tt2501792,Searching for Venice,Movie,Drama,2015,,NO DATA,"['tt2501792', 'Berkeley Clayborne', 'Kylan Conroy', 'Edy Cullen', 'Patrick Cunningham', 'Kelly Davis Wilson', 'Ariana Dziedzic', 'Joe Gandurski', 'Cece Hagen', 'Ashley Lobo', 'Irene Marquette']",[],"The young generation of an endearingly eccentric family are struggling to find happiness and meaning when a family tragedy forces them all to an uncle's vineyard. As the family reconnects, lives are changed forever.",NO DATA
tt2504514,Patric,Movie,Drama,2015,,NO DATA,"['tt2504514', 'Marisa Brown', 'Barney Fitzpatrick', 'Brian Gallagher', 'Anthony Lawton', 'Damian Muziani', 'Franklin Ojeda Smith', 'Ashley Sumner', 'Maureen Torsney-Weir', 'Winter Williams']",[],"A Technophobe angling correspondent, Patric, occupies an off-kilter reality counting raindrops with his family of cats. As social media threatens his career, a dark and thrilling flirtation with a Swiss model begins.",NO DATA
tt2503768,The Mourning,Movie,Drama,2015,4.0,NO DATA,"['tt2503768', 'Michael Rene Walton', 'Louis Mandylor', 'Dominique Swain', 'Sally McDonald', 'Kinga Philipps', 'Larry Hankin', 'Peter Dobson', 'Bob Spillman', 'Frank Krueger', 'Eda Mendell']",[],"20 years after going MIA in Desert Storm, Aaron returns home under mysterious conditions, not having aged since his disappearance, and must reestablish relationships with loved ones before an imminent return to an ambiguous other-worldly existence.",106
tt2503954,Broken Horses,Movie,Drama,2015,4.0,NO DATA,"['tt2503954', 'Henry Shotwell', 'Thomas Jane', 'Nicholas Neve', 'Sean Patrick Flanery', 'Lenny von Dohlen', 'Tom Virtue', ""Vincent D'Onofrio"", 'Sadie Alexandru', 'Greg Serano', 'Anton Yelchin']",[],"The bonds of brotherhood, the laws of loyalty, and the futility of violence in the shadows of the US Mexico border gang wars.",NO DATA
tt2503944,Burnt,Movie,Drama,2015,11.0,NO DATA,"['tt2503944', 'Bradley Cooper', 'Sienna Miller', 'Daniel Brühl', 'Riccardo Scamarcio', 'Omar Sy', 'Sam Keeley', 'Henry Goodman', 'Matthew Rhys', 'Stephen Campbell Moore', 'Emma Thompson']",[],"Adam Jones (Bradley Cooper) es chef que destruyó su carrera con drogas y un comportamiento sobervio. Al recuperarse, vuelve a Londres, dispuesto a redimirse liderando un restaurante de primera que puede conseguir tres estrellas Michelin.",NO DATA
tt2510220,Redemption Night,Movie,Drama,2015,4.0,NO DATA,"['tt2510220', 'Sharifah Amani', 'Azman Hassan', 'Akihiro Hiyama', 'Bront Palarae']",[],"One day, Tatsumi, who has lost both his job and family, receives an airmail from Malaysia. Inside of it are a photograph of his little brother who has been missing for years and a letter written in mysterious Arabic letters. With a building shown in the photo as a hint, Tatsumi flies to Malaysia. As roaming around, looking for a clue, he meets a prostitute called Ryn.... Leer todo",100
tt2510506,Dragonfly,Movie,Drama,2015,3.0,NO DATA,"['tt2510506', 'Andrew Tiernan', 'Wayne Norman', 'Frank Boyce', 'Shona McWilliams', 'Nick Reynolds', 'Ann Mitchell', 'Mark Wingett', 'Ramon Tikaram', 'Lucinda Rhodes Thakrar', 'Ricky Grover']",[],Some people pay a high price for the things they crave in this life.,Formato min incorrecto
tt2511216,The Scapegoat,Movie,Drama,2015,7.0,NO DATA,"['tt2511216', 'Celine Arden', 'Edward Lewis French', 'Alex Rendall', 'Siobhan Schulz']",[],"Three jewel thieves are stuck in a flat in Venice, Italy after a jewel heist goes terribly wrong. One of them will have to take the blame for this mess. But which one will it be?",86
tt2520306,Glitch,Movie,Drama,2015,7.0,NO DATA,"['tt2520306', 'Lucas Neff', 'Maiara Walsh', 'Blake Silver', 'Levi Fiehler', 'Lamorne Morris', 'Emily Wickersham', 'Ava Acres', 'Isabella Acres', 'Tim Acres', 'Dan Aho']",[],"An indie app developer struggles to navigate his friendship with a very taken girl, risking the loss of his best friend, business partner and career.",86
tt2523498,Becoming Fools,Movie,Drama,2015,1.0,NO DATA,"['tt2523498', 'Scott Owen Moore']",[],"Professional clowns partner with Guatemalan street youth to perform a grand theatrical event that honors their fallen hero, reconnects them to their lost childhood, and brings hope of a life beyond the addiction and isolation of life on the streets.",95
tt2523756,Lily & Kat,Movie,Drama,2015,3.0,NO DATA,"['tt2523756', 'Jessica Rothe', 'Hannah Murray', 'Jack Falahee', 'David Wilson Barnes', 'Mimi Gianopulos', 'Scott Evans', 'Alesandra Assante', 'Chris Riggi', 'Hazel Arroyo', 'Areg Barsegian']",[],"Inseparable best friends struggle to make the best of their last few days together, savoring the city nightlife with an enigmatic artist one of them takes a liking for.",Formato min incorrecto
tt2523832,A Girl Like Her,Movie,Drama,2015,3.0,NO DATA,"['tt2523832', 'Lexi Ainsworth', 'Hunter King', 'Jimmy Bennett', 'Amy S. Weber', 'Stephanie Cotton', 'Mark Boyd', 'Christy Engle', 'Jon W. Martin', 'Madison Deadman', 'Anna Spaseski']",[],"Jessica Burns enlists the help of her best friend, Brian, in order to document the relentless harassment she's received from her former friend, Avery Keller, one of South Brookdale High School's most popular students.",Formato min incorrecto
tt2531120,Trafficker,Movie,Drama,2019,5.0,NO DATA,"['tt2531120', 'Amanda Donohoe', 'Om Puri', 'Kelly B. Jones', 'Vithaya Pansringarm', 'Krystal Vee', 'Sahajak Boonthanakit', 'Miles Meili', ""Eoin O'Brien"", 'Charlie Ruedpokanon', 'Greg Garcia']",[],"When a young Vietnamese-Australian thug botches a gangland assassination and runs into serious debt with his triad, his younger brother is forced to embark on a harrowing drug run from Vietnam to pay off the mob bosses.",90
tt2531052,Amanda Ripley,Movie,Drama,2015,12.0,NO DATA,"['tt2531052', 'Angel Blanco', 'Javier de la Torre', 'Paco Maldonado', 'Moreno-Fuentes']",[],"After being abandoned, Amanda tries Aldo to comeback. Aldo's mother tells her that he has a new lover: a greedy and mean antiquarian - Ignacio Sepúlveda, Amanda's childhood friend tries at the same time to visit Aldo to convince him.",NO DATA
tt2534634,Miekkailija,Movie,Drama,2015,3.0,NO DATA,"['tt2534634', 'Märt Avandi', 'Ursula Ratasepp', 'Hendrik Toompere Jr.', 'Liisa Koppel', 'Joonas Koff', 'Egert Kadastu', 'Ann-Lisett Rebane', 'Elbe Reiter', 'Jaak Prints', 'Kirill Käro']",[],Un esgrimista campeón huye del servicio secreto soviético y se encuentra inspirando a los escolares estonios para comenzar a practicar esgrima.,NO DATA
tt2543490,Lover's Game,Movie,Drama,2015,,NO DATA,"['tt2543490', 'Meredith Crawford Collins', 'Blaine Pennington', 'Miranda McCauley', 'Paul Sheehan', 'Teniece Divya Johnson', 'Andrew Nielson', 'Nadia Serantes', 'Marianne Gagrica', 'Amin Fernandez', 'Yael Shavitt']",[],"Vincent and Annabella are a wealthy couple living in New York City. They want to have a child but soon discover that children will never be a possibility for them. Soon, their ambitions for a family begin to affect their marriage. Annabella then meets Gillian; a seductive, exotic lesbian painter who changes her whole perspective on her future plans with Vincent. Soon,... Leer todo",108
tt2548070,The Paper Boat,Movie,Drama,2021,4.0,NO DATA,"['tt2548070', 'Daniel Wilkinson', 'Linda Bella', 'Steven Eckholdt', 'Burt Culver', 'Rachel Speth', 'Bridget Bowes', 'Kyle Nicholson', 'Michael Q. Schmidt', 'Susy Diab', 'Ada Marinelli']",[],"A brother and sister struggle with his health, an actress tries to stop prostitution, and an immigrant looks for a future as his girlfriend slips into insanity. A tragic accident brings them all together and reveals how they are connected.",NO DATA
tt2544766,Michiel de Ruyter,Movie,Drama,2015,1.0,NO DATA,"['tt2544766', 'Frank Lammers', 'Sanne Langelaar', 'Barry Atsma', 'Lieke van Lexmond', 'Egbert Jan Weeber', 'Rutger Hauer', 'Charles Dance', 'Derek de Lint', 'Tygo Gernandt', 'Filip Peeters']",[],"Cuando la joven República Holandesa sufre el ataque de Inglaterra, Francia y Alemania, el país se queda al borde de la guerra civil. Solo un hombre podrá liderar la armada danesa y ese hombre es Michiel de Ruyter.",NO DATA
tt2545692,Brush with Danger,Movie,Drama,2015,9.0,NO DATA,"['tt2545692', 'Ken Zheng', 'Livi Zheng', 'Nikita Breznikov', 'Norman Newkirk', 'Michael Blend', 'Stephanie Hilbert', 'John McFarland', 'Kathleen Boushey', 'Rob Bradstreet', 'Ben Andrews']",[],"A painter, a fighter, both artists in their own way. Brother and sister, forced to flee their home, arrive at Seattle inside a shipping container. Trying to make their way in a new world the pair struggle to survive. Until, one day, an art dealer takes an interest in the sister's painting, and the pair find themselves living a dream come true. The sister loses herself... Leer todo",Formato min incorrecto
tt2547172,Larry Gaye: Renegade Male Flight Attendant,Movie,Drama,2015,6.0,NO DATA,"['tt2547172', 'Mark Feuerstein', 'Jessica Lowndes', 'Stanley Tucci', 'Christopher Fitzgerald', 'Taye Diggs', 'Molly Millard', 'Danny Pudi', 'Michael Cotter', 'Staci Roberts Steele', 'Kenny Ellis']",[],A self-anointed 'renegade' male flight attendant must save the day when the airline he works for tries to eliminate flight attendants as a cost-cutting measure.,Formato min incorrecto
tt2550858,Antikaci,Movie,Drama,2015,7.0,NO DATA,"['tt2550858', 'Ertan Gulec', 'Didem Baylan', 'Ovul Kocaman', 'Tuna Ata', 'Kaan Yasemin', 'Candan Eren', 'Sertac Ataman', 'Aclan Bates', 'Oya Neva Demirkol', 'Elif Kavlakoglu']",[],"Love who you love, when you can, while you can, as much as you can.",84
tt2553928,Better Half,Movie,Drama,2015,8.0,NO DATA,"['tt2553928', 'Jaimie Fauth', 'Grant Landry', 'Avie Weber', 'Matt Orduna', 'Malika Williams', 'Steve Hasley', 'Emily Adams', 'Kevin Held', 'Amin El Gamal', 'Daniel Rhyder']",[],"For years, Tony and Leo have been a happy couple. They had always talked about having a child... someday. So when a sickly infant is abandoned at a local hospital, Tony sees it as a sign. Suddenly, Leo is confronted with making good on his promise to start a family; he must face his deep-seeded fears of being a father, or risk losing Tony altogether.",110
tt2555652,Forever,Movie,Drama,2015,9.0,NO DATA,"['tt2555652', 'Deborah Ann Woll', 'Luke Grimes', 'John Diehl', 'Rhys Coiro', 'Jill Larson', 'Ioan Gruffudd', 'Seth Gabel', 'Shanola Hampton', 'Gill Dennis', 'Jake McLaughlin']",[],Alice is a young investigative reporter. She suffers a sorrowful loss but finds an enigmatic commune where she starts to find her will to live and love again.,110
tt2555736,The Second Best Exotic Marigold Hotel,Movie,Drama,2015,3.0,NO DATA,"['tt2555736', 'Judi Dench', 'Maggie Smith', 'Bill Nighy', 'Dev Patel', 'Danny Mahoney', 'David Strathairn', 'Celia Imrie', 'Ronald Pickup', 'Diana Hardcastle', 'Shubhrajyoti Barat']",[],"Como en el Hotel Marigold solo queda una vacante libre, lo que supone una difícil situación de alojamiento para dos recién llegados, Sonny Kapoor se lanza a cumplir su sueño: abrir un segundo hotel.",NO DATA
tt2557258,The Healer,Movie,Drama,2017,6.0,NO DATA,"['tt2557258', 'Óscar Jaenada', 'Velibor Topic', 'Melia Kreiling', 'Bill Paterson', 'Kae Alexander', 'Alix Wilton Regan', 'Celyn Jones', 'Adam Leese', 'Adjoa Andoh', 'Shammi Aulakh']",[],"Alberto, a Colombian migrant working illegally in London to pay for his mother's operation back home, becomes convinced that God has a destiny marked out for him. This is a taught, poignant thriller with a captivating supernatural twist.",90
tt2556936,No Men Beyond This Point,Movie,Drama,2015,1.0,NO DATA,"['tt2556936', 'Patrick Gilmore', 'Bronwen Smith', 'Tara Pratt', 'Kristine Cofsky', 'Adanna Avon', 'Morgan Taylor Campbell', 'Lilac Adams', 'Mackenzie Craddock', 'Dakota Guppy', 'Lorynne Machado']",[],"In a world where women have become able to ""self-fertilise"" and are no longer giving birth to males, a quiet, unassuming housekeeper named Andrew Myers finds himself at the center of a battle to keep men from going extinct.",80
tt2550170,20 Years of Madness,Movie,Drama,2016,4.0,NO DATA,"['tt2550170', 'Jerry White Jr.', 'Joe Hornacek', 'John Ryan', 'Jesus Rivera', 'Matt Zaleski', 'Rachel Angelini', 'Timothy Atwood', 'Rob Baum', 'Andrea Brandt', 'Molly Brodak']",[],"When the eccentric cast of a mid-90s Public Access show in Detroit reunite after 20 years to make a new episode, they are forced to take a hard look at their relationships and reconcile their teenage dreams with the realities of adulthood.",80
tt2551544,A New York Love Story,Movie,Drama,2015,2.0,NO DATA,"['tt2551544', 'Richard Short', 'Apolla Echino', 'Siobhan Flynn', 'Miguel Pinzon', 'Courtney Reed', 'Thomas Beaudoin', 'Sarah Braverman', 'Tyrone Marshall Brown', 'Olivia Cipolla', 'Aaron Costa Ganis']",[],"An anti-love story about Delphine, a dancer living in New York. Despite her best intentions to keep her relationships casual and simple in the infamous city, she falls hard for a sexy and charismatic painter. Although he is smitten with her, The Painter continues an array of sexual relationships, unable to concentrate solely on Delphine, despite the fact that he is fa... Leer todo",90
tt2554274,Crimson Peak,Movie,Drama,2015,10.0,NO DATA,"['tt2554274', 'Mia Wasikowska', 'Jessica Chastain', 'Tom Hiddleston', 'Charlie Hunnam', 'Jim Beaver', 'Burn Gorman', 'Leslie Hope', 'Doug Jones', 'Jonathan Hyde', 'Bruce Gray']",[],"Tras una tragedia familiar, una aspirante a escritora se encuentra dividida entre el amor por su amigo de la infancia y la tentación de un misterioso forastero. Tratando de escapar de los fantasmas de su pasado, es arrastrada a una casa que respira, sangra y recuerda.",NO DATA
tt2563706,Smalltown,Movie,Drama,2016,,NO DATA,"['tt2563706', 'Nathan Ross Murphy', 'Tori Keeling', 'Edward Dublin', 'Devan Reed', 'Sarah Clark', 'Taylor Houston', 'Amanda Gouveia', 'Wm. Chip Adams']",[],A recent college graduate in the midst of depression must decide if he will pursue his passion or stick to the protective bubble of his small town life.,109
tt2566644,Seoul Searching,Movie,Drama,2017,12.0,NO DATA,"['tt2566644', 'Cha In-pyo', 'Justin Chon', 'Jessika Van', 'Teo Yoo', 'Esteban Ahn', 'Rosalina Lee', 'Byeol Kang', 'Albert Kong', 'Crystal Kay', 'Sue Son']",[],"In 1986, a group of foreign-born Korean teenagers attend a summer camp in South Korea.",109
tt2565982,Carga Sellada,Movie,Drama,2016,2.0,NO DATA,"['tt2565982', 'Gustavo Sánchez Parra', 'Gonzalo Cubero', 'Luis Bredow', 'Fernando Arze Echalar', 'Daniela Lema', 'Marcelo Nina', 'Jorge Hidalgo', 'Agar Delos', 'Prakriti Maduro', 'Hugo Francisquini']",[],"A crew of hapless police and a stowaway make their way across Bolivia in an aged train, searching for a place to dump highly toxic cargo.",107
tt2566994,Saber que te he buscado,Movie,Drama,2015,12.0,NO DATA,"['tt2566994', 'David Mondaca', 'Teresa dal Pero', 'Jorge Ortiz Sánchez', 'Sonia Lazo', 'Luis Bredow', 'Santiago Rozo']",[],,NO DATA
tt2567688,Johnny Walker,Movie,Drama,2015,5.0,NO DATA,"['tt2567688', 'Udo Kier', 'Lynn Bari', 'Eric Godon', 'Turhan Bey', 'Astrid Whettnall', 'Christelle Cornil', 'Piet De Praitere', 'Cherise Silvestri', 'Bruce Geduldig', 'Michel Schillaci']",[],A has-been Hollywood director is forced to confront his own fears in a Dostoevskian moral fable.,85
tt2573238,Rocco tiene tu nombre,Movie,Drama,2015,5.0,NO DATA,"['tt2573238', 'Patrizia Barbieri', 'José María Blanco', 'Leonardo Brunelli', 'Xavier Capdet', 'Valentina Carnelutti', 'Andrea Concotelli', 'Emanuele Concotelli', 'Esther Cuspinera', 'Alberto Esparza', 'Marina Esteve']",[],Something breaks the routine of a man: a stranger is installed in home... says his name is Rocco. Who is this guy?,94
tt2572030,Pass the Light,Movie,Drama,2015,2.0,NO DATA,"['tt2572030', 'Cameron Palatas', 'Dalpre Grayer', 'Alexandria DeBerry', 'Colby French', 'Jon Gries', 'Charlie DePew', 'Brendon Eggertsen', 'Keith Loneker', 'Milena Govich', 'Lawrence Saint-Victor']",[],"The story of Steve Bellafiore, a 17-year-old high school senior who decides to run for Congress in order to protect the faith that he so loves.",112
tt2577874,YouTube Bazaar,Movie,Drama,2015,11.0,NO DATA,"['tt2577874', 'Daniel Gheorghe Alexe']",[],"The film is submerging in the world of YouTube and internet amateur-made-films posting through the eyes of Bahoi, one of Romania's most viewed filmmakers. The first part of the movie deeply analysis his films by going to his hometown village in Romania, Peninsula, and meeting Bahoi's most famous characters. Also through Bahoi's own words we are trying to find out why ... Leer todo",99
tt2580382,The Survivalist,Movie,Drama,2016,2.0,NO DATA,"['tt2580382', 'Martin McCann', 'Mia Goth', 'Olwen Fouéré', 'Douglas Russell', 'Andrew Simpson', 'Ryan McParland', 'Hussina Raja', 'Ciaran Flynn', 'Sean Doupe', 'Jeremy Martin']",[],"En una época de hambre, un sobreviviente vive de una pequeña tierra escondida en lo profundo del bosque. Dos mujeres que buscan comida y refugio descubren su granja, lo que amenaza su existencia.",Formato min incorrecto
tt2575290,Train Station,Movie,Drama,2017,2.0,NO DATA,['tt2575290'],[],NO DATA,NO DATA
tt2582496,Me and Earl and the Dying Girl,Movie,Drama,2015,7.0,NO DATA,"['tt2582496', 'Thomas Mann', 'RJ Cyler', 'Olivia Cooke', 'Nick Offerman', 'Connie Britton', 'Molly Shannon', 'Jon Bernthal', 'Matt Bennett', 'Katherine Hughes', 'Masam Holden']",[],"Greg, un estudiante que pasa la mayoría del tiempo haciendo parodias de películas clásicas con su compañero Earl, cambia su forma de pensar cuando entabla amistad con una compañera de clase que acaba de ser diagnosticada de cáncer.",NO DATA
tt2582502,Fathers & Daughters,Movie,Drama,2015,10.0,NO DATA,"['tt2582502', 'Russell Crowe', 'Amanda Seyfried', 'Aaron Paul', 'Diane Kruger', 'Quvenzhané Wallis', 'Bruce Greenwood', 'Janet McTeer', 'Kylie Rogers', 'Jane Fonda', 'Octavia Spencer']",[],"Un escritor ganador del Pulitzer se enfrenta a ser viudo y padre tras una crisis mental, mientras que, 27 años después, su hija adulta lucha por forjar sus propias conexiones.",NO DATA
tt2577668,Prep School,Movie,Drama,2016,7.0,NO DATA,"['tt2577668', 'Carly Schroeder', 'Taylor Lambert', 'Ben Bellamy', 'Austin Scott', 'Stephen Brookins', 'Stewart Finlay-McLennan', 'Clayton Rohner', 'Lewis Sims', 'J. Norman Riley', 'Hannah Marks']",[],"When the star player of an elite prep school rugby team suffers an emotional collapse, his friends and teammates respond in their own ways, ranging from heroic to horrifying.",Formato min incorrecto
tt2577636,Chatter,Movie,Drama,2018,5.0,NO DATA,"['tt2577636', 'Richard Hatch', 'Alison Haislip', 'Brady Smith', 'Sarena Khan', 'Tohoru Masamune', 'P.J. Marshall', 'Laura Niles', 'Ashley Palmer', 'Pete Capella', 'Derrick Redford']",[],"While monitoring Internet traffic for the Department of Homeland Security, Agent Martin Takagi comes across the intimate video chats of a couple, temporarily living in different parts of the world, who begin to discover their new home is haunted.",Formato min incorrecto
tt2583866,Eso que llaman amor,Movie,Drama,2015,9.0,NO DATA,"['tt2583866', 'Barbara Aguirre', 'Irene Almus', 'Laura Cymer', 'Lucas Ferraro', 'Verónica Intile', 'Diana Lamas', 'Matías Marmorato', 'Gustavo Pardi', 'Carlos Portaluppi', 'Roberto Vallejos']",[],"The stories of Zara, Verónica and Mora intersect and intertwine through memories, places, and people in common. Love is not always the livelihood of a couple, even when all are built in their name. A movie about the disasters that human beings can make in the name of love, in an unequal and unjust world, where women are unfailingly damaged and broken.",NO DATA
tt2585160,Gluckauf,Movie,Drama,2015,1.0,NO DATA,"['tt2585160', 'Johan Leysen', 'Vincent van der Valk', 'Ali Ben Horsting', 'Tygo Bussemakers', 'Nico de Vries', 'Joy Verberk', 'John Paulus', 'Bart Slegers', 'Raymond Kurvers', 'Dennis Költgen']",[],"In the impoverished southern Dutch province of Limburg, the bond between a former mine worker and his only son is put to the test as the latter takes it upon himself to pay his father's debts to a local gangster.",102
tt2584058,Neptune,Movie,Drama,2015,5.0,NO DATA,"['tt2584058', 'Jane Ackermann', 'William McDonough III', 'Tony Reilly', 'Maureen Butler', 'Dylan Chestnutt', 'Jeffrey Charles Day', 'Chip Emmons', 'Bob Greeley', 'Janet Lynch', 'Christine Louise Marshall']",[],"Set in the late 1980s on an island off the coast of Maine, an orphan girl raised by the church becomes obsessed by the disappearance of a classmate, and her haunted dreams and visions propel her to push past her sheltered life.",101
tt2580658,La scelta,Movie,Drama,2015,4.0,NO DATA,"['tt2580658', 'Ambra Angiolini', 'Raoul Bova', 'Valeria Solarino', 'Michele Placido', 'Manrico Gammarota', 'Monica Contini', 'Geno Diana', 'Marcello Catalano', 'Mejdi El Euchi', 'Vito Signorile']",[],A childless couple struggle in the aftermath of a sexual assault leaves the woman pregnant.,86
tt2586118,D'Ardennen,Movie,Drama,2016,2.0,NO DATA,"['tt2586118', 'Kevin Janssens', 'Jeroen Perceval', 'Veerle Baetens', 'Jan Bijvoet', 'Viviane de Muynck', 'Sam Louwyck', 'Peter Van den Begin', 'Eric Godon', 'Rachid El Ghazaoui', 'Nico Sturm']",[],"A brutal home-jacking by two brothers goes hopelessly wrong, and one of them goes to prison. Four years later, his brother tries to help him get his life back on track.",86
tt2591692,Boiling Pot,Movie,Drama,2015,9.0,NO DATA,"['tt2591692', 'Danielle Fishel', 'Louis Gossett Jr.', 'M. Emmet Walsh', 'Keith David', 'Davetta Sherwood', 'Ibrahim Ashmawey', 'Sayed Badreya', 'John Heard', 'Corrin Evans', 'Ashley Switzer']",[],"On a college campus in modern America, ideas that have long been neglected as ""issues of the past"" emerge as racial tensions and frictions grow between different student groups.",Formato min incorrecto
tt2596196,The Black Sea,Movie,Drama,2015,1.0,NO DATA,"['tt2596196', 'Erin McGarry', 'Corrina Repp', 'Cora Benesh', 'Bill Sebastian', 'Joe Von Appen', 'Matt Sipes']",[],Five friends go to a beach house on the Oregon coast for the weekend. Allison is clearly troubled by something but the others don't say a word or intervene. And then she vanishes.,75
tt2599938,Burst Theory,Movie,Drama,2019,5.0,NO DATA,"['tt2599938', 'Joseph Scott Anthony', 'Lisa Mueller', 'Ralph Lister', 'David Gries', 'Dustin Wilfert', 'Mark Boyd', 'Sherryl Despres', 'Jeffrey Goodrich', 'Michael J. Harrold II', 'John Landwerlen']",[],"A scientist at a remote facility questions the nature of a bird flu vaccine his team is studying when a colleague unexpectedly contracts the virus under suspicious circumstances. Soon, he discovers his worst nightmares are about to become reality - his life, and perhaps the lives of millions, are hanging by a thread. Hunting for the truth, he spirals into a grim consp... Leer todo",87
tt2597668,The Third Act,Movie,Drama,2015,11.0,NO DATA,"['tt2597668', 'Elizabeth Williams Grayson', 'Edd Robinson', 'Doug Nydick', 'Neill Fleeman', 'Keisha Barber', 'David Anthony Wright', 'Susan McMullen', 'Meredith Tingen', 'Reid Dalton', 'Bob Durante']",[],"Katie Gordon met Tom Nichols while playing in summer stock at the Red Bridge Playhouse in Connecticut. Twelve years later, Katie, by then a well-known actress, made her play for Tom. They began an intense affair that ends disastrously. A dozen years after their breakup and again desperately unhappy with her life, Katie encounters Tom a third time when he returns to Re... Leer todo",50
tt2602338,Malady,Movie,Drama,2017,7.0,NO DATA,"['tt2602338', 'Roxy Bugler', 'Kemal Yildirim', 'Jill Connick', 'Gary Cross', 'Ellen Carter', 'Nicola Wright']",[],"Explores the strength of love when it's built out of grief and is challenged with shame, guilt and secrets.",Formato min incorrecto
tt2603600,Voiceless,Movie,Drama,2015,,NO DATA,"['tt2603600', 'Rusty Joiner', 'Jocelyn Cruz', 'Victoria Gates', 'James Russo', 'Paul Rodriguez', 'Susan Moses', 'Taylor Coleman', 'Jerry Perna', 'Jeremiah De Moss', 'Kenneth McGregor']",[],A reserved young war veteran moves to North East Philadelphia to start an inner-city community outreach--and puts his life on the line to stand against an abortion clinic that moves across the street from his building.,Formato min incorrecto
tt2608030,Loaded,Movie,Drama,2015,3.0,NO DATA,"['tt2608030', 'Patrick John Flueger', 'Kumail Nanjiani', 'Andrew W. Walker', 'Alexandra Holden', 'Robert R. Shafer', 'Michael Shamus Wiles', 'Natalie Distler', 'Riya Ray', 'Courtenay Taylor', 'Kevin Fry']",[],Tres amigos de la escuela secundaria se reúnen para un viaje inesperado a la rehabilitación.,Formato min incorrecto
tt2613458,Khoya,Movie,Drama,2016,6.0,NO DATA,"['tt2613458', 'Rupak Ginn', 'Ravi Khanvilkar', 'Stephen McHattie', 'Anand Parmar', 'Vipin Sharma']",[],"After the death of his adopted mother, a Canadian man travels to rural India desperately searching for the birth family he's never known and seeking to unravel the mystery surrounding his adoption.",82
tt2612138,Everybody Gets Screwed Here,Movie,Drama,2015,3.0,NO DATA,"['tt2612138', 'Heerok Das', 'Asxem Dlean', 'Sandeep Ghosh', 'Shahruk Khan', 'Sanjay Nath', 'Pavitra Sarkar', 'Eden Shyodhi', 'Teeshay', 'Varun Thakur', 'Yoshika Verma']",[],"Three young urban Indians (representative of the rich, middle and lower socio-economic classes) realise life's ultimate truth when a benign road trip goes bad due to reasons that are of their own making.",82
tt2611160,A Beautiful Now,Movie,Drama,2016,9.0,NO DATA,"['tt2611160', 'Abigail Spencer', 'Cheyenne Jackson', 'Collette Wolfe', 'Elena Satine', 'Sonja Kinski', 'Patrick Heusinger', 'Guy Burnet', 'John Patrick Amedori', 'Hana Hayes', 'Deborah Geffner']",[],A beautiful dancer balances on the razor's edge between reality and fantasy as she asks her friends to help her figure out the passions and relationship that have shaped who they are and who they will become.,82
