tt2172284,Doorways,Movie,Drama,2015,1.0,NO DATA,"['tt2172284', 'Steven Murphy', 'Jonathan Ciardini', 'Todd Von Joel', 'Maria Theresa Rodriguez', 'Jordan Mooney', 'Paul Moss', 'Caroline Piggott', 'Andy Evason', 'Danny Cutler', 'Christopher Brand']",[],A young man embarks on a search for his masculinity by becoming a bouncer. He meets Craig who has been doing it for years and it is all that he knows. The two embark on a story of self-discovery in which they both uncover secrets about themselves; and the young bouncer soon realises there are many more elements to being a 'man' than he thought as their journey spirals... Leer todo,102
tt2176778,From Ashes,Movie,Drama,2015,7.0,NO DATA,"['tt2176778', 'Quinton Greene', 'Christopher Hunt', 'Mariah Francis', 'Zachary Mull', 'Anna Lasbury', 'Isaiah Butler', 'Paul Mishler', 'Jamey Young', 'Brenda Jo Reutebuch', 'Joseph Mervis']",[],Forgiveness at a price.,110
tt2179734,A Life Not to Follow,Movie,Drama,2017,7.0,NO DATA,"['tt2179734', 'Michael Capozzi', 'Fiore Leo', 'Molly Kay', 'David Graziano', 'John Martellucci', 'Erica Derrickson', 'William Bloomfield', 'Johnny Cammarata', 'Jaimie Tucker', 'Geno Mirabella']",[],"A hitman, a gangster and a private detective share an interlacing narrative about common human frailty.",Formato min incorrecto
tt2181012,Canadian Muscle,Movie,Drama,2015,2.0,NO DATA,"['tt2181012', 'Derek Dowling', 'Shaden Dehaan', 'Alex Lyon', 'Jonathan Piers', 'Jonathan McFaul', 'Andrew Thomas Hopkins', 'Michael Bruce Horn', 'Andrew Shepherd', 'Gregory Shepherd', 'Kayla London']",[],"When high school ends, high octane summer adventures are just beginning!",Formato min incorrecto
tt2181814,Im Sommer wohnt er unten,Movie,Drama,2015,10.0,NO DATA,"['tt2181814', 'Sebastian Fräsdorf', 'Alice Pehlivanyan', 'Godehard Giese', 'Karin Hanczewski', 'William Peiro']",[],"Matthias is the younger of the two Landberg brothers. While his brother David has followed in their father's footsteps on the path to success, Matthias lives his life far away from ambitions and career options. He shares his family's holiday home at the French Atlantic coast with his girlfriend Camille and her 6-year-old son Etienne from a previous relationship. Toget... Leer todo",100
tt2183978,Damaged,Movie,Drama,2015,9.0,NO DATA,"['tt2183978', 'Nicholas Burton', 'Kabir Singh', 'Maha Wilson', 'Matthew Clarke', 'Dean Kyrwood', 'Amanda Jermyn', 'Johnny Brady', 'Logan Michael Byrnes', 'Christian Anthony', 'Joshua Armitage']",[],Damaged is the endearing tale of a friendship in the most remarkable of circumstances.,97
tt2184335,Urban Hymn,Movie,Drama,2016,9.0,NO DATA,"['tt2184335', 'Shirley Henderson', 'Letitia Wright', 'Isabella Laughland', 'Ian Hart', 'Steven Mackintosh', ""Caroline O'Neill"", 'Shaun Parkes', 'Matthew Steer', 'Jack McMullen', 'Jamie Taylor']",[],"""Urban Hymn"" follows troubled teenage girl Jamie, who possesses an amazing singing voice, and Kate, an inspiring and unconventional social worker who encourages her to use it.",97
tt2187071,Seeking Dolly Parton,Movie,Drama,2015,5.0,NO DATA,"['tt2187071', 'Kacey Clarke', 'Anya Monzikova', 'Michael Worth', 'Paula Alder', 'Alex Ballar', 'Raffaello Degruttola', 'Shane Fahy', 'Jean Franco', 'Lois Stewart', 'Max Tadman']",[],"When Charlie and her girlfriend Cerina decide to have a baby together, the idea of using Cerina's ex-boyfriend Josh as the live-in donor turns an easy on-paper idea into a much more challenging event.",97
tt2187139,The Playbook,Movie,Drama,2015,7.0,NO DATA,"['tt2187139', 'Mick Preston', 'Harry Borland', 'Kath Gordon', 'Luc Longley', 'Dennis Coard', 'Darran Scott', 'Lauren Clair', 'Lloyd Edwards', ""Keely O'Halloran"", 'Cate Commisso']",[],One family learns that forgiveness is paramount.,97
tt2186848,Landmine Goes Click,Movie,Drama,2015,6.0,NO DATA,"['tt2186848', 'Sterling Knight', 'Spencer Locke', 'Kote Tolordava', 'Dean Geyer', 'Nana Kiknadze', 'Helen Nelson', 'Giorgi Tsaava', 'Nika Apriashvili', 'Elene Bezarashvili']",[],"Atrapado sobre una mina terrestre armada, un turista estadounidense se ve obligado a mirar impotente mientras su novia es aterrorizada y agredida brutalmente.",97
tt2188901,Ochentaisiete,Movie,Drama,2015,2.0,NO DATA,"['tt2188901', 'Andres Alvares', 'Andres Alvarez', 'Nicolás Andrade', 'Estefano Bajak', 'Jessica Barahona', 'Andrés Crespo', 'Camilo Luzuriaga', 'Michel Noher', 'Ricardo Ortiz', 'Francisco Perez']",[],"Pablo, Andres and Juan, get into their biggest teenager adventure, when Juan decides to run away from home. He is not willing to go back because his father, an old fashioned policeman, wants to change him to a military school. After a car accident, Pablo flees, never to return. 15 years later, he comes back to Ecuador to face what he left in the past. OCHENTAYSIETE is... Leer todo",88
tt2188860,Bella e perduta,Movie,Drama,2015,11.0,NO DATA,"['tt2188860', 'Tommaso Cestrone', 'Sergio Vitolo', 'Gesuino Pittalis', 'Elio Germano', 'Claudio Casadio', 'Anna Redi', 'Raffaele Montesarchio', 'Teresa Montesarchio', 'Gerardo Attanasio', 'Antonio Delise']",[],"The foolish servant Pulcinella is sent from the depths of Mt. Vesuvius to present-day Campania to honor the last wishes of the poor shepherd Tommaso: his mission is to save a young buffalo called Sarchiapone. Pulcinella finds the animal at the former royal palace of Carditello, where Tommaso had looked after the ruined Bourbon estate in the heart of the Land of Fires.... Leer todo",NO DATA
tt2190467,Safelight,Movie,Drama,2016,4.0,NO DATA,"['tt2190467', 'Evan Peters', 'Juno Temple', 'Christine Lahti', 'Kevin Alejandro', 'Jason Beghe', 'Ariel Winter', 'Will Peltz', 'Don Stark', 'Joel Gretsch', 'Ever Carradine']",[],A teenage boy and girl discover a renewed sense of possibility as they go on a road trip to photograph lighthouses along the California coast.,NO DATA
tt2191765,Un moment d'égarement,Movie,Drama,2015,6.0,NO DATA,"['tt2191765', 'Vincent Cassel', 'François Cluzet', 'Lola Le Lann', 'Alice Isaaz', 'Louka Meliava', 'Noémie Merlant', 'Romain Apelbaum', 'Philippe Nahon', 'François Bergoin', 'Annelise Hesme']",[],"Dos amigos van de vacaciones con sus respectivas hijas y se acaban encontrando en una situación embarazosa. Un remake de la película francesa de 1977 ""Un moment d'égarement"".",NO DATA
tt2193356,The Return of God,Movie,Drama,2015,8.0,NO DATA,"['tt2193356', 'Paul Dante', 'S. William Wallace', 'Luke Dante', 'Jessica Jacklin', 'Ryan Porte', 'Kirsten Walker', 'Candace Smith', 'Dan Dando', 'Tina Brasil', 'Charlie Jacklin']",[],"After an extended absence, GOD returns to earth where he hires a taxi and its driver for an overnight tour. During this tour he encounters his ex-wife, the devil. The two of them strike a bet which puts the fate of mankind's future on the line.",115
tt2195552,The Elevator,Movie,Drama,2019,6.0,NO DATA,"['tt2195552', 'Burt Young', 'Caroline Goodall', 'James Parks', 'Sara Lazzaro', 'Niccolò Senni', 'Katia Greco', 'Katie McGovern', 'Gianfranco Terrin', 'Paolo Borzì', 'Daniel Mba']",[],"A disturbing psychological thriller, that engages the audience to the point that it is always caught off guard, thus changing the point of view of the two main performers.",NO DATA
tt2198281,Window of Opportunity,Movie,Drama,2015,,NO DATA,"['tt2198281', 'Oliver Muirhead', 'Jack Maxwell', 'Phil Proctor', 'Kym Jackson', 'Ty Granderson Jones', 'Rayna Tharani', 'Annie Abbott', 'Maude Bonanni', 'Johnny Crear', 'Michael Gaglio']",[],"A suspenseful dark comedy/thriller about greed and the corporate world. CEO - Roger Sizemore and his toady CFO, Carl Everett, invite a young hotshot executive, Peter Miller, up to a remote cabin for a weekend of drinking and debauchery, but it is clear that Roger and Carl are setting Peter up to take the fall for their own financial shenanigans. When a couple of call ... Leer todo",99
tt2199772,And We Wait,Movie,Drama,2015,8.0,NO DATA,"['tt2199772', 'Nikki Estridge', 'Lindsay-Elizabeth Hand', 'Tanis Parenteau', 'Dina Cataldi', 'Devon Marie Saunders', 'Kendra North', 'Anne Marie Nestor', 'Angelique Berry', 'Morgan Monnig', 'Daniela Malave']",[],"The story of the women of Vietnam. As a follow-up film to The Battle of Ripcord (2013), we take an intimate look into the lives of those left behind, outcast from their friends, families and communities as the world moved on. The women of Vietnam were in waiting while their husbands, brothers, sons and fathers fault and died in a distant land. During a time of social ... Leer todo",NO DATA
tt2201532,The Adventures of Beatle,Movie,Drama,2015,12.0,NO DATA,"['tt2201532', 'Ever Carradine', 'Michele Hicks', 'Jeffrey Dean Morgan', 'Ben Mendelsohn', 'Tony Shalhoub', 'Sarah Shahi', 'Orlando Jones', 'Ivana Milicevic', 'Brooke Adams', 'Raffaello Degruttola']",[],Detective Holt and Beatle talk about a murder with flashbacks added. Twists follow.,NO DATA
tt2202450,Hollis,Movie,Drama,2015,,NO DATA,"['tt2202450', 'Ty Fanning', 'Matt Altobelli', 'Terry Masters', 'Lance Reese', 'Rob Gallavan', 'Cassidee Vandalia', 'Kody Walker', 'Steven David Walton', 'Dylan Shelby', 'Sheridan Cravens']",[],"A small town high school graduate, pulled between duty to his family and dreams of college, must make bold decisions that not only affect him, but the destiny of those closest in his life.",94
tt2210451,Backgammon,Movie,Drama,2016,3.0,NO DATA,"['tt2210451', 'Brittany Allen', 'Noah Silver', 'Alex Beh', 'Olivia Crocicchia', 'Christian Alexander']",[],"When Lucian and Miranda are left alone in an isolated mansion for the weekend, their mutual attraction grows, as does their unease about the whereabouts of Miranda's ex-boyfriend who may be hiding somewhere in the house.",94
tt2211666,Under the Same Sun,Movie,Drama,2015,10.0,NO DATA,"['tt2211666', 'Rucha Inamdar', 'Karamveer Choudhary', 'Motilal Khan', 'Aadar Malik', 'Manish Shah', 'Taifur Shaikh']",[],"Under the Same Sun explores the mind of a confused and orphaned young man, Karim Jamal, who accidentally falls into the hands of a group of Hindu and Muslim village children in the medieval town of Jaisalmer, near the border of India and Pakistan. As the young boys welcome and nurture their injured desert guest, Karim soon discovers the true meaning of brotherhood and... Leer todo",93
tt2214114,Changing Seasons,Movie,Drama,2015,10.0,NO DATA,"['tt2214114', 'Dan Cortese', 'Jason K. Allen', 'Stephanie Champion', 'Ponda Frost', 'Casey Fuller', 'Lacy Garrison', 'Cooper Guy', 'Jet Jurgensmeyer', 'Wendy Keeling', 'Priscila Lafarga']",[],"Leaving behind a troubled past and an ex-husband in prison, Anneliese begins a fresh start. She and her son, Bryce, move out of the city to the small town of Pine Cove. While Bryce has trouble adjusting to his new school, Anneliese makes a new friend who helps her get a job and takes Bryce under his wing. But Anneliese's secret begins to unravel when her ex-husband is... Leer todo",84
tt2215673,The Timber,Movie,Drama,2015,2.0,NO DATA,"['tt2215673', 'James Ransone', 'Josh Peck', 'Elisa Lasowski', 'Mark Caven', 'William Gaunt', 'David Bailie', 'Attila Árpa', ""Shaun O'Hagan"", 'Maria Doyle Kennedy', 'Marius Florian']",[],"In the wild, snow covered gold fields of Alaska, two brothers embark on a journey to collect a bounty in a desperate attempt to save their home: but what they find along the way is more than they bargained for.",Formato min incorrecto
tt2217859,Louder Than Bombs,Movie,Drama,2016,2.0,NO DATA,"['tt2217859', 'Jesse Eisenberg', 'Gabriel Byrne', 'Isabelle Huppert', 'Devin Druid', 'Amy Ryan', 'Ruby Jerins', 'Megan Ketch', 'David Strathairn', 'Rachel Brosnahan', 'Russell Posner']",[],"Una frágil familia formada por un padre y sus dos hijos se enfrentan a los diferentes sentimientos y recuerdos de su esposa y madre fallecida, una famosa fotógrafa de guerra.",NO DATA
tt2224219,Hamlet's Ghost,Movie,Drama,2015,12.0,NO DATA,"['tt2224219', 'Glen Mac', 'Creagen Dow', 'Walker Haynes', 'John Loprieno', 'Ida Anderson', 'Barbara Niven', 'Stephanie Zimbalist', 'Dan Braun', 'Eric Gerleman', 'Brooke Newton']",[],A modern Shakespearean actor must travel back in time to confront enigmatic forces from the past and future.,NO DATA
tt2224371,Nina Nobody,Movie,Drama,2015,10.0,NO DATA,"['tt2224371', 'Philip Brodie', 'Paul Marlon', 'Tom Wilton', 'Randa Ray', 'Lee Saczak', 'Rachael Keiller', 'Rebecca Finlay-Hall', 'Evie Rolland', 'Kerri Rolland', 'Paul Duncan']",[],"When Nina leaves home, in search of her estranged father, Jim, she thinks he's going to be the answer to all her problems. But when she finds a shadow of the man she expected, it takes a journey home to understand just what it is they've both been missing.",96
tt2226630,After Words,Movie,Drama,2015,8.0,NO DATA,"['tt2226630', 'Marcia Gay Harden', 'Ron Canada', 'Yvette Thor', 'Haydee Bisval', 'Óscar Jaenada', 'Huguette Urhausen', 'Beatriz Rojas Cardenas', 'Jenna Ortega', 'Jackie Torres', 'Maria Bonilla']",[],A librarian facing a mid-life crisis travels to Costa Rica.,96
tt2226321,Dark,Movie,Drama,2015,9.0,NO DATA,"['tt2226321', 'Whitney Able', 'Alexandra Breckenridge', 'Michael Eklund', 'Brendan Sexton III', 'Benny Achour', 'Redman', 'Eunice Ahn', 'Christian D. Alvarez', 'Steel Burkhardt', 'James Dinonno']",[],A disturbed young woman must confront her worst fears when she finds herself trapped alone in a New York City loft during the 2003 blackout.,Formato min incorrecto
tt2231253,Wild Card,Movie,Drama,2015,2.0,NO DATA,"['tt2231253', 'Jason Statham', 'Michael Angarano', 'Dominik Garcia', 'Milo Ventimiglia', 'Hope Davis', 'Max Casella', 'Stanley Tucci', 'Sofía Vergara', 'Jason Alexander', 'Anne Heche']",[],"Cuando un guardaespaldas de Las Vegas con habilidades letales y un problema de juego se mete en problemas con la mafia, tiene una última jugada, y es todo o nada.",NO DATA
tt2231349,La granja,Movie,Drama,2015,9.0,NO DATA,"['tt2231349', 'Alexandra Lopez Galan', 'Jazmín Caratini', 'Amneris Morales', 'Omar Cruz Soto', 'Carlos Esteban Fonseca', 'Ian Daryk', 'Yulie Padilla', 'Andrea Ruiz', 'Eddie Diaz Rivera', 'José Colón']",[],"A promising young boxer, a barren midwife and a fat kid with a bike: three intersecting stories about the pursuit of happiness and it's unanticipated consequences during the economic collapse of the island of Puerto Rico.",NO DATA
tt2236570,Love N Success,Movie,Drama,2015,,NO DATA,"['tt2236570', 'Blue Kimble', 'Erica Page', 'Danny Vinson', 'Nicky Buggs', 'Racquel Bianca John', 'Rico Ball', 'Angie Stone', 'Porsha Ferguson', 'Denise Santos', 'Shimri Taemar']",[],Money changes everything.,NO DATA
tt2243260,Swung,Movie,Drama,2015,12.0,NO DATA,"['tt2243260', 'Elena Anaya', 'Owen McDonnell', 'Elaine M. Ellis', 'Greg Hemphill', 'Marta Gvazdauskaite', 'Shauna Macdonald', 'Lesley Hart', 'David Elliot', 'Anne Connor', 'Kimberly Neill']",[],"Cuando un encuentro tiene un impacto inesperado en la impotencia de David, Alice cree que podría haber encontrado la solución a todos sus problemas, pero el mundo poliamoroso es un lugar difícil para que florezca el amor.",87
tt2241750,Drown,Movie,Drama,2015,5.0,NO DATA,"['tt2241750', 'Matt Levett', 'Maya Stange', 'Jack Matthews', 'Harry Cook', 'JayR Tinaco', 'Lucy Green', 'Jessina Oakes', 'Meg McDermott', 'Kimberly Lim', 'Robin Gonnella']",[],"Three surf lifesavers on a big night out. Jealousy, homophobic fears and unrequited lust culminate in a tragic booze-fueled episode of near-fatal bullying.",87
tt2245003,Miss You Already,Movie,Drama,2016,4.0,NO DATA,"['tt2245003', 'Drew Barrymore', 'Toni Collette', 'Dominic Cooper', 'Paddy Considine', 'Shola Adewusi', 'Grace Schneider', 'Lucinda Raikes', 'Eleanor Stagg', 'Emily Trappen', 'Lucy Morton']",[],La amistad entre dos amigas de toda la vida se pone a prueba cuando una comienza una familia y la otra cae enferma.,NO DATA
tt2246575,Audition,Movie,Drama,2015,9.0,NO DATA,"['tt2246575', 'Paige Spara', 'Chelsea Frei', 'Benedict Mazurek', 'Sam Quartin', 'Tyler Elliot Burke', 'Nicholas Baroudi', 'Jess Brown', 'Ariella Mastroianni', 'Gianmarco Soresi', 'Erica Camarano']",[],A romance is portrayed by one hundred actors who audition for the two lead roles and the chance to perform the final terrifying act.,90
tt2248739,Departure,Movie,Drama,2016,5.0,NO DATA,"['tt2248739', 'Juliet Stevenson', 'Alex Lawther', 'Phénix Brossard', 'Finbar Lynch', 'Niamh Cusack', 'Patrice Juiff', 'Guillaume Tobo', 'Danièle Catala']",[],Una familia nuclear se desintegra en el sur de Francia.,90
tt2250054,"After Winter, Spring",Movie,Drama,2015,2.0,NO DATA,"['tt2250054', 'Nanou Bouchat', 'Charlotte Brajot', 'Isabelle Brajot', 'Frédéric Coté', 'Isabelle Coté', 'Ginette Delibie', 'Marie-Louise Gourdon', 'Judith Lit', 'Guy Phélip', 'Alain Rabeau']",[],"Seen through the eyes of family farmers in southwest France, AFTER WINTER, SPRING is an intimate portrait of an ancestral way of life under threat in a world increasingly dominated by large-scale industrial agriculture.",75
tt2250418,Ever After: Resurrection,Movie,Drama,2015,,NO DATA,['tt2250418'],[],Elite assassin Miko returns to complete one last mission.,90
tt2249498,Hooligans at War: North vs. South,Movie,Drama,2015,4.0,NO DATA,"['tt2249498', 'Chris Bell', 'Alan Lund', 'Danny Howard', 'Colin Burt Vidler', 'John Teeboon', 'Darren Hoar', 'Martin Workman', 'Ross Boatman', 'Dean Martin', 'Robert English']",[],"Two best friends who go through war overseas, leave the army and become London gang bosses.",80
tt2251828,Territoriya,Movie,Drama,2015,4.0,NO DATA,"['tt2251828', 'Konstantin Lavronenko', 'Grigoriy Dobrygin', 'Egor Beroev', 'Evgeniy Tsyganov', 'Vladislav Abashin', 'Kseniya Kutepova', 'Olga Krasko', 'Pyotr Fyodorov', 'Konstantin Shelestun', 'Andrey Nazimov']",[],"It happened in the sixties, during the political thaw in the Soviet Union... but our story unfolds in the coldest terrain of the country. It was an unexplored and unbeaten terrain of boundless ice-field and forbidding rocks. This was the proper place for real men and real romantics. Our story is about the geologists prospecting gold in the Extreme North.",157
tt2254131,Shelter,Movie,Drama,2015,4.0,NO DATA,"['tt2254131', 'Joyce Hshieh', 'Michael Patrick Lane', 'Sarah Street', 'Jeffrey Green', 'Carlos C. Garcia', 'Matt Pantaleno', 'Eric R. Williams']",[],"Five survivors wait out nuclear winter in a bomb shelter. The group struggles against the clock until it's safe to return to the surface. As weeks turn into months, one room proves too small for five people.",Formato min incorrecto
tt2259426,Pictures of Lily,Movie,Drama,2015,,NO DATA,"['tt2259426', 'Elena Saorin', 'Daniel Lane', 'Louise Torres-Ryan', 'Nicholas Farr', 'Emer Mary Morris', 'Oliver Harrison', 'Amber Coombs', 'Katharine Eskenazi', 'Simeon Oakes', 'Scott Virgo']",[],A jaded businessman and a free-spirited woman forge an unexpected bond in a bohemian seaside town.,76
tt2262345,Tout en haut du monde,Movie,Drama,2015,12.0,NO DATA,"['tt2262345', 'Peter Hudson', 'Christa Théret', 'Féodor Atkine', 'Antony Hickling', 'Tom Morton', 'Kester Lovelace', 'Leslie Clack', 'Marc Bretonnière', 'Chloe Dunn', 'Loïc Houdré']",[],"En 1882, una joven aristócrata rusa se embarca en una aventura épica para descubrir qué le pasó a su abuelo y restaurar la imagen de su familia.",NO DATA
tt2262161,Sunset Song,Movie,Drama,2015,12.0,NO DATA,"['tt2262161', 'Ken Blackburn', 'Mark Bonnar', 'Stuart Bowman', 'Emily-Jane Boyle', 'Ewan Comes', 'Maelly Comes', 'Ann Overstall Comfort', 'Callum Adams', 'Agyness Deyn', 'Ron Donachie']",[],La hija de un granjero escocés alcanza la mayoría de edad a principios del siglo XX.,NO DATA
tt2262153,Sun Flower: Himawari,Movie,Drama,2015,12.0,NO DATA,"['tt2262153', 'Masaaki Kouno', 'Kengo Matsuzaki', 'Seiya Nakano', 'Ayaka Saito', 'Konomi Tsuboi']",[],"150 days after the Great East Japan Earthquake, in the fictional town of Izu. Akemi, a girl from the Tohoku region, constantly carries with her a sunflower, firmly believing in its ability to absorb radioactivity. She has evacuated here to live and work at a long-established onsen ryokan (hot spring inn), managed by her grandmother. Although faced with the harsh reali... Leer todo",66
tt2262788,Mulberry Stains,Movie,Drama,2015,9.0,NO DATA,"['tt2262788', 'Tricia Jo Hoffman', 'Bailey Gambertoglio', 'Joey Lauren Adams', 'Kelvin Payton', 'Robert Works', 'Chaz Wood', 'Robert Lott', 'Denton Blane Everett', 'Connie Cooper', 'Julie Oliver-Touchstone']",[],"In this emotionally charged thriller, Harper is forced to face horrifying secrets of her childhood in order to give her daughter a better future. But how far will she go to forget the past?",130
tt2268016,Magic Mike XXL,Movie,Drama,2015,7.0,NO DATA,"['tt2268016', 'Channing Tatum', 'Joe Manganiello', 'Matt Bomer', 'Adam Rodriguez', 'Juan Piedrahita', 'Sharon Blackwood', 'Alison Faulk', 'Josh Diogo', 'Kevin Nash', 'Gabriel Iglesias']",[],Mike y los Reyes de Tampa ofrecen el espectáculo de sus vidas en Myrtle Beach.,130
tt2271563,Forsaken,Movie,Drama,2016,2.0,NO DATA,"['tt2271563', 'Esther Purves-Smith', 'Kiefer Sutherland', 'Donald Sutherland', 'Lex Cassar', 'Graeme Black', 'Dave Trimble', 'Joe Norman Shaw', 'Aaron Poole', 'Michael Wincott', 'Brian Cox']",[],"En 1872, un pistolero amargado llamado John Henry Clayton intenta hacer las paces con su padre, el reverendo Samuel Clayton, mientras su comunidad es asediada por despiadados acaparadores de tierras.",130
tt2273657,True Story,Movie,Drama,2021,1.0,NO DATA,"['tt2273657', 'James Franco', 'Jonah Hill', 'Felicity Jones', 'Maria Dizzia', 'Ethan Suplee', 'Conor Kikot', 'Charlotte Driscoll', 'Stella Rae Payne', 'Robert John Burke', 'Byron Jennings']",[],Cuando el deshonroso reportero del New York Times Michael Finkel se encuentra con el asesino acusado Christian Longo -quien ha asumido la identidad de Finkel- su investigación se transforma en un juego de gato y ratón.,NO DATA
tt2273062,Diablo Canyon,Movie,Drama,2015,,NO DATA,"['tt2273062', 'Walter Anaruk', 'Laura Baukol', 'Jeff Bosley', 'Ron Burkhardt', 'Elgin Cahill', 'Thor Carr', 'Leon Clark', 'Pamela Crawford', 'Marty Dasis', 'JP Dayton']",[],"When the latest victim of the I-70 kidnapper barely escapes with her life, Sheriff Jack Clay joins forces with FBI Agent Carrie Wilson to bring him to justice. But the clock starts ticking when they discover that he has another victim.",84
tt2278815,All Hale,Movie,Drama,2015,8.0,NO DATA,"['tt2278815', 'Rob Morgan', 'Veronica Ilenre', 'Stuart Campbell', 'Mary Katherine Murphy', 'Stephanie Allen', 'Romello Brown']",[],Tensions run high when a young female architect moves to a small but uniquely-built rural town and unwittingly falls in love with the son of the man responsible for the town's misfortune.,100
tt2279199,Off,Movie,Drama,2015,6.0,NO DATA,"['tt2279199', 'Nikola Djuricko', 'Ljubomir Bandovic', 'Vuk Jovanovic', 'Mina Manojlovic', 'Slobodan Pavelkic', 'Milan Cucilovic', 'Tanasije Uzunovic', 'Goran Sultanovic', 'Dejan Dedic', 'Dijana Jovicic']",[],"Petar Lubarda, a young medical student, leads a secret life as one of the best drivers of ""Serbian Roulette"" - illegal street-races taking place during nighttime in downtown Belgrade. His older brother Mihajlo, once a top driver of ""Roulette"" himself, now a renowned anesthesiologist, gets involved in a maze of blackmail, conspiracy and revenge, when a former childhood... Leer todo",76
tt2280578,Hard Time Bus,Movie,Drama,2016,,NO DATA,"['tt2280578', 'Neil Reidman', 'Naomi Ryan', 'Roger Griffiths', 'Michael Ellis', 'Bailey Patrick', 'Tashan Sinclair-Doyle', 'Anthony Warren', 'Fahad Salman', 'Juliet de Gannes', 'Charlotte Peak']",[],"After a rude awakening, Mark Bishop's carefree and complacent lifestyle comes crashing back to reality, forcing him to make hasty plans to marry devoted girlfriend, Denise. His decision opens his eyes to the life he led and the friends he thought he knew, but will the years of complacency finally catch up with him before he makes it to the altar?",90
tt2282390,Anna and Modern Day Slavery,Movie,Drama,2015,1.0,NO DATA,"['tt2282390', 'Paula Preston', 'Pawel Palcat', 'Francesca De Luca', 'Joanna Bondarowska', 'Ewa Galusinska', 'Laura Menendez', 'Robert Zawadzki', 'Elena Mazzon', 'Marek Olchawski', 'Ana Rubia Rodrigues']",[],Together with her team of close collaborators Anna works tirelessly risking her own life to unravel dark secrets behind a major trafficking ring.,65
tt2282737,The Breakup Girl,Movie,Drama,2015,7.0,NO DATA,"['tt2282737', 'Shannon Woodward', 'Wendi McLendon-Covey', 'Bobbi Salvör Menuez', 'Mary Kay Place', 'Ray Wise', 'Joe Lo Truglio', 'Catherine Bach', 'Timm Sharp', 'Nick Thune', 'Casey Wilson']",[],Three estranged sisters deal with their father's death.,65
tt2291284,Subterranea,Movie,Drama,2016,9.0,NO DATA,"['tt2291284', 'Lily Gladstone', 'Bug Hall', 'William Katt', 'Nicholas Turturro', 'Amber Rose Mason', 'Jeff Medley', 'Tashia Gates', 'Daniel Molloy', 'Ken White', 'Derrick Louden']",[],"Having spent his entire life in a dark cell, never seeing the light of day or another human being, the ""Captive"" is released into society and must learn how to live for the first time as an adult.",Formato min incorrecto
tt2290397,Alaska,Movie,Drama,2015,11.0,NO DATA,"['tt2290397', 'Elio Germano', 'Astrid Bergès-Frisbey', 'Valerio Binasco', 'Elena Radonicich', 'Antoine Oppenheim', 'Paolo Pierobon', 'Pino Colizzi', ""Marco D'Amore"", 'Roschdy Zem', 'Anastasia Vinogradova']",[],"Fausto and Nadine meet for the first time in a hotel in Paris. They both are fragile, alone and obsessed with an unreachable desire of happiness. Fausto is an Italian man who moved to France and is working as a waiter hoping to find success, but in vain. Nadine is a young and beautiful French girl. They will fall in love with each other and suffer together for their f... Leer todo",125
