tt14889036,Cigarette Sedbedi Preethi Madbedi,Movie,Drama,2015,12.0,NO DATA,"['tt14889036', 'Kaddipudi Chandru', 'Suresh Heblikar', 'Sadhu Kokila', 'Girija Lokesh', 'Nagashekar', 'Neha Patil', 'Rakshitha Ponnamma', 'Roopashree', 'Lucky Shanker']",[],Movie promoting the social message of how smoking is injurious to health.,132
tt1490785,I Saw the Light,Movie,Drama,2016,4.0,NO DATA,"['tt1490785', 'Tom Hiddleston', 'Elizabeth Olsen', 'Maddie Hasson', 'Bradley Whitford', 'Cherry Jones', 'Wrenn Schmidt', 'David Krumholtz', 'Josh Pais', 'Wesley Robert Langlois', 'Joshua Brady']",[],"La cinta narrará la historia del meteórico ascenso a la fama del cantautor estadounidense, Hank Williams, así como su trágico final tanto en su vida personal como en lo referente a su salud.",NO DATA
tt14923388,Modelos,Movie,Drama,2015,,NO DATA,"['tt14923388', 'Padre Apeles', 'Anna Carolina Benítez', 'Miriam Gonzalez', 'Alfons Nieto', 'Erik Putzbach', 'Fernando Romero']",[],,95
tt15011976,Zig zag,Movie,Drama,2015,12.0,NO DATA,"['tt15011976', 'Reem Al Baroudi']",[],,NO DATA
tt15106736,Clown of a Salesman,Movie,Drama,2015,4.0,NO DATA,"['tt15106736', 'Kim In-kwon', 'Cheol-min Park']",[],"Il-Bum falls behind on his loans and begins work at a place that sells health food and supplements. He tries to make his customers, mostly older women, happy but soon finds himself compromising his own beliefs in the pursuit of sales.",104
tt15115144,Mythili & Co,Movie,Drama,2015,,NO DATA,"['tt15115144', 'Chitram Basha', 'Jeeva', 'Ravi Kale', 'Poonam Pandey', 'Potti Rambabu', 'Milan Rathi', 'Sanul Rathi', 'Samrat Reddy', 'Junior Relangi', 'Kavya Singh']",[],A woman runs a massage parlor in Mumbai.,111
tt1512098,Nicht weit von mir,Movie,Drama,2015,10.0,NO DATA,"['tt1512098', 'Jennifer Sabel', 'Florian Kleine', 'Anna Prüstel', 'Claudia Bill', 'Ronald Hansch', 'David O. Riedel', 'Christian Tompos', 'Joachim Zons']",[],"Louisa is living a gloomy life. She takes rescue in literature, loosing herself in books and novels. One day she takes a book from the library, she did not choose: A guide to Lucid Dreaming. Soon she discovers the endless options of this new universe of opportunities: living a dream.",95
tt15148808,The First Lady,Movie,Drama,2015,10.0,NO DATA,"['tt15148808', 'Omoni Oboli', 'Alexx Ekubo', 'Chinedu Ikedieze', 'Joseph Benjamin', 'Yvonne Jegede', 'Anthony Monjaro', 'Taiwo Familoni', 'Jude Chukwuka', 'Emilyn Johnson-Ekpo', 'Udoka Oyeka']",[],A prostitute who is tired of the kind of work she does doing everything in her power to stop and also looking unto a man to save her from her predicament.,107
tt1517471,Dough,Movie,Drama,2017,6.0,NO DATA,"['tt1517471', 'Jonathan Pryce', 'Jerome Holder', 'Phil Davis', 'Ian Hart', 'Pauline Collins', 'Andrew Ellis', 'Malachi Kirby', 'Natasha Gordon', 'Melanie Freeman', 'Joel Beckett']",[],Un viejo panadero judío lucha por mantener su negocio a flote hasta que su joven aprendiz musulmán agrega cannabis a la masa y dispara las ventas.,NO DATA
tt15273502,Territory 313 vs 734,Movie,Drama,2015,10.0,NO DATA,"['tt15273502', 'Johnathan Brown', 'Gregory Dockery', 'Jeanette Drake', 'Candace Hale', 'Jaquan', ""D'Tonio Lebrian"", 'Kyle Sammy', 'Valentino J. Smith']",[],,47
tt1527837,Sweet Lorraine,Movie,Drama,2015,4.0,NO DATA,"['tt1527837', ""Tatum O'Neal"", 'Steven Bauer', 'Peter Greene', 'Madinah Jabbaar', 'Julianne Michelle', 'Robyn Peterson', 'Scott William Winters', 'Matthew Meis', 'Toni Romano', 'Matt Sauerhoff']",[],"The double life of Methodist minister's wife catches up to her, as her husband campaigns for Mayor in a small New Jersey town.",47
tt15360288,Deception,Movie,Drama,2015,,NO DATA,"['tt15360288', 'Dona Gregorio', 'Christan Ramos', 'Pamela Rivers']",[],,NO DATA
tt15428852,Open Marriage,Movie,Drama,2015,10.0,NO DATA,"['tt15428852', 'Theophilus Afe', 'Monalisa Chinda', 'Frank Dallas', 'Alexx Ekubo', 'Aaron Garvey', 'Efe Henry', 'Stanley Ikeogu', 'Jennifer Lamai', 'Daniel Lloyd', 'Rosaline Meurer']",[],,87
tt15435110,Since it's not late,Movie,Drama,2015,2.0,NO DATA,"['tt15435110', 'Nikolay Azarov', 'Viktoriya Belyakova', 'Irina Brazgovka']",[],,NO DATA
tt15516496,Marg Maza Aekala,Movie,Drama,2015,4.0,NO DATA,"['tt15516496', 'Ajinkya Deo', 'Sulabha Deshpande', 'Alka Kubal', 'Supriya Pathare', 'Ravi Patwardhan', 'Uday Tikekar', 'Varsha Usgaonkar']",[],,NO DATA
tt15574610,First Cut,Movie,Drama,2015,1.0,NO DATA,"['tt15574610', 'Joseph Benjamin', 'Monalisa Chinda', 'Bobby Obodo', 'Lisa Omorodion']",[],A woman tries to make a life for herself despite the trauma in her past.,NO DATA
tt15613416,Ikogosi,Movie,Drama,2015,5.0,NO DATA,"['tt15613416', 'Kunle Adetoba', 'Didi Ekanem', 'Chelsea Eze', 'Emem Isaac', 'Toka McBaror', 'Kemi Michaels', 'Ik Ogbonna', 'Lisa Omorodion', 'Leo Orji', 'Brutus Richard']",[],,74
tt15618484,Ploque,Movie,Drama,2015,5.0,NO DATA,"['tt15618484', 'Farajollah Golsefidi', 'Mahmoud Maghami', 'Ali Tajdary']",[],"plaque the story is about reza, a boy who has a sick mother and has to pay for his mothers surgery. he is forced to steal with his other friend and faces many challenges. reza(Ali Tajdary)is the main character in the story",90
tt1564945,The Scarapist,Movie,Drama,2016,8.0,NO DATA,"['tt1564945', 'Jeanne Marie Spicuzza', 'Katy Colloton', 'R. Michael Gull', 'Kyle Walsh', 'Nathaniel Ross', 'Bryn Hartnett', 'Guy Hoffman', 'Krystal Watson', 'Synthian Sharp']",[],"An insane therapist entangles a suburban novelist in a web of hypnosis, drugs, kidnapping, depravity and murder.",Formato min incorrecto
tt15699492,Stariki,Movie,Drama,2015,,NO DATA,"['tt15699492', 'Sergey Fetisov', 'Alexandra Nalba', 'Irina Sidorova', 'Vitalii Stuzhev']",[],,NO DATA
tt1573475,"Love, Guns & Christmas",Movie,Drama,2015,7.0,NO DATA,"['tt1573475', 'Yvonne Maverick', 'Karl Campbell', 'Brian Skelhorn', 'Mary Bodnar', 'Eleonora Barna', 'Maria Christina Bruno', 'Neno Vojic', 'Yossie Grinshpan', 'Amer Mushahbash', 'Ted Powers']",[],"Love, Guns & Christmas is a dark comedy about two men in the witness protection program. After a few years in hiding, they sneak back into town for Christmas to see their friends while dodging the mafia and the police whose protection they will lose if caught.",83
tt1591469,Collar,Movie,Drama,2015,,NO DATA,"['tt1591469', 'Tom Sizemore', 'David Wilson', 'Rebecca De Mornay', 'Richard Roundtree', 'Kether Donohue', 'Emily Tremaine Fernandez', 'Jaime Santana', 'Iris Delgado', 'Sabrina Johnston', 'Kurt Andon']",[],"Timothy James 'TJ' Williams (David Wilson) is a streetwise detective whose checkered career, family life and long standing friendship with the would-be mayor, police chief Hamilton Markham (Tom Sizemore), spins out of control and teeters on the brink of catastrophe as a result of a bust gone bad. While his life begins to crumble, his fast fading future is bartered for... Leer todo",Formato min incorrecto
tt1596363,The Big Short,Movie,Drama,2016,1.0,NO DATA,"['tt1596363', 'Christian Bale', 'Steve Carell', 'Ryan Gosling', 'Brad Pitt', 'Rudy Eisenzopf', 'Casey Groves', 'Charlie Talbert', 'Harold Gervais', 'Maria Frangos', 'Hunter Burke']",[],"En 2006, un grupo de inversores apostó contra el mercado hipotecario de Estados Unidos. En está investigación, sale a la luz cuán defectuoso y corrupto es el mercado.",NO DATA
tt1598642,Z for Zachariah,Movie,Drama,2015,8.0,NO DATA,"['tt1598642', 'Chiwetel Ejiofor', 'Chris Pine', 'Margot Robbie']",[],Dos hombres y una mujer se encuentran en un emocional triángulo amoroso al convertirse en los tres últimos supervivientes tras una catástrofe que aniquila a la humanidad.,NO DATA
tt1605791,Beyond the Farthest Star,Movie,Drama,2015,8.0,NO DATA,"['tt1605791', ""Renée O'Connor"", 'Todd Terry', 'Cherami Leigh', 'William McNamara', 'Andrew Prine', 'Barry Corbin', 'Tyler Corie', 'Shawn Roe', 'Lou Beatty Jr.', 'Jordan Walker Ross']",[],"A torched nativity shifts the national spotlight to a dying Texas town, revealing the hidden secrets of a preacher's broken family.",NO DATA
tt1629242,Careful What You Wish For,Movie,Drama,2015,5.0,NO DATA,"['tt1629242', 'Nick Jonas', 'Kiki Harris', 'David Sherrill', 'Graham Rogers', 'Isabel Lucas', 'Paul Sorvino', 'John Driskell Hopkins', 'Marc Macaulay', 'Dermot Mulroney', 'Jay Potter']",[],"Un hombre obtiene más de lo que esperaba después de tener una aventura con la esposa de un banquero de inversiones. Pronto, una muerte sospechosa y una póliza de seguro de vida sustancial lo envuelven en un escándalo.",NO DATA
tt1655441,The Age of Adaline,Movie,Drama,2015,6.0,NO DATA,"['tt1655441', 'Blake Lively', 'Michiel Huisman', 'Harrison Ford', 'Kathy Baker', 'Ellen Burstyn', 'Amanda Crew', 'Lynda Boyd', 'Hugh Ross', 'Richard Harmon', 'Fulvio Cecere']",[],"Adaline Bowman nació en 1908, pero tras sufrir un accidente adquirió la eterna juventud. Tras décadas de vida solitaria, conoce a Ellis Jones, un joven por el que merecería la pena perder la inmortalidad.",NO DATA
tt1658801,Freeheld,Movie,Drama,2016,5.0,NO DATA,"['tt1658801', 'Julianne Moore', 'Elliot Page', 'Steve Carell', 'Michael Shannon', 'Luke Grimes', 'Gabriel Luna', 'Anthony DeSando', 'Skipp Sudduth', 'Josh Charles', ""Kevin O'Rourke""]",[],La lugarteniente de policía Laurel Hester y su compañera Stacie Andree luchan por preservar el derecho de Hester a una pensión cuando la diagnostican con un cáncer terminal.,NO DATA
tt1659611,Le grand partage,Movie,Drama,2015,12.0,NO DATA,"['tt1659611', 'Karin Viard', 'Didier Bourdon', 'Valérie Bonneton', 'Michel Vuillermoz', 'Josiane Balasko', 'Patrick Chesnais', 'Firmine Richard', 'Michèle Moretti', 'Anémone', 'Jackie Berroyer']",[],"An unusually cold winter forces the french government to push the best housed people to accommodate some poor fellow citizens. The decree called ""Le Grand Partage"" creates some trouble among the residents of a Paris upscale apartment block.",NO DATA
tt1661199,Cinderella,Movie,Drama,2015,3.0,NO DATA,"['tt1661199', 'Lily James', 'Cate Blanchett', 'Richard Madden', 'Helena Bonham Carter', 'Nonso Anozie', 'Stellan Skarsgård', 'Sophie McShera', 'Holliday Grainger', 'Derek Jacobi', 'Ben Chaplin']",[],"Cuando su padre fallece inesperadamente, la joven Ella se encuentra a merced de su cruel madrastra y sus maquiavélicas hermanastras. Jamás dispuesta a perder la esperanza, su suerte empieza a cambiar después de encontrarse con un atractivo desconocido.",NO DATA
tt1663202,The Revenant,Movie,Drama,2016,1.0,NO DATA,"['tt1663202', 'Leonardo DiCaprio', 'Tom Hardy', 'Will Poulter', 'Domhnall Gleeson', 'Forrest Goodluck', 'Paul Anderson', 'Kristoffer Joner', 'Joshua Burge', 'Duane Howard', ""Melaw Nakehk'o""]",[],Un hombre de la frontera que participa en una expedición de comercio de pieles en la década de 1820 lucha por sobrevivir después de ser mutilado por un oso y dado por muerto por los miembros de su propio equipo de caza.,NO DATA
tt1663655,Martyrs,Movie,Drama,2016,1.0,NO DATA,"['tt1663655', 'Troian Bellisario', 'Bailey Noble', 'Kate Burton', 'Caitlin Carmichael', 'Melissa Tracy', 'Romy Rosemont', 'Toby Huss', 'Elyse Cole', 'Ever Prishkulnik', 'Blake Robbins']",[],Una mujer y su amiga de la infancia buscan vengarse de quienes las victimizaron y abusaron.,Formato min incorrecto
tt1671741,Surviving Me: The Nine Circles of Sophie,Movie,Drama,2015,,NO DATA,"['tt1671741', 'Ellana Barksdale', 'Joanna Becker', 'Matt Cannon', 'Rusty Clauss', 'Mira Furlan', 'Dennis Hill', 'Jeanmarie Lally', 'Fredric Lehne', 'Kevin Murray', 'Marjo-Riikka Mäkelä']",[],"As she enters her junior year of college, aspiring poet Sophie (Christine Ryndak) embarks on a journey of self-discovery amidst a sexual identity crisis. Fear and insecurity eventually get the best of her, and Sophie loses her moral compass, damaging her relationships with her boyfriend Jimmy (Vincent Piazza) and best friend Kiera (Leah Yananton), as well as her poetr... Leer todo",NO DATA
tt1675432,Finding Mabel,Movie,Drama,2015,1.0,NO DATA,"['tt1675432', 'Eileen Álvarez', 'Garrett Vander Leun']",[],A young woman travels from the U.S to Argentina (her parent's homeland) to piece together the enigmatic disappearance of the woman she was named after - a young activist named Mabel. Will she find Mabel? What will she find along the way?,101
tt1674771,Entourage,Movie,Drama,2015,6.0,NO DATA,"['tt1674771', 'Adrian Grenier', 'Kevin Connolly', 'Jerry Ferrara', 'Kevin Dillon', 'Jeremy Piven', 'Emmanuelle Chriqui', 'Perrey Reeves', 'Rex Lee', 'Debi Mazar', 'Rhys Coiro']",[],"La estrella de cine Vincent Chase, junto con sus hijos Eric, Turtle y Johnny, están de vuelta - y retornan al negocio con el super agente convertido en jefe de estudio, Ari Gold, en un arriesgado proyecto que servirá de debut como director de Vince.",NO DATA
tt1683051,Forgiveness,Movie,Drama,2015,2.0,NO DATA,"['tt1683051', 'Richard T. Jones', 'Adam Lazarre-White', 'Robinne Lee', 'Maya Dunbar', 'Gabriel Kalomas', 'Inny Clemons', 'Kelly Pendygraft', 'Kevin Benton', 'Jakai Bishop', 'Malika Blessing']",[],"A beloved Pastor works to serve his 'flock' and save his 100 year old church. In his dedication and desire to do so, he crosses boundaries that are not to be crossed.",NO DATA
tt1683919,No Way Out,Movie,Drama,2015,11.0,NO DATA,"['tt1683919', 'Hector Echavarria', 'Danny Trejo', 'Estella Warren', 'Carlotta Elektra Bosch', 'Robert Miano', 'Patrick Kilpatrick', 'Christian Rodrigo', 'Amin Joseph', 'Rob Fuller', 'Celso Franco']",[],"Juan de los Santos, a former undercover cop from Paraguay, once ready to take down the biggest drug cartel in Latin America, has lost everything; his wife and kids brutally murdered on a cold dark night and with them, his will to live. Juan, himself didn't survive unscathed; on that cold night he took two bullets, one still in his heart, the other one damaging a part ... Leer todo",NO DATA
tt1694021,Into the Grizzly Maze,Movie,Drama,2015,8.0,NO DATA,"['tt1694021', 'James Marsden', 'Thomas Jane', 'Piper Perabo', 'Scott Glenn', 'Michaela McManus', 'Billy Bob Thornton', 'Adam Beach', 'Kelly Curran', 'Reese Alexander', ""Luisa d'Oliveira""]",[],"Dos hermanos distanciados se reencuentran en la casa de su infancia, en el desierto de Alaska. Se embarcan en una caminata de dos días y son perseguidos por un implacable oso pardo.",NO DATA
tt1698654,Catching the Sun,Movie,Drama,2016,4.0,NO DATA,['tt1698654'],[],"An unemployed American worker, a Tea Party activist, and a Chinese solar entrepreneur race to lead the clean energy future. But who wins and who loses the battle for power in the 21st century?",Formato min incorrecto
tt1702429,Eisenstein in Guanajuato,Movie,Drama,2015,6.0,NO DATA,"['tt1702429', 'Elmer Bäck', 'Luis Alberti', 'Maya Zapata', 'Lisa Owen', 'José Montini', 'Cristina Velasco Lozano', 'Rasmus Slätis', 'Jakob Öhrman', 'Sara Juárez', 'Alaín Vargas']",[],"El venerado cineasta Eisenstein es comparable en talento, perspicacia y sabiduría a personas como Shakespeare o Beethoven, hay pocos directores que puedan ser elevados a tales alturas.",NO DATA
tt1707380,Every Thing Will Be Fine,Movie,Drama,2015,7.0,NO DATA,"['tt1707380', 'James Franco', 'Peter Miller', 'Gilbert Wahiakeron', 'Claude Chamberlain', 'Rachel McAdams', 'Jack Fulton', 'Charlotte Gainsbourg', 'Céline Bonnier', 'Mary Katherine Harvey', 'Patrick Bauchau']",[],"Un día conduciendo sin rumbo fijo después de una disputa, un escritor llamado Tomas, golpea y mata accidentalmente a un niño. ¿Podrá seguir adelante?",NO DATA
tt1708135,Elser,Movie,Drama,2016,1.0,NO DATA,"['tt1708135', 'Christian Friedel', 'Katharina Schüttler', 'Burghart Klaußner', 'Johann von Bülow', 'Felix Eitner', 'David Zimmerschied', 'Rüdiger Klink', 'Simon Licht', 'Cornelia Köndgen', 'Martin Maria Abram']",[],"En noviembre de 1939, el intento de Georg Elser de asesinar a Adolf Hitler fracasa y es arrestado. Durante su encierro, recuerda los acontecimientos que llevaron a su complot y sus razones para decidir tomar una acción tan drástica.",NO DATA
tt1720161,Messina High,Movie,Drama,2015,8.0,NO DATA,"['tt1720161', 'Owen Drake', 'Kody Corduan', 'Amanda Bauer', 'Lola Blanc', 'Osayande Kokayi', 'Jason Suhrke', 'Steve Sanders', 'Ben Blois', 'Jesse Pimentel', 'Tim Talbot']",[],Rachel helped John set-up Claudio against Hayley.,NO DATA
tt1721503,Using,Movie,Drama,2015,2.0,NO DATA,"['tt1721503', 'Thomas Anthony Quinn', 'Elizabeth Schwarzrock', 'Toya Turner', 'Christopher J. Domig', 'Marlee Turim', 'Brooke Trantor', 'Rian Jairell', 'Kymberly Harris', 'Andy Junk', ""Johnny 'Koolout' Starks""]",[],A guilt-ridden real estate magnate must enlist the help of a mysterious tenant to rescue his troubled daughter from self-destruction.,87
tt1728977,The Eighth Sin,Movie,Drama,2015,,NO DATA,"['tt1728977', 'Mehdi Francois-Ackerman', 'Augie Duke', 'Frank Leboeuf', 'Sandra Seeling']",[],"Haunted by disturbing dreams, Paris questions his relation with Maya. The alluring women he can't seem to remember ever meeting.",95
tt1731702,Cats Dancing on Jupiter,Movie,Drama,2015,5.0,NO DATA,"['tt1731702', 'Amanda Righetti', 'Nicole Andrews', 'Jocelyn Saenz', 'Erica Taylor', 'Jonathan Bennett', 'Anneliese van der Pol', 'Richard Grieco', 'Peter Gray Lewis', 'Allan Louis', 'Billy Wirth']",[],"Two 20-something club hopping women in LA are at first glance living the good life of partying and casual sex, until they are revealed to be scarred by a childhood abduction and driven to take revenge on every man who crosses their path.",90
tt1732651,Ghost Shark 2: Urban Jaws,Movie,Drama,2015,6.0,NO DATA,"['tt1732651', 'Johnny Hall', 'Campbell Cooley', 'Roberto Nascimento', 'Kathleen Burns', 'Steve Austin', 'Sarah McMullan', 'Ban Abdul', 'Leighton Cardno', 'Patrick Powdrell', 'Adam Baines']",[],"When Ghost Shark returns to terrorize Auckland, Mayor Broody calls in an expert ghost shark hunter to protect the citizens and finally defeat the creature.",70
tt1733731,"46, xx",Movie,Drama,2015,11.0,NO DATA,"['tt1733731', 'Annick Christiaens', 'François Beukelaers', 'Gaelle Gillis', 'Olivier Bonjour', 'John Flanders', 'Olivier Bisback', 'Kevin Van Doorslaer', 'Laetitia Chambon', 'Karel Tuytschaever', 'Alexandra Oppo']",[],"Because she was raped a few years earlier, a young nurse flips out when she finds out that her boyfriend has cheated on her. She loses her relationship, home and job and uses her body to take revenge on men. But only one way her nightmare will end.",122
tt1734579,Ztraceni v Mnichove,Movie,Drama,2015,10.0,NO DATA,"['tt1734579', 'Martin Mysicka', 'Tomás Bambusek', 'Vladimír Skultéty', 'Stanislas Pierret', 'Marcial Di Fonzo Bo', 'Jirí Reindl', 'Jirí Rendl', 'Prokop Holoubek', 'Edita Leva', 'Marek Taclík']",[],"Sir ""P"" a 90 year old gray parrot, formerly living with Edouard Daladier, the French prime minister responsible for signing the Munich Treaty, comes to Prague to give his ""account"" of the past events. But can he do it, being just a bird? In a series of weird events sir is kidnapped by a Czech journalist undergoing his midlife crisis. The guy has him publicly say some ... Leer todo",105
tt1735907,The Adderall Diaries,Movie,Drama,2016,3.0,NO DATA,"['tt1735907', 'James Franco', 'Ed Harris', 'Amber Heard', 'Jim Parrack', 'Timothée Chalamet', 'Danny Flaherty', 'Christian Slater', 'Cynthia Nixon', 'Elizabeth Hobgood', 'Tamzin Brown']",[],"Elliot, un ex escritor exitoso con problemas, decide escribir sobre una esposa desaparecida y el juicio por asesinato de su esposo.",NO DATA
tt1741273,Secret in Their Eyes,Movie,Drama,2016,3.0,NO DATA,"['tt1741273', 'Chiwetel Ejiofor', 'Nicole Kidman', 'Julia Roberts', 'Dean Norris', 'Alfred Molina', 'Joe Cole', 'Michael Kelly', 'Zoe Graham', 'Patrick Davis Alarcón', 'Eileen Fogarty']",[],"Ray y Jess, dos agentes del FBI, son relevados de sus puestos cuando aparece asesinada la hija de ella. 13 años después, Ray encuentra por fin una pista para resolver el caso.",NO DATA
tt1754656,Le Petit Prince,Movie,Drama,2015,7.0,NO DATA,"['tt1754656', 'Jeff Bridges', 'Mackenzie Foy', 'Rachel McAdams', 'Marion Cotillard', 'Riley Osborne', 'James Franco', 'Bud Cort', 'Benicio Del Toro', 'Ricky Gervais', 'Albert Brooks']",[],La primera película animada inspirada por la icónica história de Antoine de Saint-Exupéry El Principito.,NO DATA
tt1754331,Le grand tout,Movie,Drama,2015,9.0,NO DATA,"['tt1754331', 'Jauris Casanova', 'Hélène Seuzaret', 'Benjamin Boyer', 'Laure Gouget', 'Pierre-Alain de Garrigues']",[],"Ejected 20,000 years away from their civilization by a black hole, 3 scientists, a pshychiatrist, and a mechanic, decide to explore the universe rather than go back to earth.",131
tt1754736,Chloe & Theo,Movie,Drama,2015,6.0,NO DATA,"['tt1754736', 'Theo Ikummaq', 'Dakota Johnson', 'Ashley Springer', 'André De Shields', 'Mira Sorvino', 'Michael Stiles', 'Jessica Anderson', 'Peter Henry Arnatsiaq', 'Christopher Backus', 'Lawrence Ballard']",[],From the northern ice comes a gentler kind of hero.,131
tt1761008,The Weather Outside,Movie,Drama,2015,10.0,NO DATA,"['tt1761008', 'Michael J. Prosser', 'Erin McGarry', 'Barrie Wild', 'Tim Whitcomb', 'Haley Talbot', 'Ted Rooney', 'Todd A. Robinson', 'Galen Schrick', 'JoAnn Johnson', 'Ryan Menard']",[],"Max finds himself separated from his family on Christmas Eve. He ultimately comes to the conclusion that his wife has left him and taken their children along with her. One year after the disappearance, he begins to discover that he might have one last risky chance to get them back.",NO DATA
tt1772261,The Curse of Downers Grove,Movie,Drama,2015,8.0,NO DATA,"['tt1772261', 'Bella Heathcote', 'Lucas Till', 'Helen Slater', 'Penelope Mitchell', 'Mark L. Young', 'Zane Holtz', 'Martin Spanjers', 'Jeff Staron', 'Marcus Giamatti', 'Tom Arnold']",[],"A teen angst thriller at a high school gripped by an apparent curse that claims the life of a senior every year. Story follows a senior, Chrissie, who is skeptical, and another, Tracy, who believes that she may be the next victim.",Formato min incorrecto
tt1772288,Danny Collins,Movie,Drama,2015,6.0,NO DATA,"['tt1772288', 'Al Pacino', 'Annette Bening', 'Jennifer Garner', 'Bobby Cannavale', 'Christopher Plummer', 'Katarina Cas', 'Giselle Eisenberg', 'Melissa Benoist', 'Josh Peck', 'Brian Thomas Smith']",[],Una estrella mayor del rock decide cambiar su vida cuando descubre que una carta de hace cuarenta años dirigida a él está escrita por John Lennon.,NO DATA
tt1773845,Zigosana,Movie,Drama,2015,3.0,NO DATA,"['tt1773845', 'Andriana Djordjevic', 'Jelena Susnjar', 'Amra Latific', 'Bojan Zirovic', 'Biljana Misic', 'Ana Stefanovic', 'Marija Djuric', 'Milan Jelic', 'Bojana Denic', 'Nena Lekic']",[],"Slavica is living on the margins of society, always skirting borders of what is legal. She is trying to change her ways and to make a living, but it turns out to be an impossible achievement for her. Not having any other means to survive, she turns to stealing, but is quickly apprehended and severely sentenced. She tries to cover her tracks and takes on the identity o... Leer todo",NO DATA
tt1773687,Single in South Beach,Movie,Drama,2015,11.0,NO DATA,"['tt1773687', 'Haley Webb', 'Tinsel Korey', 'Mike Erwin', 'Kevin Sorbo', 'Carlos Ponce', 'John Lewis', 'Alex McKenna', 'Jessica Sutta', 'Wendy Bryan Michaels', 'Jason Canela']",[],"Amy, an attractive single woman, confuses love with money and becomes victim of the materialism of South Beach, Miami. Her life reaches a point of no return and soon discovers that in South Beach, not everything is as good as it looks.",NO DATA
tt1798684,Southpaw,Movie,Drama,2015,9.0,NO DATA,"['tt1798684', 'Jake Gyllenhaal', 'Rachel McAdams', 'Oona Laurence', 'Forest Whitaker', '50 Cent', 'Skylan Brooks', 'Naomie Harris', 'Victor Ortiz', 'Beau Knapp', 'Miguel Gomez']",[],Un campeón del boxeo lucha para recuperar a su hija de los servicios sociales y reavivar su carrera.,NO DATA
tt1810683,Little Boy,Movie,Drama,2015,4.0,NO DATA,"['tt1810683', 'Jakob Salvati', 'Emily Watson', 'David Henrie', 'Michael Rapaport', 'Cary-Hiroyuki Tagawa', 'Tom Wilkinson', 'Ben Chaplin', 'Ted Levine', 'Kevin James', 'Ali Landry Monteverde']",[],Un niño de 8 años está dispuesto a todo por acabar la segunda guerra mundial y traer a su padre de vuelta a casa. La historia revela en amor de la relación padre e hijo.,NO DATA
tt1811313,Disposable,Movie,Drama,2015,1.0,NO DATA,"['tt1811313', 'Greg Beam', 'Logan Borsari', 'Robin Christian', 'Claire Cowley', 'Scott Dunn', 'Cassie Farren', 'David Fine', 'Maia Gersten', 'Carol Hurley', 'Josh Jacobson']",[],"Riley's life is a nightmare. Her mom committed suicide because of her. She gets herself kicked out of one foster home after another. No one seems to understand her, or even care. And now her dad is giving her up for adoption! Riley figures out that someone has been killing other adopted kids in town, making it look like accidents. But no one believes her. How can she ... Leer todo",101
tt1813458,Les derniers survivants,Movie,Drama,2015,11.0,NO DATA,"['tt1813458', 'Arnaud Toussaint', 'Fanny Roger', 'Marcel Mankita', 'Lucky Jacob', 'Sandra Thomas', 'Didier Lelong', 'Loïc Brabant', 'Fabien Joubert', 'Angelique Friant', 'Lola Bonnard']",[],"Two brothers are trying to survive a planetary disaster. Things have envaded the world. Nobody knows how they got here nor what they came here to do, only that they feed on living things included humans.",85
