tt10875068,Deadly Promises,Movie,Drama,2020,7.0,Joseph Ramos,"['tt10875068', 'Julian Crouser', 'Isabella Salazar', 'Michael-John Wolfe', 'Braeden Wilson', 'Brandon Anders', 'Tessa Awald', 'Beckett Bauer', 'Brady Bauer', 'Benji Billman', 'Julia Blok']","['Sandra L. Bucy', 'Thomas Crouser Jr.', 'Julian Crouser']","At Castle Park High, both Dillon and Travis have a crush on Megan. Dillon would kill for her but not if a hidden secret in the basement kills them first.",81
tt10879920,Tengo Miedo Torero,Movie,Drama,2020,10.0,Rodrigo Sepúlveda,"['tt10879920', 'Alfredo Castro', 'Leonardo Ortizgris', 'Julieta Zylberberg', 'Amparo Noguera', 'Luis Gnecco', 'Sergio Hernández', 'Ezequiel Díaz', 'Paulina Urrutia', 'Gastón Salgado', 'Erto Pantoja']","['Pedro Lemebel', 'Nazareno Obregón Nieva', 'Rodrigo Sepúlveda']","Entre boleros y disparos, florece una apasionada relación entre una solitaria travesti y un joven guerrillero durante la dictadura de Pinochet",NO DATA
tt10880230,Do You Still Love Me?,Movie,Drama,2020,5.0,Annie Johnson,"['tt10880230', 'Terrell Bogany', 'Kenneth Campbell', 'Tiffany Collins', 'Dennis Davis', 'April Dillard', 'April Melody Rox Dillard', 'Vonfredrick Gipson', 'Rashaan Harris', 'Chelsa Hillis', 'Linda Hudson']",['Annie Johnson'],,120
tt10880402,De Gaulle,Movie,Drama,2020,3.0,Gabriel Le Bomin,"['tt10880402', 'Lambert Wilson', 'Isabelle Carré', 'Olivier Gourmet', 'Catherine Mouchet', 'Pierre Hancisse', 'Sophie Quinton', 'Gilles Cohen', 'Alain Lenglet', 'Laurent Stocker', 'Philippine Leroy-Beaulieu']","['Valérie Ranson-Enguiale', 'Gabriel Le Bomin']","París, 1940. El matrimonio De Gaulle se enfrenta al colapso político y militar de Francia. Charles se va a Londres dejando a Yvonne con tres hijos camino al éxodo.",108
tt10887902,I Used to Go Here,Movie,Drama,2020,8.0,Kris Rey,"['tt10887902', 'Gillian Jacobs', 'Jemaine Clement', 'Josh Wiggins', 'Forrest Goodluck', 'Hannah Marks', 'Kate Micucci', 'Zoe Chao', 'Jorma Taccone', 'Jennifer Joan Taylor', 'Khloe Janel']",['Kris Rey'],"Un antiguo profesor invita a la escritora Kate, de 35 años, a hablar en su universidad Después de aceptar la invitación, Kate se encuentra profundamente inmersa en la vida de un grupo de estudiantes universitarios.",80
tt10886702,Lady of Guadalupe,Movie,Drama,2020,12.0,Pedro Brenner,"['tt10886702', 'Guillermo Iván', 'Jesús Lloveras', 'Paola Baldion', 'Kimberley Aria Peterson', 'Eric da Silva', 'Norman Patrick Brown', 'Glenn Craley', 'Christopher Phipps', 'Hash Patel', 'Gary J. Neuger']","['Pedro Brenner', 'Seann Dougherty']","Based on true events, ""Lady of Guadalupe"" is a moving religious discovery juxtaposing folklore and the present day. Historically significant recreations are used to illustrate the origin of her prevalent and powerful symbolism of Mexican identity and faith. When a young and ambitious reporter (Guillermo Iván) is assigned an article on faith, he finds himself enmeshed ... Leer todo",95
tt10886166,365 dni,Movie,Drama,2020,6.0,Barbara Bialowas,"['tt10886166', 'Anna-Maria Sieklucka', 'Michele Morrone', 'Bronislaw Wroclawski', 'Otar Saralidze', 'Magdalena Lamparska', 'Natasza Urbanska', 'Grazyna Szapolowska', 'Tomasz Stockinger', 'Gianni Parisi', 'Mateusz Lasowski']","['Tomasz Klimala', 'Tomasz Mandes', 'Barbara Bialowas']",Massimo es un miembro de la mafia siciliana y Laura una directora de ventas que no esperaba ser secuestrada en su viaje a Sicilia y dada 365 días para enamorarse de él.,114
tt10891822,Kolej na milosc,Movie,Drama,2020,10.0,Miguel Velez,"['tt10891822', 'Aleksandra Bialkowska', 'Olimpia Bogusz', 'Piotr Czarniecki', 'Dominika Dawidowicz', 'Marcin Franc', 'Roman Gancarczyk', 'Marcin Gawel', 'Christian Harting', 'Malgorzata Ilasz', 'Karolina Jastrzebska']","['Michal Mieszczyk', 'Miguel Velez']","Mikolaj jumps on a train captivated by a beautiful woman. He hopes to convince her that they are made for each other. On the way to happiness he finds himself with no ticket, and tickets are sacred for the crude conductor Mr. Nowak",79
tt10893272,El Hombre Búfalo,Movie,Drama,2020,8.0,David Torres,"['tt10893272', 'Raúl Briones', 'Sofia Alvarez', 'Antonio Monroi', 'Verónica Bravo', 'José Luis Pérez', 'Ana Clara Castañón', 'Atanasio Cadena', 'Carmen Giménez Cacho', 'Valeria Carbajal Briseño', 'Alberto Coria']",['David Torres'],Eric is a journalist who stops publishing after a threat. Nicolasa convinces him to investigate a group of people stripped of their lands and resources. Eric then embarks on a search for justice that leads him to a mythological entity.,64
tt10896962,Blackjack: The Jackie Ryan Story,Movie,Drama,2020,10.0,Danny A. Abeckaser,"['tt10896962', 'Ashley Greene', 'David Arquette', 'Michael Rapaport', 'Robert Davi', 'James Madio', 'Greg Finley', 'Tara Westwood', 'Caitlin Mehner', 'Geoffrey Cantor', 'Brandon Thomas Lee']",['Antonio Macia'],La historia de la leyenda del básquet original del Brooklyn Jackie Ryan.,98
tt10895828,Marafon zhelaniy,Movie,Drama,2020,1.0,Darya Charusha,"['tt10895828', 'Yuliya Aug', 'Pavel Derevyanko', 'Aleksandr Gudkov', 'Andrew Ilitchev', 'Oleg Kursachyov', 'Mariya Minogarova', 'Kirill Nagiev', 'Alina Nedobitko', 'Mikhail Orlov', 'Irina Ruzanova']","['Maksim Budarin', 'Darya Charusha', 'Aleksandr Gudkov']","Hoping to change her life, Marina, a small town girl, embarks on a journey to a life coaching event. But an unexpected delay at a St. Petersburg airport sends her on a 24 hour comedic spree, which may ultimately provide her with the key to her happiness.",95
tt10897180,Bábovky,Movie,Drama,2020,9.0,Rudolf Havlik,"['tt10897180', 'Jana Plodková', 'Ondrej Vetchý', 'Tatiana Pauhofová', 'Denisa Biskupová', 'Rostislav Novák Jr.', 'Barbora Poláková', 'Lenka Vlasáková', 'Kristyna Ryska', 'Jirí Langmajer', 'Brigita Cmuntová']","['Rudolf Havlik', 'Radka Trestíková']","Six women, six destinies connected in one novel. Have you ever wondered what a married man's mistress is dealing with and what is the horrible wife he is telling her about? Or why does a wife's sister have such a bad relationship with her daughter? How does the fifteen-year-old girl, whose parents never make time, feel? And where did the money actually go? Who took th... Leer todo",97
tt10901068,Joseph,Movie,Drama,2020,1.0,Marcia Weekes,"['tt10901068', 'Kevoy Burton', 'Mawuli Gavor', 'Alison Hinds', 'Stogie Kenyatta', 'Chris McFarlane', 'Sika Osei', 'Mariam Owusu Poku', 'Shontelle']",['Marcia Weekes'],"A Jamaican doctor trained in Western medicine and in conflict with his family (all of whom are doctors) about his belief in the benefits of bush medicine, travels to Ghana to prove them wrong.",116
tt10902002,The Pain Behind You,Movie,Drama,2020,8.0,Sean Roberts,"['tt10902002', 'Angelissa A. Delgado', 'Arlyned A. Delgado', 'Carl Dunn', 'Mary Santana Edge', 'Edel Elveus', 'Janice Marie Reichard Fisher', 'Sherron Jackson', 'Joe Lopez', 'Lisa McConnell', 'Liz Nolan']",['Sean Roberts'],"Jim a hardworking construction worker who has pain behind him from sexual abuse as a child. Takes out his pain on his co worker girlfriend, wife and kids . As a result of his pain he causes his wife to be hurt from his abuse . His kids suffer because his son goes to school and bullies another student because of his pain. The cycled continued until it was was stopped b... Leer todo",NO DATA
tt10909266,A'hr,Movie,Drama,2020,10.0,Sanal Kumar Sasidharan,"['tt10909266', 'Manju Warrier', 'Sonith Chandran', 'Bhupendra Khurana', 'Sujith Koyickal', 'Gaurav Ravindran', 'Vedh']",['Sanal Kumar Sasidharan'],"In Sanskrit, Maya means magic or illusion upon which the universe is woven. Protagonist, Maya refers to the wider mystery of the universe and its masterful manipulation with the human minds. The mystic story unravels in a Himalayan climb.",NO DATA
tt10909734,Threshold,Movie,Drama,2020,10.0,Rouzbeh Akhbari,"['tt10909734', 'Armenuhi Burmanyan', 'Metin Emlek', 'Garik Hovhannissyan', 'Soma Hovhannissyan', 'Arsen Ohanjanyan', 'Levon Petrosyan']","['Rouzbeh Akhbari', 'Felix Kalmenson']",An Armenian film director location scouts for an upcoming film on the history of the movement of ideas and contagion along the ancient trade networks which connected the historic Armenian capital of Ani to the world. Along the way he encounters the complex geopolitical realities which impact the region.,64
tt10908892,Mugabe,Movie,Drama,2020,6.0,Robert Peters,"['tt10908892', 'Hakeem Kae-Kazim', 'Jackie Appiah', 'Kenny Kondo', 'Adam Chasema', 'Julene Paton', 'Taurai Kawara', 'Nyaradzo Mutsauri', 'Dalma Chiwereva', 'Nazirah Omar', 'John Dennison']","['Samantha Iwowo', 'Nyaradzo Mutsauri', 'Nyaradzo Mutsauri']",Mugabe rises from being a prisoner to power as a guerrilla fighter but gradually becomes the world's top tyrant. After four decades in power his allies do the unexpected.,120
tt10905522,The Painting,Movie,Drama,2020,3.0,Tuz Sarkany Bogee,"['tt10905522', 'Lili Avramova', 'Tuz Sarkany Bogee', 'Yoan Bozhikov', 'Kalina Georgieva', 'Ellie Hemmings', 'Stefania Paula Ionita', 'Mohamed Kabbah', 'Silje Øksland Krohne', 'Zoe Karolina Kwiatkowska', 'Ruby Lott']",['Valeri Lilov'],"When a group of kids get lost in Hell, they try to find the way back by investigating a series of haunted paintings they discover along the way.",NO DATA
tt10911328,Studenac,Movie,Drama,2020,11.0,Borko Brajovic,"['tt10911328', 'Predrag Vasovic', 'Nikola Boskovic', 'Snezana Horvat', 'Dunja Segrt', 'Tamara Petrovic', 'Miroslav Hudjec', 'Maja Ilic', 'Vladimir Jorgic', 'Djordje Ercevic', 'Predrag Popovic-Pop']",['Borko Brajovic'],"Davor is an ordinary young man living in the countryside. His life is very simple and he likes to play tennis, dreaming of turning pro someday. One day, Davor stops by accident in front of an old house, located very close to an old well. Driven by curiosity he decides to have a closer look. that will turn out to be a big mistake.",89
tt10910894,Beyond The After,Movie,Drama,2020,1.0,Shaun Peter Cunningham,"['tt10910894', 'Cooper Carter', 'Courtney Cheek', 'Emma Lou Cunningham', 'Christine Elizabeth Engel', 'Leila Finn', 'Audrey Lingle', 'Grace Martin', 'Kiko Medrano IV', 'Audrey Medrano', 'Dash Melrose']",['Shaun Peter Cunningham'],"Having successfully made it to The After, the survivors learn that every action has a reaction, but when forced to face their mistakes, will they make amends, or suffer the ultimate consequence?",NO DATA
tt10914194,Angelina Call Girl,Movie,Drama,2020,6.0,Robert Homann-Cauquil,"['tt10914194', 'Badiou', 'Alexandra Balakina', 'Andreas Berger', 'Jakob Buch', 'Tomaso Cannello', 'Alexia Carr', 'Ornella Cauquil', 'Igor Choulman', 'Oliver Chwat', 'Saskia Crehl']","['Ute Homann', 'Robert Homann-Cauquil']","Heiko lives in Berlin, he is a small criminal, and lived together with Angelina, who is always prostituting himself, with politicians, and wealthy men. They both have big dreams. When playing poker, Heiko first wins a lot of money, but at the end of the day he loses all. The mafia guy Bruno makes a deal with Heiko, he should trade Cocaine for him. All the deal went wr... Leer todo",NO DATA
tt10916120,Ik Sandhu Hunda Si,Movie,Drama,2020,2.0,Rakesh Mehta,"['tt10916120', 'Gippy Grewal', 'Neha Sharma', 'Vikramjeet Virk', 'Roshan Prince', 'Dheeraj Kumar', 'Raghveer Boli', 'Jasprem Dhillon', 'Pawan Malhotra', 'Tarsem Paul', 'Babbal Rai']","['Jass Grewal', 'Anooj Kumar Sareen', 'Prince Kanwaljit Singh']","Para luchar contra la corrupción en una universidad Punjab, un estudiante en su último año anuncia su candidatura a Grewal en las elecciones.",115
tt10915060,Crímenes de familia,Movie,Drama,2020,8.0,Sebastián Schindel,"['tt10915060', 'Cecilia Roth', 'Miguel Ángel Solá', 'Benjamín Amadeo', 'Sofía Gala Castiglione', 'Yanina Ávila', 'Diego Cremonesi', 'Paola Barrientos', 'Marcelo Subiotto', 'Claudio Martínez Bel', 'Santiago Ávila']","['Pablo Del Teso', 'Sebastián Schindel']",Alicia emprende un viaje que le cambiará la vida para siempre cuando acusan a su hijo de violar e intentar asesinar a su exmujer.,99
tt10914452,Il legame,Movie,Drama,2020,10.0,Domenico de Feudis,"['tt10914452', 'Riccardo Scamarcio', 'Mía Maestro', 'Giulia Patrignani', 'Mariella Lo Sardo', 'Federica Rosellini', ""Raffaella D'Avella"", 'Sebastiano Filocamo', 'Roberto Negri', 'Antonella Bavaro', 'Susi Rutigliano']","['Daniele Cosci', 'Davide Orsini', 'Domenico de Feudis']","Mientras visita a la madre de su prometido en el sur de Italia, una mujer debe luchar contra la misteriosa y malévola maldición que intenta reclamar a su hija.",93
tt10916036,Andhirikan,Movie,Drama,2020,2.0,Seezan Ali,"['tt10916036', 'Seezan Ali', 'Sheela Najeeb', 'Aminath Rishfa', 'Ahmed Saeed']",['Ahmed Zareer'],After number of miscarriages a woman finds out that she can no longer conceive babies and requires her to make serious decisions to save her marriage.,NO DATA
tt10914712,Romansu dôru,Movie,Drama,2020,1.0,Yuki Tanada,"['tt10914712', 'Yû Aoi', 'Issei Takahashi', 'Kenta Hamano', 'Kitarô', 'Yutaka Mishima', 'Tôko Miura', 'Kôji Ohkura', 'Pierre Taki', 'Eri Watanabe']",['Yuki Tanada'],"It was a pre-destined love and marriage for Sonoko and Tetsuo. They tied the knot and became husband and wife no questions asked. All is well then. Well, perhaps not. Each holds a secret that even the binds of matrimony cannot untie. Sonoko does not know that Tetsuo makes sex dolls or Dutch wives. Sonoko has a secret too. She is about to tell Tetsuo what she has been ... Leer todo",123
tt10917968,Bullied,Movie,Drama,2020,8.0,NO DATA,['tt10917968'],[],NO DATA,NO DATA
tt10916102,Bahut Hua Sammaan,Movie,Drama,2020,10.0,Ashish R. Shukla,"['tt10916102', 'Sanjay Mishra', 'Ram Kapoor', 'Raghav Juyal', 'Dibyendu Bhattacharya', 'Abhishek Chauhan', 'Nidhi Singh', 'Namit Das', 'Flora Saini', 'Rohit Chaudhary', 'Bhupesh Singh']","['Avinash Singh', 'Vijay Narayan Verma']","Con su atraco planeado saliendo mal, Bony y Fundoo se involucran inextricablemente en la búsqueda de ''Kohinoor''.",125
tt10919132,Love Mocktail,Movie,Drama,2020,1.0,Darling Krishna,"['tt10919132', 'Darling Krishna', 'Milana Nagaraj', 'Amrutha Iyengar', 'Abhilaash', 'Rachana Inder', 'Khushi Achar', 'Anupama', 'Geetha Bharathi', 'Dhanush', 'Dinakar']",['Darling Krishna'],Love Mocktail is a romantic and fun film about the protagonist Aadi's quest for love. Life takes him through a rollercoaster ride and goes through varied experience at several stages throughout his search for true love. Does Aadi finally find his soulmate?,153
tt10918984,Color of Vacancy,Movie,Drama,2020,12.0,Kyle Brown,"['tt10918984', 'Brandon Blake', 'Nicholas Conway', 'Chelsea Harris', 'Kim Martin', 'Heather Siess', 'Nick Swezey', 'Charles Walker', 'Bryan Whorton']",['Kyle Brown'],,NO DATA
tt10921468,Mr Johnson,Movie,Drama,2020,,William Collinson,"['tt10921468', 'Paul Slabolepszy', 'Jana Cilliers', 'Graham Hopkins', 'Frank Rautenbach', 'Carla Classen', 'Sisanda Henna', 'Drikus Volschenk', 'Antony Coleman', 'Jailoshini Naidoo', 'Marinus Gubitz']","['William Collinson', 'Ami Di Castri', 'Czerina Patel']","After waking from a 50-year coma at 76, David struggles to accept his aging body and lost time, but he still remembers his college sweetheart, Helena McCarthy.",95
tt10922404,The Blue Rose,Movie,Drama,2020,2.0,Tijuana Layne,"['tt10922404', 'Damien Gulde', 'Jacob Klick', 'Tijuana Layne']",['Tijuana Layne'],A woman drowns herself in a cycle of abuse and alcoholism after the death of her husband. Her husband's friend receives a letter and commits to a promise to help The Blue Rose.,NO DATA
tt10923534,Mendilim Kekik Kokuyor,Movie,Drama,2020,3.0,Hakan Kursun,"['tt10923534', 'Mehmet Çevik', 'Wilma Elles', 'Cetin Buyukakin', 'Basar Alemdar', 'Devrim Yakut', 'Alper Kut', 'Oktay Dal', 'Selim Gürata', 'Radife Baltaoglu', 'Meltem Evcioglu']",['A. Kadir Bozkurt'],The story of a group of soldiers going to Gallipoli War.,107
tt10921436,The Ferryman,Movie,Drama,2020,8.0,Luke Agius,"['tt10921436', 'Marybeth Bonnor', 'Natalia Cricri', ""Adrian D'Arcy"", 'Izaak Love', 'Wongso Marno', 'Alexandra Nicholas', 'Michael Pisciuneri', 'Abel Robinson', 'John Roynon', 'Hayden Simmons']",['Luke Agius'],A struggling taxi driver moonlights as a disposal guy for a serial killer.,90
tt10922066,Ice 2,Movie,Drama,2020,2.0,Zhora Kryzhovnikov,"['tt10922066', 'Alexander Petrov', 'Mariya Aronova', 'Aglaya Tarasova', 'Vitaliya Kornienko', 'Nadezhda Mikhalkova', 'Yuliya Khlynina', 'Sergey Lavygin', 'Adeliya Abdulova', 'Aleksey Antonov', 'Andrey Arseev']","['Zhora Kryzhovnikov', 'Andrey Zolotarev']","Figure skater Nadya and hockey player Sasha got married and more than anything, they dream of a child. However, the price that they will have to pay for this dream is unimaginably high.",132
tt10925824,Iron deficiency,Movie,Drama,2020,10.0,Azadeh Abadpour,"['tt10925824', 'Babak Karimi', 'Sara Miraei', 'Fahimeh Rahimnia', 'Niloofar Soleimani']",['Azadeh Abadpour'],,NO DATA
tt10928202,Hawa,Movie,Drama,2020,,Mejbaur Rahman Sumon,"['tt10928202', 'Chanchal Chowdhury', 'Nazifa Tushi', 'Nasir Uddin Khan', 'Shohel Mondol', 'Sariful Razz', 'Sumon Anowar', 'Md Abid Mallick', 'Bablu Bose', 'Rizvi Rizu', 'Mahmud Alam']","['Mejbaur Rahman Sumon', 'Faruque Jahin Amin', 'Sukorno Shahed Dhiman']","Hawa, una niña que vive sola con su abuela gravemente enferma. Cuando se entera de que Michelle Obama está de visita en París, a Hawa se le ocurre la loca idea de ser adoptada por esta personalidad, a la que admira por encima de todo.",131
tt10930586,Shikara,Movie,Drama,2020,2.0,Vidhu Vinod Chopra,"['tt10930586', 'Sadia Khateeb', 'Zain Khan Durrani', 'Priyanshu Chatterjee', 'Bhavna Chauhan', 'Ashwin Dhar', 'Farid Azad Khan', 'Saghar Sehrai', 'Mushtaq Kak', 'Vinay Raina', 'Anjna Sood']","['Vidhu Vinod Chopra', 'Abhijat Joshi', 'Rahul Pandita']",Shikara is the story of resilience in the face of insurmountable odds. It's also the story of a love that remains unextinguished through 30 years of exile. A timeless love story in the worst of times.,118
tt10934216,Kozhipporu,Movie,Drama,2020,3.0,Jibit George,"['tt10934216', 'Indrans', 'Pauly Valsan', 'Jinoy Janardhanan', 'Navajith Narayanan', 'Sohan Seenulal', 'Jolly Chirayath', 'Sarin', 'Veena Nandakumar', 'Anjali Nair', 'Jibit George']","['Jibit George', 'Jinoy Janardhanan']","The story revolves around two families, portraying their relationship, and how a hen and its eggs changes it over time.",99
tt10935014,Selfie King,Movie,Drama,2020,2.0,Bishal Sapkota,"['tt10935014', 'Bipin Karki', 'Laxmi Bardewa', 'Abhay Baral', 'Jiban Bhattarai', 'Amitesh Shah', 'Dhiren Kunwar']",['Bishal Sapkota'],A Nepali comedian's professional commitment and personal life takes turn during his journey to a far remote region of Nepal for a performance.,119
tt10933000,Beg,Movie,Drama,2020,11.0,Andrey Zagidullin,"['tt10933000', 'Mariya Akhmetzyanova', 'Oleg An', 'Svetlana Bryukhanova', 'Leonid Gromov', 'Valentina Koshkina', 'Nikita Lobanov', 'Polina Maksimova', 'Nadezhda Markina', 'Mariya Minogarova', 'Evgeniy Romantsov']",['Yuliya Idlis'],"Contemporary Moscow. After a car accident, champion athlete Sergey Borozdin suddenly has a psychic ability to see past events. When he becomes a suspect in a series of murders, he is forced to use this ability to find the real killer.",90
tt10934040,Khwab Sare Jhootey,Movie,Drama,2020,2.0,Deepak Baldev,"['tt10934040', 'Ajay Gautam', 'Harsh Kumar', 'Madhu Nambiar', 'Madhu Narayan', 'Ruby Pari', 'Tullika Singh']",['Deepak Baldev'],Young woman who wants to achieve her dreams without realizing the ramifications of her actions.,100
tt10936740,Why Me,Movie,Drama,2020,2.0,Robert D. Parham,"['tt10936740', 'Cynda Williams', 'Hawthorne James', 'Fatima L. Gray', 'Reignea Ford', 'Vanessa Henderson', 'Shania Brown', 'Manuel Brown Jr.', 'Kendal Moseley', 'Valerie Wright', 'John Brooks']","['Earlena Brown', 'Shania Brown']","Crystal is a very outgoing preteen who loves people, loves her life and loves just living. One day she started to change but everyone just assumed she was going through puberty. No one noticed until they had no other choice.",NO DATA
tt10938522,Sticky Toffee Pudding,Movie,Drama,2020,,Harvey John,"['tt10938522', 'Samuel Nicholls', 'Emma-Kate Barry', 'Charlie Howard', 'Genevieve Lewis', 'Callum Henderson', 'Sophie Mae', 'Samuel G Caple', 'Abi Watkinson', 'Maddy Bowyer', 'Jessica Reeve']",['Harvey John'],"Following the death of his best friend, 17-year-old Shelby struggles to readjust back into life at boarding school until popular girl Lilibet decides to take him under her wing. With the aid of her reckless and wealthy group of friends, Shelby finds himself reintroduced to a fast moving world of parties, sex and drugs -- but with life after school quickly approaching ... Leer todo",102
tt10935044,Ashes Over Sun,Movie,Drama,2020,10.0,Bogomil Kalinov,"['tt10935044', 'Julian Vergov', 'Silvia Petkova', 'Alexander Kalinov', 'Anastasia Lyutova', 'Irini Jambonas', 'Stefan Denolyubov', 'Pavel Popandov', 'Niki Iliev', 'Kamen Ivanov', 'Mila Bancheva']","['Alexander Kalinov', 'Bogomil Kalinov', 'Kalin Kalinov']",Dr. Stefanov is in the middle of a huge media scandal due to a patient's death. Antonia is a young journalist who bravely embarks on a journey to uncover what truly happened.,90
tt10937376,White Horse Paradise,Movie,Drama,2020,3.0,Zhibin Zhang,"['tt10937376', 'Yitong Zhou']",['Yitong Zhou'],"The story tells about an era-fusion, about love, about family affection, and about nature. It talks about the relationship between the Baima people, the Han people, the white horse people and nature.",NO DATA
tt10937434,Ultras,Movie,Drama,2020,3.0,Francesco Lettieri,"['tt10937434', 'Aniello Arena', 'Ciro Nacca', 'Antonia Truppo', 'Daniele Vicorito', 'Salvatore Pelliccia', 'Simone Borrelli', 'Gennaro Basile', 'Angelo Caianiello', 'Giuseppe Capozzi', 'Luigi Chiocca']","['Peppe Fiore', 'Francesco Lettieri']","Naples. At almost fifty years old Sandro is the leader of the Apache, a group of ultras with whom he has spent his whole life at the stadium: a life of violence, clashes, passions, and unshakable values. Now that a hooligan prevents him from approaching the curve, those values are starting to falter. He feels for the first time the need for a normal life, a relationsh... Leer todo",108
tt10941528,Sotto il sole di Riccione,Movie,Drama,2020,7.0,Younuts,"['tt10941528', 'Cristiano Caccamo', 'Davide Calgaro', 'Matteo Oscar Giuggioli', 'Ludovica Martino', 'Saul Nanni', 'Fotinì Peluso', 'Claudia Tranchese', 'Lorenzo Zurzolo', 'Isabella Ferrari', 'Luca Ward']","['Caterina Salvadori', 'Enrico Vanzina', 'Ciro Zecca']","De vacaciones en las playas de Riccione, unos adolescentes entablan amistad y se ayudan a lidiar con los amores de verano.",101
tt10944744,The Escape from Auschwitz,Movie,Drama,2020,3.0,Terry Lee Coker,"['tt10944744', 'Elliot Cable', 'Paul Joseph Bonnici', 'Alex Reece', 'David Winfield', 'Joe Stock', ""Paul O'Neill"", 'Tony Fadil', 'Patrick Silke', 'Tappin. Phillip', 'Meyrem Enver']",['Bradley Coker'],"Kazimierz es enviado a Auschwitz, donde transporta cadáveres de las cámaras de gas al crematorio. Tras descubrir que uno de sus amigos está en la lista para ser ejecutado, se promete a sí mismo impedir su muerte.",80
tt10946516,Deney,Movie,Drama,2020,9.0,Birol Kurt,"['tt10946516', 'Büsra Acar', 'Yagiz Aydogan', 'Bedirhan Bariser', 'Ercument Fidan', 'Emel Genç', 'Selcuk Kilic', 'Serdar Yildirim']","['Büsra Acar', 'Yagiz Aydogan', 'Bedirhan Bariser']",A military scientist conducts a sleep experiment and 6 people is selected as subjects,108
tt10944276,Death of a Telemarketer,Movie,Drama,2020,8.0,Khaled Ridgeway,"['tt10944276', 'Lamorne Morris', 'Jackie Earle Haley', 'Haley Joel Osment', 'Alisha Wainwright', 'Woody McClain', 'Matt McGorry', 'Gil Ozeri', 'David So', 'Starletta DuPois', 'Gwen Gottlieb']",['Khaled Ridgeway'],Un vendedor telefónico que habla con suavidad se encuentra a merced del hombre al que trató de estafar.,88
tt10944486,Chick Fight,Movie,Drama,2020,11.0,Paul Leyden,"['tt10944486', 'Malin Akerman', 'Bella Thorne', 'Dulcé Sloan', 'Kevin Connolly', 'Kevin Nash', 'Alec Mapa', 'Dominique Jackson', 'Fortune Feimster', 'Alec Baldwin', 'Alexia Barlier']","['Joseph Downey', 'Hope Bryant']","Cuando Anna Wyncomb es presentada a un club de lucha clandestino, exclusivamente femenino, ella descubre que está mucho más conectada con la historia del club de lo que jamás podría imaginar.",97
tt10945164,Février,Movie,Drama,2021,6.0,Kamen Kalev,"['tt10945164', 'Lachezar Dimitrov', 'Kolyo Dobrev', 'Ivan Nalbantov', 'Hristo Dimitrov-Hindo', 'Milko Lazarov', 'Aleksiya Georgieva', 'Nencho Kostov', 'Nikolay Todorov', 'Stanislav Kondov', 'Stivan Mitev']",['Kamen Kalev'],"The life of a man at the ages of eight, eighteen, and eighty-two",125
tt10944812,Mei yi ge hun dan dou hen you shang,Movie,Drama,2020,,Kan Zhou,['tt10944812'],[],,NO DATA
tt10945328,Madklubben,Movie,Drama,2020,10.0,Barbara Topsøe-Rothenborg,"['tt10945328', 'Stina Ekblad', 'Kirsten Olesen', 'Karoline Hamm', 'Kirsten Lehfeldt', 'Mia Lyhne', 'Troels Lyby', 'Rasmus Botoft', 'Peter Hesse Overgaard', 'Nathalie Ferare', 'Kenny Duerlund']","['Nina Lyng', 'Anne-Marie Olesen', 'Barbara Topsøe-Rothenborg']",Follows three longtime girlfriends from elementary school who are coming into their prime and finding a new lease on life after participating in a cooking course in Italy.,98
tt10948820,I predatori,Movie,Drama,2020,10.0,Pietro Castellitto,"['tt10948820', 'Massimo Popolizio', 'Manuela Mandracchia', 'Giorgio Montanini', 'Pietro Castellitto', 'Dario Cassini', 'Anita Caprioli', 'Marzia Ubaldi', 'Giulia Petrini', 'Liliana Fiorelli', 'Claudio Camilli']",['Pietro Castellitto'],"Two families, one bourgeois and intellectual and the other proletarian and fascist, are brought together by a trivial accident that will bring these two polar-opposites together and set them on a collision course.",NO DATA
