tt10078472,Striver's Row: Faith,Short,Drama,2019,3.0,NO DATA,"['tt10078472', ""A'Darius Bell"", 'Arion Johnson', 'E.J. Manuel', 'Jhsiri Emerson Massey', 'Michael Lamont Sawyers', 'Aaron Davis Warren', 'Rhonnie Washington', 'Rob Young']",[],,NO DATA
tt10077576,Cuando la Música Deja de Sonar,Short,Drama,2019,3.0,NO DATA,"['tt10077576', 'Secun de la Rosa', 'Pablo Escamilla', 'Diego Gurpegui', 'Roberto Millán', 'María José Moreno', 'Ana Soro']",[],Una historia sobre un giro inesperado del destino. Un viaje sin retorno al interior de un cerebro dañado.,15
tt10079752,The Widow,Short,Drama,2019,3.0,NO DATA,"['tt10079752', 'Pirina Dzhupanova', 'Nicolle Marquez', 'Laurence Martin', 'Will Rowlands']",[],"As she tastes the salt on her lips, a widow cannot but cry. But what better place to cool down tears, than a cold lover's lap?",17
tt10079472,Sandman,Short,Drama,2019,3.0,NO DATA,"['tt10079472', 'Nemanja Glavinic', 'Joakim Tasic', 'Radmila Tomovic', 'Vukasin Zdravkovic', 'Ivana Zecevic']",[],"In a crisis period, a conflict within the family pushes the protagonist into reconsidering memories, desires and fears, in a word - dreams.",16
tt10078830,Left Behind,Short,Drama,2019,9.0,NO DATA,"['tt10078830', 'Sibylla Meienberg', 'Jack Weise', 'Deborah Colphon', 'Kevin Stephen-Jones']",[],,7
tt10080208,Subconscious,Short,Drama,2019,2.0,NO DATA,['tt10080208'],[],,4
tt10078708,Iconic,Short,Drama,2019,5.0,NO DATA,"['tt10078708', 'Karina Fontes', 'Jeff Newman', 'Mecca Morgan White', 'Ej Cabasal', 'James Berardo', 'Sam Eaton', 'Jacob Weiss', 'Dylan Brosnan', 'Rocco Rivetti']",[],"It's 1984, Sam Gordin is the lead icon and graphic designer at Brock Computers, an upcoming tech company. As she gets ready for her first ever T.V. interview we soon discover Sam isn't just tapping into the tech world but she is still seen as a woman entering a man's world? Sam is challenged by the dark side of being a female trailblazer in a male-dominated industry a... Leer todo",NO DATA
tt10078984,Come Into Me,Short,Drama,2019,4.0,NO DATA,"['tt10078984', 'Staffan Edenholm', 'Linus Gelber', 'Robert Gulack', 'Kathryn Milewski', 'Alexa Roosevelt', 'Sarah Schoonmaker']",[],"A trafficked girl, a pimp, and a sex client are trapped in their circumstances in New York.",16
tt10079384,Flight,Short,Drama,2019,3.0,NO DATA,"['tt10079384', 'Adam Daniel Mezei', 'Jenna Bowler-Cooke', 'Marianne Thea', 'Telsie Jackson', 'Nicolas Mongillo']",[],"Reflecting back on happier days, the ailing Braxton family struggles to survive in the wake of mother Sarah's bitter raging illness.",NO DATA
tt10078774,Night Out,Short,Drama,2019,2.0,NO DATA,"['tt10078774', 'Danilo Herrera', 'Rebecca Lafon', 'Auberin Strickland']",[],"Sometimes, you find yourself in the most unexpected of places. That is the case with Fernando after a brief encounter with Caroline at the Sugarhouse Motel. The neighboring bed squeaks, arguments between couples, and partying teenagers form an almost oppressive environment. Regardless, the two manage to find some peace that allows them to have a genuine interaction - ... Leer todo",9
tt10078302,To Dance in Prague,Short,Drama,2019,3.0,NO DATA,['tt10078302'],[],"With her husband dead, a woman must choose the shape of her dreams.",NO DATA
tt10078582,Faces In The Sun,Short,Drama,2019,4.0,NO DATA,"['tt10078582', 'Yara Bou Nassar', 'Vanessa Mghames']",[],"Batoul, an apprentice prayer surrogate, doubts the reason why her mentor asked her to have an off day from work. This doubt leads her back to the office and down a path with unexpected consequences.",20
tt10079882,Better than Neil Armstrong,Short,Drama,2019,11.0,NO DATA,"['tt10079882', 'Kian Alipanah', 'Golnoosh Ghahremani', 'Ilia Hasani', 'Nooshika Khodashenas', 'Asal Shakeri']",[],Four kids start their journey to the moon with the mission of finding a mysterious place called The Redland but the gates of Redland are being guarded by a mischievous snake.,20
tt10080142,Floating Islands,Short,Drama,2019,1.0,NO DATA,"['tt10080142', 'Aliya Boulanger', 'Gabrielle Rose', 'Andres Soto', 'Saúl Osorio Camargo', 'Donald Auger', 'Adam Klassen']",[],"Ava, a young counselor at a Christian camp on a Pacific coast island, meets two fugitives from El Salvador who are trying to cross the border into Canada. Over the course of a long day, she must decide whether to help them.",23
tt10081034,Light,Short,Drama,2019,5.0,NO DATA,"['tt10081034', 'Or Shashua', 'Natalia Lozano', 'Ajia Munns', 'Veletta Marshall', 'Jordan Crawford', 'Gina Carillo']",[],"After Lucius abandons his ailing mother, Marie, in her final hours, he finds himself trapped in a strange room. The only way out is for him to seek forgiveness from the people he's hurt most.",8
tt10081024,Late,Short,Drama,2019,11.0,NO DATA,"['tt10081024', 'Liam Coleman', 'Vanessa Riddell', 'Greg Smith']",[],,NO DATA
tt10081152,Streets of London,Short,Drama,2019,4.0,NO DATA,"['tt10081152', 'Maxine Howard', 'Michael Konieczny', 'Caroline Koziol', 'Atul Sharma']",[],,NO DATA
tt10082296,This Time,Short,Drama,2019,7.0,NO DATA,"['tt10082296', 'Ayesha Antoine', 'Felix Scott', 'Kya Garwood']",[],,NO DATA
tt10082710,Cultish Behavior,Short,Drama,2019,5.0,NO DATA,"['tt10082710', 'Royal Allen', 'Elizabeth Austin', 'Rebekah Babelay', 'Drez Ryan', 'Randy Spence', 'Lindsey Whitus']",[],Hannah can't shake the guilt of a past mistake. Joseph is lost in his religious ideals. Esther is caught in the middle. Can God save them or is all innocence lost?,14
tt10082294,The Old Turk,Short,Drama,2019,11.0,NO DATA,"['tt10082294', 'Giselle Cullinane', 'Keith Dickinson', 'Michael Kennedy', 'Sara Mazzanti', 'Matthew Wignall']",[],"A young man enters a pub to confront the dying ex-soldier who murdered his parents, only to discover the truth isn't as he believed.",10
tt10085026,Cactus Boy,Short,Drama,2019,10.0,NO DATA,"['tt10085026', 'Colin Ford', 'Georgie Flores', 'William John Banks', 'Ian Cuson', 'Noah Levia', 'Jennifer Jones Nesbit']",[],"'Cactus Boy' tells the story of Winston Prickle, a grown man who decides to break up with his childhood imaginary friend, Cactus Man.",17
tt10084672,The silence,Short,Drama,2019,1.0,NO DATA,"['tt10084672', 'Claudia Serra']",[],,1
tt10086800,A Call of Inaction,Short,Drama,2019,3.0,NO DATA,"['tt10086800', 'Rhianna Palmer']",[],Loneliness. Powerlessness. Cynicism. These are the feelings a young woman expresses as she comes to grips with rejection and self-loathing as she drifts aimlessly through the glitz and glamour of Hollywood. What happens when your dreams don't come true?,NO DATA
tt10083122,The Death of a Matriarch,Short,Drama,2019,3.0,NO DATA,"['tt10083122', 'Andrew Hannah', 'Elias Kacavas', 'Toni Nagy', 'Nancy Reimer', 'David Szehi']",[],"The Matriarch of a wealthy family is dying, but still within her grips are family secrets she doesn't want to let go of. Her denial of rape culture within society is echoed in her relations to her daughter and granddaughter.",19
tt10085116,Words to Someone Else,Short,Drama,2019,3.0,NO DATA,"['tt10085116', 'Anna Gichan']",[],"A few months ago, my friend, Anna, gave me a call. I let it go to voicemail.",3
tt10086588,Dead Weights,Short,Drama,2019,1.0,NO DATA,"['tt10086588', 'Victor Monroy', 'Carrie Wrigley']",[],,11
tt10082366,A Cup Of Coffee (ACOC),Short,Drama,2019,3.0,NO DATA,"['tt10082366', 'Karishma Singh', 'Dhruv Raaj Bhatia', 'Monika Gupta']",[],"""The film is about two strangers bumping into each-other at a busy café in Delhi, both are going through their own travails of life, get entangled into each other.""",19
tt10084854,Somewhere,Short,Drama,2019,,NO DATA,"['tt10084854', 'Lior Gallner', 'Nissim Lagro', 'Emily Maduel']",[],Two 10-year-old girls are trying to relieve the boredom of Shabbat in the religious town they live in.,16
tt10084892,The Player,Short,Drama,2019,3.0,NO DATA,"['tt10084892', 'Ethan Chapples', 'Carl Medland']",[],"A gay tongue in cheek black comedy. Carl and Tom hook up on a dating app, only to soon discover that when Tom arrives at Carl's doorstep, no one could have predicted the games that were played.",34
tt10082906,The Choice an EnVz Productions film,Short,Drama,2019,3.0,NO DATA,"['tt10082906', 'Ebony N Mayo', 'Cassi Maddox', 'Martin Jakes Jr.', 'Jamila Dyon Smith']",[],,NO DATA
tt10082960,Beckoning,Short,Drama,2019,5.0,NO DATA,"['tt10082960', 'Brittany Aellig', 'Rachel Elizabeth Ames', 'Jacqueline Gritton', 'Claudia Harris', 'Jordan Hesseling', 'Konnie Kern', 'Brooke McCormick', 'Emily Robleza', 'Lon Sierra']",[],"Three women of faith are in the throws of life but God beckons them and as they gather with other women in worship, their burdens fall away in the presence of an almighty God.",NO DATA
tt10085472,Untitled Super 8,Short,Drama,2019,2.0,NO DATA,"['tt10085472', 'Josiah Jacquez', 'Janet Rodriguez', 'Steve Brio']",[],A boy escapes the reality of an abusive father through the lens of an 8 mm camera.,NO DATA
tt10085096,Strike Three,Short,Drama,2019,3.0,NO DATA,"['tt10085096', 'Jacob Beanblossom', 'Mallory Gonyea']",[],"When an escape plan becomes complicated, an innocent accessory must choose between saving her brother and saving herself.",4
tt10086928,A Moment of Sincerity,Short,Drama,2019,3.0,NO DATA,"['tt10086928', 'Josh Bzura', 'Liam Rogers', 'Caroline E. Mitchell', 'Matt Szakal', 'Riley Ayar']",[],"An illustrious and self centered restaurant employee finds himself caught in a love triangle for the ages with a rebellious young girl and her psychopathic boyfriend, when it turns out he may have bitten off more than he can chew",NO DATA
tt10086664,Fleeting,Short,Drama,2019,4.0,NO DATA,"['tt10086664', 'Adam Cage', 'Ashley Hawkins']",[],,NO DATA
tt10084682,Parindey (The Birds),Short,Drama,2019,3.0,NO DATA,"['tt10084682', 'Anil Chapekar', 'Shriram Jog', 'Parag Johari', 'Kavita Koutuk', 'Vaishali Pingle', 'Vicky Pradeep', 'Parmanand Sisodiya']",[],,12
tt10084510,Out?,Short,Drama,2019,5.0,NO DATA,"['tt10084510', 'Dajay Brown', 'Cameron Wilson', 'Louis Stannett', 'Sam Hartwell', 'Azure Phoenix', ""Andrew D'Alton""]",[],"Marcus (Dajay Brown) comes home from University to have a lads night, whilst dealing with a secret. Whilst having fun at this lads night with Jacob (Cameron Wilson), Connor (Louis Stannett) and Evan (Sam Heartwell), Marcus starts to feel uncomfortable with what is being said. He pulls Jacob aside to try and help sort out his feelings, only to have this backfire and th... Leer todo",NO DATA
tt10085156,Little Black Dress,Short,Drama,2019,11.0,NO DATA,"['tt10085156', 'Justin Mirichii', 'Esther Tebandeke']",[],A devastating revelation causes a married woman who has been struggling to have children to reconsider her relationship with her husband. All this happens in the midst of a brewing feminist revolution.,NO DATA
tt10087234,Lift and Separate,Short,Drama,2019,1.0,NO DATA,"['tt10087234', 'Griffin Gardner', 'Amy McAndrew', 'Allison Orr', 'Cindy Vining']",[],"Candace (aka Cinderella) opted to stay with her tacky stepsisters. Now it's high time for her to get out, and stay out.",28
tt10086566,Finding Rhoeshan,Short,Drama,2019,1.0,NO DATA,"['tt10086566', 'Jude Adams', 'Noah Anderson', 'Paige Dooley', 'Peter Macaluso', 'Jack Martin', 'Dirk Martinez', 'Alec May']",[],"After finding a lost paper, a group of friends set out to find the missing person, not knowing the horrors they will uncover.",Formato min incorrecto
tt10085586,Switchblade and Ice Cream,Short,Drama,2019,3.0,NO DATA,"['tt10085586', 'Avril Menting']",[],"In search of a dream, she's a runaway in danger.",NO DATA
tt10086410,I (Don't) Love U,Short,Drama,2019,10.0,NO DATA,"['tt10086410', 'Lauren Analla', 'Blayne Childers', 'Jove Leatherbury']",[],"A newlywed couple's routine argument over finances spirals out of control forcing them to confront their true feelings about one another, no matter the cost.",8
tt10087582,Splittet,Short,Drama,2019,2.0,NO DATA,"['tt10087582', 'Lasse Voss', 'Hans Henrik Clemensen']",[],,NO DATA
tt10087322,Un Court Dimanche,Short,Drama,2019,5.0,NO DATA,"['tt10087322', 'Alizee Durkheim', 'Lou Justine Moua Nedellec', 'Yoni Steiner']",[],,15
tt10087592,Nobody's Son,Short,Drama,2019,4.0,NO DATA,"['tt10087592', 'Tom Nunez', 'Nell Hudson', 'Louise Brealey', 'Osy Ikhile', 'Josh Johnson']",[],"Joe Thompson is a homeless young man in London. Through a series of phone calls, we learn of his troubled life as he finally summons the courage to confront the past that has been haunting him.",NO DATA
tt10087630,Beyond the Leaves,Short,Drama,2019,10.0,NO DATA,"['tt10087630', 'Tyler Harper', 'Shahzaib Raza', 'David Bohrnstedt', 'Devin McBride', 'Rachel Harper', 'Sal Blake']",[],Three friends reunite to seek closure from a traumatic experience they had witnessed as teenagers.,25
tt10089488,The Fisherman's Wife,Short,Drama,2019,10.0,NO DATA,"['tt10089488', 'Dicky Crowell', 'Aaron Dowdy', 'Andrea Lauren Goldman', 'Butch Roth']",[],"The wife of a fisherman lost at sea struggles with denial, loss, grieving and acceptance.",16
tt10089178,Kitchen Shadows,Short,Drama,2019,10.0,NO DATA,"['tt10089178', 'Megan Aspinall', 'Sarah Light', 'Moe Tiong']",[],One extraordinary morning as two talented female chefs seek the perfect dish their dark secrets come alive.,12
tt10089226,Deportación,Short,Drama,2019,9.0,NO DATA,"['tt10089226', 'Megan Caulfield', 'Giulio Santello', 'Herbert Moscoso', 'Jimmy Bacon', 'Brad Perrott', 'Matthew Sharpe']",[],,6
tt10089806,Museum,Short,Drama,2019,10.0,NO DATA,"['tt10089806', 'Ben Amendolara', 'Charity Buckbee', 'Brooks Ginnan', 'David M. Girard', 'Amy Kirkpatrick Rosen']",[],A man struggles with intrusive thoughts and his efforts to confront them.,19
tt10090448,A Temperance Tale,Short,Drama,2019,5.0,NO DATA,"['tt10090448', 'Jan Rigby', 'Richard Rigby', 'Stan Roberts', 'Kate Sandison']",[],"In 1892, in the London of Queen Victoria, Miss Rebecca McCarter hopes fervently that her Magic Lantern show will be a success.",13
tt10092946,The Story of A Character: Kirdaar,Short,Drama,2019,2.0,NO DATA,"['tt10092946', 'Mukesh Chhabra', 'Pooja Gaur', 'Suneel Sinha']",[],,NO DATA
tt10093540,Zdrav,Short,Drama,2019,4.0,NO DATA,"['tt10093540', 'Vladimir Gvojic', 'Strahinja Blazic', 'Mina Obradovic', 'Antonio Andric', 'Bogdan Andric', 'Andrej Bergam', 'Masa Djordjevic', 'Gordana Djurdjevic', 'Marko Prodic', 'Jelena Radenovic']",[],Nemanja is discharged from a psychiatric hospital and is coming back home.,20
tt10091220,Saving Robin Williams,Short,Drama,2019,11.0,NO DATA,"['tt10091220', 'Roger Kabler', 'Lawrence Whitener']",[],Brilliant mathematician breaks Einstein's time-travel theory into the past. It can only be tested once. What would you do to make the world better?,28
tt10089936,Lo que se espera de mí,Short,Drama,2019,4.0,NO DATA,"['tt10089936', 'Elisabet Biosca', 'Gonzalo Ramos']",[],,11
tt10090584,Damaged,Short,Drama,2019,5.0,NO DATA,"['tt10090584', 'Braden Austin', 'Trestin George', 'Dakota Henry', 'Renee Rogoff', 'Emilie Talbot']",[],,NO DATA
tt10091356,Cold Hands,Short,Drama,2019,2.0,NO DATA,"['tt10091356', 'Vahid Davoudpour', 'Sarina Doshmanzari', 'Rozhin Mirseyed', 'Ghazal Moghinami', 'Edwin Rastad', 'Mohsen Shemirani']",[],,NO DATA
tt10092444,Darth Daddy,Short,Drama,2019,3.0,NO DATA,"['tt10092444', 'Monty Lo', 'Nick Ford', 'Ines Laimins', 'Lucia Lam', 'Dash Lo', 'Rachel Malviya', 'Kiran Malviya', 'Kelvin Chow', 'Kimiko Ordich']",[],A seasoned tennis instructor struggles with the idea of steering his life towards a new direction.,18
tt10091582,The Straight Man,Short,Drama,2019,4.0,NO DATA,"['tt10091582', 'David Aleman', 'Lindsay Bailey', 'Anna Bernardi', 'Greg Bernardi', 'Joe Fernandes', 'Carol Casa Hunter', 'Donna Jeanne', 'John Lampasona', 'Lougene Lampasona', 'Amy Laudicano']",[],"After 20 years the surviving member of a comedy team is depressed and going nowhere, until he meets a young reporter who helps him on the road to redemption.",13
tt10090412,La petite sirène,Short,Drama,2019,6.0,NO DATA,"['tt10090412', 'Ziad El May', 'Nawelle Evad', 'Vincent Fontano', 'Julien Hoareau', 'Jessé Paviel']",[],"At the end of their studies, Simon, Paul and Wallace, friends since always, offer a three-day resurrection service and bring back to life, their friend Diane, who died three years earlier. Once again, they all go on a final journey to the sea.",25
tt10091686,Hannah,Short,Drama,2019,4.0,NO DATA,"['tt10091686', 'Kayla Katherine', 'Dimitrije Popovic', 'Madeleine Spa']",[],,NO DATA
tt10090962,Re-rehab,Short,Drama,2019,3.0,NO DATA,"['tt10090962', 'Emrald Jaceil', 'Mary Martin', 'Brohdny Ricketts']",[],"A man, desperate to find his wife after her disappearance, searches for answers through the very technology that may have caused her disappearance in the first place.",10
tt10091148,Brother's Birthday,Short,Drama,2019,5.0,NO DATA,"['tt10091148', 'Justin Avila', 'Italia Ruffalo', 'Germano Blanco', 'Kristen Garrett', 'Jason Markoff']",[],"A group of friends take a road trip during Spring Break to prank their other friend, John, during his brother's birthday week. Unbeknownst to them, a surprise awaits them by the journey's end.",11
tt10091370,Medium,Short,Drama,2019,7.0,NO DATA,"['tt10091370', 'Susan Ateh', 'Jen Bashian', 'Camilla Froude', 'Cooper Hopkins', 'Emanda Pimentel', 'Caroline Sweet', 'Marisa Van Den Borre']",[],,5
tt10090912,Waters of Babylon,Short,Drama,2019,2.0,NO DATA,"['tt10090912', 'Kevin Miner', 'Simon Jon Provan', 'Edison Roth', 'Alistair Sewell']",[],"In the midst of grief, a father wrestles with his desire for justice and vengeance.",6
tt10090088,Ivan,Short,Drama,2019,3.0,NO DATA,"['tt10090088', 'Ivan Barnev', 'Phillip Avramov', 'Veselin Anchev', 'Igor Knyazev', 'Neno Koynarski', 'Kristina Kulish', 'Luizabel Nikolova', 'Ylia Petrova', 'Mihail Sarvanski', 'Radi Stoyanov']",[],,NO DATA
tt10090766,Raining Dogs,Short,Drama,2019,11.0,NO DATA,"['tt10090766', 'Caroline Hatem', 'Said Serhan']",[],A young boy is forced to face his biggest fears in order to find out what kind of trouble his parents are in.,20
tt10094226,Favoriten,Short,Drama,2019,5.0,NO DATA,"['tt10094226', 'Renate Baier', 'Christian Dolezal', 'Günther Lainer', 'Lia Wilfing']",[],"After falling out with her mother, young Sofia hitchhikes southwards in search of the father she never had.",18
tt10096234,Failure,Short,Drama,2019,3.0,NO DATA,"['tt10096234', 'Chase Lomboy']",[],,NO DATA
tt10096228,2nd Chance,Short,Drama,2019,2.0,NO DATA,"['tt10096228', 'Tatiana Bilan', 'Evi Stamatiou', 'Hugo Teugels']",[],"A girl lost her sister in the same place where her father disappeared. It happened exactly one year ago, and now she wonders if it's her turn.",NO DATA
tt10094382,Falling,Short,Drama,2019,3.0,NO DATA,"['tt10094382', 'Mary Charles Miller']",[],"A young teen, Joy, has to make a difficult choice after her mother discovers her secret. She makes a social media post to tell others about her experiences and personal beliefs.",9
tt10096188,The Long Commute,Short,Drama,2019,8.0,NO DATA,"['tt10096188', 'Anthony Robert Grasso', 'Jolie Lo Grasso', 'Marvin Johnson', 'Geraldine Leer', 'Godfrey J. Rayner']",[],A workaholic businessman attempting to reconnect with his estranged father discovers that time is unforgiving.,18
tt10096120,Shilouette,Short,Drama,2019,1.0,NO DATA,"['tt10096120', 'Marcus Massey']",[],,NO DATA
tt10097502,Tell Me What to Say,Short,Drama,2019,3.0,NO DATA,"['tt10097502', 'Isabelle Abel', 'Tara Milante']",[],,NO DATA
tt10097392,Most Wanted,Short,Drama,2019,3.0,NO DATA,"['tt10097392', 'Chris Boudreaux', 'Jermaine Davis']",[],,NO DATA
tt10097418,I Don't Want Your Help,Short,Drama,2019,3.0,NO DATA,"['tt10097418', 'Anadelle Phillips', 'Monica Phillips']",[],,NO DATA
tt10097462,Drop Your Attitude,Short,Drama,2019,3.0,NO DATA,"['tt10097462', 'Henry Robinson', 'Michael Turner']",[],,NO DATA
tt10097546,Richard & Cole,Short,Drama,2019,3.0,NO DATA,"['tt10097546', 'Benton Bohannon', 'Ross Howard']",[],,NO DATA
tt10097440,She Didn't Love Me,Short,Drama,2019,3.0,NO DATA,"['tt10097440', 'Anadelle Phillips']",[],,NO DATA
tt10097450,Tell Me Why,Short,Drama,2019,3.0,NO DATA,"['tt10097450', 'Henry Robinson']",[],,NO DATA
tt10097494,It Ends Now,Short,Drama,2019,3.0,NO DATA,"['tt10097494', 'David Granados', 'Alessandra Mañon']",[],,NO DATA
tt10097402,You're No Friend of Mine,Short,Drama,2019,3.0,NO DATA,"['tt10097402', 'Dennis Boyd', 'Kevin A Wright', 'Angelica Zuenko']",[],,NO DATA
tt10097478,Moving Up,Short,Drama,2019,3.0,NO DATA,"['tt10097478', 'Andi Sweeney Blanco', 'Rodrigo Rojas']",[],,NO DATA
tt10097400,Road to Hell,Short,Drama,2019,3.0,NO DATA,"['tt10097400', 'Jermaine Davis', 'Kevin A Wright']",[],,NO DATA
tt10097408,I Won't Lie,Short,Drama,2019,3.0,NO DATA,"['tt10097408', 'Anadelle Phillips', 'David Sanepour']",[],,NO DATA
tt10097050,The Best Best Friend,Short,Drama,2019,5.0,NO DATA,"['tt10097050', 'Claira Williams', 'Carly Kramer', 'Grace H Bryan', 'Sydney Villacortabuer', 'Harley Renault', 'Monica Kramer', 'Faith Hendrix']",[],"Lisa has spent her entire life with her older sister, Lauren, as her best friend. Upon Lisa's 13th birthday, Lauren decides that Lisa needs to learn how to actually make friends.",18
tt10097488,You've Been Hurt,Short,Drama,2019,3.0,NO DATA,"['tt10097488', 'Alessandra Mañon', 'Henry Robinson']",[],,NO DATA
tt10097474,Credit,Short,Drama,2019,3.0,NO DATA,"['tt10097474', 'Andi Sweeney Blanco', 'Neil Dickson']",[],"A young journalist intern discovers how harsh the world she has ventured into when she begins having to fight for her right to be credited for her own work. In a world where women are still fighting to be taken seriously in corporate settings, she leans on her integrity and commitment to what is right for power and support.",NO DATA
tt10098140,Rachel,Short,Drama,2019,9.0,NO DATA,"['tt10098140', 'Jodie Whittaker', 'Kate Ashfield', 'Sarah Beck Mather', 'Sophie P. Correa-Smith', 'Gabriel de Laage', 'Sébastien de Laage', 'Emily Frain', 'Stella Kammel', 'Laura McAlpine', 'Jason Milligan']",[],"When a rare chance for a meeting with her estranged daughter presents itself, Rachel grabs it with both hands.",11
tt10098334,Flee,Short,Drama,2019,3.0,NO DATA,"['tt10098334', 'Leon Cambray', 'Fiona Darlow', 'Ian Bell', 'Julian Winchester', 'David John', 'Elsa Grenon', 'Shimon Lopez', 'Silvano De Simone', 'Ted Rowe', 'Onute Maneikyte']",[],"A young man decides to run away to escape from his life at home. However, troubles arrive fueled by his own crippling anxiety that put his hopes of survival and the promise of a new life in danger.",7
tt10097562,The Statement,Short,Drama,2019,3.0,NO DATA,"['tt10097562', 'Andi Sweeney Blanco', 'Bahram Khosraviani']",[],"When a wealthy socialite family in Mexico hire a new body guard for their protection, due to a recent influx of threats against them, they come to discover their new protector has a dark past that will put them all in greater danger than they could have foreseen. A gritty look at the frequency of kidnappings in Mexico today, The Statement follows the journey of a youn... Leer todo",NO DATA
tt10097526,The Old Me,Short,Drama,2019,3.0,NO DATA,"['tt10097526', 'Benton Bohannon']",[],,NO DATA
tt10097576,Monday at Three,Short,Drama,2019,4.0,NO DATA,"['tt10097576', 'Andrew Burdette', 'Phage Nolte']",[],A young Woman struggles with the consequences of an important decision.,6
tt10098076,The Spirit,Short,Drama,2019,10.0,NO DATA,"['tt10098076', 'Laura Scheirich', 'Bruce Hughes', 'Casey Asplin', 'Jack Charles', 'Rowan Landers', 'Kathleen Mary Lee', 'Sofia Marshall', 'David Perkins', 'Vaughn Rae', 'Jah Suwannasiri']",[],"In dystopian Melbourne, a wandering, benevolent ghost must come to terms with her past.",10
tt10102358,End of Term,Short,Drama,2019,5.0,NO DATA,"['tt10102358', 'Albert Emery', 'Pantelis Kodogiannis']",[],"When depressed addict John (Albert Emery) hears the rumors that his college might be closing again for the second time. John confronts Steven Clark (Pantelis Kodogiannis) about the rumors surrounding the closure. John's future potentially at risk, he decides to take things into his own hands.",NO DATA
tt10098476,Oleuba,Short,Drama,2019,3.0,NO DATA,"['tt10098476', 'Dermot Arrigan', 'Nicolás Rivero', 'Ricard Salom', 'Luis Siles', 'Cristina Vidal']",[],,NO DATA
tt10098064,break,Short,Drama,2019,5.0,NO DATA,"['tt10098064', 'Madjid Alaei', 'Atefeh Saniee']",[],"Nazanin leaves Iran to visit her boyfriend Arash in Australia, while pretending to her traditional family she is going to a conference in Dubai. However, her holiday is interrupted by the news of her father's sudden passing, forcing Nazanin to make a critical decision - staying with Arash or returning to Iran and running the risk of never being able to come back to Au... Leer todo",15
tt10098492,Amar,Short,Drama,2019,9.0,NO DATA,"['tt10098492', 'Kate Barakis', 'Emily Seif', 'Donia Salem', 'Odette Kassab', 'Shea MacDonough', 'Jamie Aditya', 'Abdullah Bakhsh', 'Michael Andrew Buxton', 'Mariam Chakielli', 'Chido Mwaturura']",[],"Wedding of the Century is a short film funded by SBS and Film Victoria that follows the story of Amar, a 28-year-old Muslim woman with Down syndrome. Amar is secretly planning the wedding of her dreams amidst her parents' struggle with unwanted community prejudice, discrimination and marginalisation. The film highlights ways in which society isolates and excludes peop... Leer todo",NO DATA
tt10102830,The Tyrant,Short,Drama,2019,4.0,NO DATA,"['tt10102830', 'Mattias Kindberg', 'Michael Petersson', 'Margareta Pettersson']",[],Daniel can't stand the abuse anymore - and decides to fight fire with fire.,12
tt10098186,Confession,Short,Drama,2019,3.0,NO DATA,['tt10098186'],[],,NO DATA
tt10100178,Signal,Short,Drama,2019,11.0,NO DATA,"['tt10100178', 'Gabriel Brown', 'Sujata Day']",[],A couple surviving in a post-apocalyptic landscape reach a crossroads in their relationship and must decide whether to stay together or split up.,19
