tt10431512,Nartai,Movie,Drama,2020,3.0,Vakhtang Khubutia,"['tt10431512', 'Henry Buchmann', 'Grigoriy Chaban', 'Antoine Doukravets', 'Konrad Hollenstein', 'Sofya Skya', 'Anna Starchenko', 'Sharifbek Zakirov']",['Sergey Kaluzhanov'],"1990-s. Russian circus actor Edik Petrov steals the T-72 tank and flees to Germany. Accidentally, Edik kidnaps Nartai - the tank's driver. While Edik left his «no future» country on purpose, Nartai was brought to Germany against his will.",NO DATA
tt10431572,Sorido eopsi,Movie,Drama,2020,10.0,Hong Eui-jeong,"['tt10431572', 'Yoo Ah-in', 'Yoo Jae-myung', 'Moon Seung-ah', 'Lee Ka-eun', 'Jo Ha-seok', 'Seung Hyung-bae', 'Im Kang-sung', 'Yoo Seong-ju', 'Kim Ja-yeong', 'Seo Dong-soo']",['Hong Eui-jeong'],"Two men work for a criminal organization to clean up the aftermath messes. One day, they receive an unexpected order.",NO DATA
tt10434142,Las niñas,Movie,Drama,2020,9.0,Pilar Palomero,"['tt10434142', 'Andrea Fandos', 'Natalia de Molina', 'Zoé Arnao', 'Julia Sierra', 'Francesca Piñón', 'Ainara Nieto', 'Elisa Martínez', 'Carlota Gurpegui', 'Daniel García', 'Jesusa Andany']",['Pilar Palomero'],"Celia, una niña de 11 años que estudia en un colegio de monjas y vive con su madre, una viuda de 30 años, se adentra en su adolescencia tras la llegada de una nueva compañera de clase.",97
tt10433624,Carmen Vidal Mujer Detective,Movie,Drama,2020,11.0,Eva Dans,"['tt10433624', 'Eva Dans', 'Roberto Suárez', 'Luciano Demarco', 'Leonor Courtoisie', 'Nicolás Luzardo', 'Bruno Contenti', 'Gimena González']",['Eva Dans'],"Carmen Vidal is a private detective addicted to pizza, beer and marijuana who fights against a criminal Senator to avenge the death of her colleague, in a modern film noir about self-improvement.",70
tt10436970,Un Domingo de Julio en Santiago,Movie,Drama,2020,,Gopal Ibarra,"['tt10436970', 'Daniel Alcaíno', 'Alejandro Castillo', 'Francisco Dañobeitía', 'Camila Hirane', 'Grimanesa Jiménez', 'Hugo Medina', 'Magdalena Müller', 'Alejandro Rivas', 'Catalina Saavedra', 'Daniela Vega']","['Gopal Ibarra', 'Visnu Ibarra']",,90
tt10441806,Biz Böyleyiz,Movie,Drama,2020,1.0,Caner Özyurtlu,"['tt10441806', 'Berrak Tüzünataç', 'Engin Öztürk', 'Sebnem Bozoklu', 'Özge Özpirinçci', 'Meric Aral', 'Boran Kuzum', 'Hümeyra', 'Burak Altay', 'Cihan Ayger', 'Melih Duzenli']","['Meliksah Altuntas', 'Berrak Tüzünataç', 'Caner Özyurtlu']",A group of old friends get together to be with their beloved aunt/grandmother who took care of them when they were kids for her last days. And things get complicated.,121
tt10441822,The Nowhere Inn,Movie,Drama,2021,9.0,Bill Benz,"['tt10441822', 'St. Vincent', 'Ezra Buzzington', 'Toko Yasuda', 'Chris Aquilino', 'Drew Connick', 'Carrie Brownstein', 'Tema Louise Sall', 'Erica Acevedo', 'Sean Liang', 'Sarah Tither-Kaplan']","['Carrie Brownstein', 'St. Vincent']","St. Vincent se propone hacer un documental sobre su música, pero cuando contrata a un amigo cercano para que lo dirija, las nociones de realidad, identidad y autenticidad se vuelven cada vez más distorsionadas y extrañas.",91
tt10442766,The Life Peddler,Movie,Drama,2020,5.0,Jose Mojica,"['tt10442766', 'Stan Houston', 'Tina Gloss', 'Michael Gordon', 'Peter Knox', 'Sonja Crosby', 'Mark Finnell', 'Jovany Torres', 'Don Klenk', 'Alexander Ross', 'Molly Gibson']",['Jose Mojica'],All hope is lost for Michael to keep his wife alive when Susan decides she's done fighting cancer and ends her chemotherapy treatments. That is until an old salesman offers him a mysterious box. The box can extend Susan's life using the memories embedded in the walls of their house. But Michael soon finds out that using the box comes with severe consequences.,105
tt10441958,La bonne épouse,Movie,Drama,2020,6.0,Martin Provost,"['tt10441958', 'Juliette Binoche', 'Yolande Moreau', 'Noémie Lvovsky', 'Edouard Baer', 'François Berléand', 'Marie Zabukovec', 'Anamaria Vartolomei', 'Lily Taieb', 'Pauline Briand', 'Armelle']","['Martin Provost', 'Séverine Werba']","Paulette y su esposo dirigen una escuela de limpieza, tras su repentina muerte, Paulette descubre que la escuela está al borde de la quiebra y tiene que asumir sus responsabilidades.",109
tt10443396,Reunion,Movie,Drama,2020,7.0,Alex Tweddle,['tt10443396'],"['Andrew Bullas', 'Alex Tweddle']","Two brothers, one a child genius are reunited after many years apart. Over the course of one night, revelations about their past lives are revealed with shocking consequences for both of them.",Formato min incorrecto
tt10442666,She Paradise,Movie,Drama,2020,4.0,Maya Cozier,"['tt10442666', 'Michael Cherrie', 'Kimberly Crichton', 'Denisia Latchman', 'Kern Mollineau', 'Onessa Nestor', 'Chelsey Rampersad']","['Melina Brown', 'Maya Cozier']","A teenage girl stumbles upon a free-spirited dance crew, leading to alluring but unsettling encounters with nightlife and money.",71
tt10448528,Ernesto,Movie,Drama,2020,11.0,Alice De Luca,"['tt10448528', 'Ilaria Bevere', 'Rodolfo Cascino-Dessy', 'Nicoletta Cifariello', 'Luca Ingravalle', 'Silvia Micunco', 'Federico Russo', 'Leonardo Venturi', 'Blu Yoshimi']","['Alice De Luca', 'Giacomo Raffaelli']","Ernesto (Federico Russo) is a teenager who wanders, in search of himself, through the streets of Rome. Chapter after chapter, time passes and people just disappear but he continues to live impromptu relationships, causing pain to himself and to others. Taking refuge in his happy moments and in political ideologies, he believes he can save his soul from suffering altho... Leer todo",76
tt10448820,Saturday School,Movie,Drama,2020,8.0,Tyrone Breaux,"['tt10448820', 'Blake Alexander', 'Sophia Arguelles', 'Kahlo De Jesus Buffington', ""Odalis De La O'Cortez"", 'Kane Filbeck', 'Cherie Johnson']",['William Perdue'],"After a teacher's purse gets stolen, five suspected kids, get sent to Saturday School.",86
tt10452854,The 24th,Movie,Drama,2020,8.0,Kevin Willmott,"['tt10452854', 'Timaine Bryant', 'Trai Byers', 'Bashir Salahuddin', 'Aja Naomi King', 'Mo McRae', 'Tosin Morohunfola', 'Mykelti Williamson', 'Thomas Haden Church', 'Lorenzo Yearby', 'Cuyle Carvin']","['Kevin Willmott', 'Trai Byers']","It is the story of the all-black Twenty-Fourth United States Infantry Regiment, and the Houston Riot of 1917.",113
tt10451852,Nine Days,Movie,Drama,2022,1.0,Edson Oda,"['tt10451852', 'Winston Duke', 'Zazie Beetz', 'Bill Skarsgård', 'Benedict Wong', 'Tony Hale', 'David Rysdahl', 'Elizaveta Shaikhulina', 'Taran Marshall', 'Brandy Pitcher', 'Caleb Fralick']",['Edson Oda'],Un hombre solitario lleva a cabo una serie de entrevistas con almas humanas para tener la oportunidad de nacer.,124
tt10452184,She's the Eldest,Movie,Drama,2020,10.0,Cate Jones,"['tt10452184', 'Mary Buss', 'Cate Jones', 'Mickey Reece', 'Kyle Penington', 'Alex Sanchez', 'Jacob Ryan Snovel', 'Julien Cash Reece', 'Ginger Gilmartin', 'Laurie Cummings', 'Kato Buss']",['Cate Jones'],Three eccentric siblings return to their childhood home to reconnect but end up digging up the past of their parents' mysterious disappearances.,NO DATA
tt10452766,Uppercase Print,Movie,Drama,2021,7.0,Radu Jude,"['tt10452766', 'Serban Lazarovici', 'Bogdan Zamfir', 'Ioana Iacob', 'Serban Pavlu', 'Alexandru Potocean', 'Silvian Vâlcu', 'Constantin Dogioiu', 'Gianina Carbunariu', 'Doru Catanescu', 'Nicolae Ceausescu']","['Gianina Carbunariu', 'Radu Jude']","Relata la historia de Mugur Calinescu, un adolescente rumano que escribió mensajes de graffiti de protesta contra el régimen del dictador Nicolae Ceausescu y que posteriormente fue aprehendido por la policía secreta.",128
tt10456358,Akash ongshoto meghla,Movie,Drama,2020,,Joydeep Mukherjee,"['tt10456358', 'Rudranil Ghosh', 'Rahul Banerjee', 'Ankita Chakraborty', 'Koushik Kar', 'Md Ahmad', 'Taranga Banerjee', 'Arpita Banik', 'Daminee Benny Basu', 'Shyamal Bhattacharjee', 'Sanjay Biswas']",['Joydeep Mukherjee'],"The film connects apparently disconnected stories of two men who have lost their way of life as a consequence of unexpected lockout or closure of factory. Rasomoy Bagchi used to work in a Jute mill as a labor until his factory announces an unexpected Lockout. Life of Rasomoy, his wife and daughter was shattered all of a sudden. Another story unfolds 7-8 years later. A... Leer todo",105
tt10457702,Bound,Movie,Drama,2020,7.0,Jokes Yanes,"['tt10457702', 'Ciro Dapagio']","['J. Bishop', 'Ciro Dapagio', 'Jokes Yanes']",Bondsman Voss a retired Lt Col. will dive head first into the Mexican cartels home turf to try and rescue a childhood friends daughter from a ruthless band of sex traffickers who lack any type of empathy for humanity.,NO DATA
tt10457128,Été 85,Movie,Drama,2020,9.0,François Ozon,"['tt10457128', 'Félix Lefebvre', 'Benjamin Voisin', 'Philippine Velge', 'Valeria Bruni Tedeschi', 'Melvil Poupaud', 'Isabelle Nanty', 'Laurent Fernandez', 'Aurore Broutin', 'Bruno Lochet', 'Yoann Zimmer']","['Aidan Chambers', 'François Ozon']","Un joven de 16 años en la costa de Normandía en los 80 no sueña ni con un mejor amigo, ni con un pacto adolescente, ni con aventuras de verano en moto o en barco, sino con la muerte. De vacaciones, Alexis comienza a conocerse a sí mismo.",101
tt10456640,Present Still Perfect,Movie,Drama,2020,3.0,Anusorn Soisa-Ngim,"['tt10456640', 'Darina Boonchu', 'Anusorn Soisa-Ngim', 'Kritsana Maroukasonti', 'Dhamawat Suntanaphan', 'Adisorn Tonawanik', 'Aunruen Soisangim', 'Chalida Sutitosatham', 'Ryota Omi', 'Lakkana Punwichai']",['Anusorn Soisa-Ngim'],"Present Still Perfect is the sequel to its first chapter when ""Toey"" fall in love with ""Oat"", the cool guy who was about to get married. That journey had been hurting ""Toey"" and caused him so many questions. Four years later, he accidentally met Oat at the airport. All the pains came back to him once again. As a result, he decided to go rest his heart at ""Koh Kood"", T... Leer todo",114
tt10461238,Scorpio,Movie,Drama,2020,10.0,Julian Noble,"['tt10461238', 'Cecilia Camarena', 'Margarita Chavarría', 'Arturo del Ángel', 'Tina French', 'Edgar Marchena', 'Roberto Mares', 'Arturo Olivares', 'Arturo Orutra', 'Gustavo Sánchez Parra', 'Luis Eduardo Yee']",['Julian Noble'],"Juan is a modest young man who is new to the city. Falling in love with his neighbor Maria, he begins to uncover the mysteries that surround the Motel where he lives. In the process, he immerses himself into his own darkness.",127
tt10463488,Podsolnukh,Movie,Drama,2020,2.0,Fyodor Petrukhin,"['tt10463488', 'Aleksandrina Adamova', 'Andrey Chubchenko', 'Taras Dobrovolskiy', 'Oleg Efimenko', 'Evgeniy Ermakov', 'Andrey Esin', 'Dmitriy Gudochkin', 'Alesa Kacher', 'Olga Matrokhina', 'Mikhail Negin']",['Irina Subbotina'],,106
tt10466338,Whirlpool,Movie,Drama,2020,9.0,Emory Parker,"['tt10466338', 'Jolie Curtsinger']",['Emory Parker'],,NO DATA
tt10464930,Palindrome,Movie,Drama,2020,8.0,Marcus Flemmings,"['tt10464930', 'Tábata Cerezo', 'Hester Ruoff', 'Sarah Swain', 'Gabriel Cagan', 'Karishma Bhandari', 'Daniel Jordan', 'Ingrid Evans', 'Thomasin Lockwood', 'Yuk Man', 'Ariya Larker']",['Marcus Flemmings'],"Young black man Fred struggles to find freedom in modern Britain. Set against the backdrop of Brexit and its impending doom! Interwoven with this is a LGBTQ tale of a love triangle of three matriarchal characters - both stories dealing with slavery, gentrification, art, love, race, mental health and politics.",112
tt10469804,Teddy,Movie,Drama,2021,6.0,Ludovic Boukherma,"['tt10469804', 'Anthony Bajon', 'Christine Gautier', 'Ludovic Torrent', 'Guillaume Mattera', 'Noémie Lvovsky', 'Jean-Paul Fabre', 'Jean-Michel Ricart', 'Alain Boitel', 'Thierry Nou', 'Jeannine Dufour']","['Ludovic Boukherma', 'Zoran Boukherma']","En un pueblo rural francés, Teddy, de veintitantos años, es arañado por una bestia desconocida y poco a poco experimenta cambios aterradores.",88
tt10473076,Miles Away Under the Moon,Movie,Drama,2020,,Htoo Paing Zaw Oo,"['tt10473076', 'Ku Ku Zin Aung', 'Daung', 'Aung Zayyar Min Htin', 'Ye Htut', 'Mya Hnin Yee Lwin', 'Arkar Myo Min', 'Win Khant Moe', 'Shine', 'Htate Htar Thazin', 'Yi Wai Yan']",['Jue'],,NO DATA
tt10471804,Crónica de una tormenta,Movie,Drama,2020,8.0,Mariana Barassi,"['tt10471804', 'Clara Lago', 'Ernesto Alterio', 'Quique Fernández']","['Clara Lago', 'Ernesto Alterio', 'Quique Fernández']",Un importante editor de un periódico debe elegir a su próximo sucesor. Esta decisión acabará siendo un peligroso juego sexual y de poder.,84
tt10472290,Lxs chicxs de las motitos,Movie,Drama,2020,7.0,Inés María Barrionuevo,"['tt10472290', 'Erika Cuello', 'Carolina Godoy', 'Carla Gusolfino', 'Ignacio Pedrone']",['Gabriela Vidal'],"Juliana and Lautaro live in a poor neighborhood surrounded by policemen. They are in love, and they are facing an unwanted pregnancy. They don't know what to do. Who will they turn to avoid illegality and abandonment? Juliana's mother, Flor, notice what is going on and decides to take action. Afterward, the teenagers will meet again.",84
tt10476500,STWFA,Movie,Drama,2020,3.0,Benyamin Aki,"['tt10476500', 'Bethany Hazelitt', 'Drew Sherston', 'Ryan Jesse', 'Zack Davis', 'Antonella Sinishtaj', 'Sydney Brown Birch', 'Aaron Matthew Atkisson', 'Sarah Barney', 'Alexandria Barron', 'Joshua Bootz']","['Bethany Hazelitt', 'Drew Sherston', 'Ryan Jesse']",This film follows four siblings in the 18 months after their parents die. Andrew (23) is now in charge of Mike and Liz( seniors in high school) and Reagan(7),NO DATA
tt10475916,Historias incompletas,Movie,Drama,2020,12.0,Guillermo González Lanchares,"['tt10475916', 'Carmen Criprés', 'Cristina de Inza', 'Triana Lange', 'Mikeka Nshimbi', 'Lydia Gervás', 'Fernando Bardera', 'Álvaro Blázquez', 'Carmen Bolena', 'Ana Cantero', 'Laura Castillo']","['Guillermo González Lanchares', 'Álvaro Hervás', 'Manuel Mejías']",,NO DATA
tt10477300,The Road to Cabazon,Movie,Drama,2020,5.0,Jackson Begley,"['tt10477300', 'Chris Korkalo', 'Mark Huber', 'Lila Korkalo', 'Robert Shepherd', ""Kera O'Bryon"", 'Daniel Rylee Bush', 'Connor McLean', 'Jennifer Pyle', 'Joel King', 'Kwame Rakes']",['Jackson Begley'],"Sam just lost custody of his daughter, Emma. As a last-ditch-effort to connect with Emma, Sam decides to drive her across country to her mother on the west coast. Things get complicated when Sam is unable to drive and his ex-brother-in-law, Dave, must do the job.",NO DATA
tt10477668,My Sisters,Movie,Drama,2020,9.0,Adam Justice Hardy,"['tt10477668', 'Chandler Young', 'Shanera Richardson', 'Nadia Marina', 'Diana Sanchez', 'Taamu Wuya', 'Chelsea Averill', 'Cait Bidwell', 'Jonathan Bocinsky', 'Carson Cash', 'Ken Jones Comedian']",['Adam Justice Hardy'],A women's support group becomes the target of a misogynistic brotherhood.,91
tt10481890,Kholodno,Movie,Drama,2020,3.0,Avdotya Aleksandrova,"['tt10481890', 'Evgeniy Alyokhin', 'Egor Baranov', 'Klarissa Barskaya', 'Veta Geraskina', 'Donatas Grudovich', 'Dmitriy Kubasov', 'Maksim Shpuga', 'Konstantin Strokolskiy']",['Avdotya Aleksandrova'],"A young failed writer lives in a secluded house far from the city on the coast of the Gulf of Finland. His wife, a former actress, tries to restore her career at a modern city theatre after the birth of their child. Today, like many other times, she leaves the son in the care of the father, who not only deals with the child rather ineptly, but also gets drunk regularl... Leer todo",93
tt10476718,Deathwell,Movie,Drama,2020,10.0,Ethan Allen,"['tt10476718', 'Mina Tobias', 'Dakota Sawyer', 'Benjamin J. Welch', 'Ethan Allen', 'Demitra Sealy', 'L. Emille Thomas', 'Jessica Lelia Greene', 'Serena Kashmir', 'Andrew J. Jackson', 'Braxton Hale']",['Ethan Allen'],Ciudadanos inocentes se convierten en enemigos del estado es este noir preapocalíptico.,79
tt10482066,Beware of Dog,Movie,Drama,2020,1.0,Nadia Bedzhanova,"['tt10482066', 'Buddy Duress', 'Kevin Iso', 'Paula Knüpling', 'Gladston Makhib', 'Elena Nesterova', 'Dan Perlman', 'Marina Prados', 'Emily Bahr-de Stefano', 'Pavel Tabakov', 'Marina Vasileva']",['Nadia Bedzhanova'],"Alienada en un Moscú políticamente ambiguo, una joven lidia con un TOC severo, mientras que su prima en Berlín intenta construir una relación romántica ignorando su propia condición.",88
tt10482072,Mayar Jonjal,Movie,Drama,2020,8.0,Indranil Roychowdhury,"['tt10482072', 'Kamalika Banerjee', 'Paran Banerjee', 'Bratya Basu', 'Ritwick Chakraborty', 'Saoli Chattopadhyay', 'Chandrayee Ghosh', 'Wahida Mollick Jolly', 'Aupee Karim', 'Shohel Mondol', 'Mustafiz Shahin']","['Manik Bandopadhaya', 'Indranil Roychowdhury', 'Sugata Sinha']",A petty criminal who loves a whore and wants to run away with her savings meets a laid-off factory worker who is desperate to stop his wife from working as a housemaid.,101
tt10481968,The Lion Rock,Movie,Drama,2020,1.0,Rosario Scandura,"['tt10481968', 'Marco Iermanò', 'Rosanna Sapia', 'Laura Gigante', 'Piergiuseppe Giuffrida', 'Federico Guglielmino', 'Gino Astorina']",['Rosario Scandura'],"The Lion Rock is a movie rich with nostalgia, sweetness, drama and comedy. The main character Saro, is a 10 year old boy who lives in a small fishing village named Santa Maria La Scala in Sicily (Italy). Saro has a secret friend, a sea-rock. It is here where Saro ventures at night, pulled by the sound of the crashing waves and pale moon reflecting off the clear water.... Leer todo",97
tt10482504,The Trip to Greece,Movie,Drama,2020,5.0,Michael Winterbottom,"['tt10482504', 'Steve Coogan', 'Rob Brydon', 'Claire Keelan', 'Rebecca Johnson', 'Marta Barrio', 'Tim Leach', 'Cordelia Bugeja', 'Justin Edwards', 'Tessa Walker', 'Richard Clews']","['Steve Coogan', 'Rob Brydon', 'Claire Keelan']",Actors Rob Brydon and Steve Coogan travel from Troy to Ithaca following in the footsteps of the Odysseus.,103
tt10482802,The Lamp of Truth,Movie,Drama,2020,2.0,Thanesh Gopal,"['tt10482802', 'T. Varatharajah']",['Thanesh Gopal'],A soul stirring film based on the story of a Doctor who served in the killing field of Sri Lanka.,90
tt10482336,The Atlantic City Story,Movie,Drama,2020,10.0,Henry Butash,"['tt10482336', 'Jessica Hecht', 'Mike Faist', 'Gary Wilmes', 'Scott Banks', 'Bill Beydoun', 'Scott Breiner', 'Kelly Brennan', 'Alexander Carney', 'Angela Citrola', 'George Crover']",['Henry Butash'],"An unhappily married woman runs away from home and goes to Atlantic City, where she meets a young gambler and develops an unlikely friendship with him.",98
tt10484276,Danny. Legend. God.,Movie,Drama,2020,9.0,Yavor Petkov,"['tt10484276', 'Dimo Alexiev', 'Kate Nichols', 'James Ryan Babson', 'Valentina Aleksandrova', 'Iliana Lazarova', 'Suzanitta', 'Borislav Markovski', 'Emil Kamenov', 'Georgi Naldzhiev', 'Yordan Danchev']",['Yavor Petkov'],Conoce a Danny. Leyenda. Dios. O eso se cree él. Un concejal búlgaro boicotea a un equipo documental al que conduce peligrosamente a través de su mundo de corrupción sin escrúpulos.,106
tt10485538,Opposite Direction,Movie,Drama,2020,3.0,Alejandro Bellame Palacios,"['tt10485538', 'Claudia Rojas', 'Christian Josue Gonzalez', 'Erick Palacios', 'Diana Volpe', 'Alberto Alifa', 'Veronica Arellano', 'Juliana Cuervos', 'Martha Estrada', 'Edmary Fuentes', 'William Goite']","['Alejandro Bellame Palacios', 'Eduardo Sánchez Rugeles']","Eugenia, 30, is torn between fulfilling or not a promise made 13 years ago to Luis, his brief and tragic teen love.",120
tt10485148,Sage of Time,Movie,Drama,2021,8.0,Luke Mayze,"['tt10485148', 'Steven Rooke', 'Carlotta Morelli', 'Hugo Stinson', 'Eliza Allen', 'Sami Afuni']","['Luke Mayze', 'Kevin Spink']","Paul es un fotógrafo que se reencuentra con su primer amor, Anna, en un ruidoso mercado de Filipinas. Aunque la llama se prende de nuevo, sus principios son conflictivos. La noche que comparten lo cambiará todo.",NO DATA
tt10497782,König der Raben,Movie,Drama,2021,8.0,Piotr J. Lewandowski,"['tt10497782', 'Malik Blumenthal', 'Antje Traue', 'Karim Günes', 'Mert Dincer', 'Danuta Stenka', 'Barbara Philipp', 'Ralph Herforth', 'André Röhner', 'Slavko Popadic', 'Anja Schiffel']",['Piotr J. Lewandowski'],"Darko es un macedonio que vive ilegalmente en Alemania y hace todo lo posible por sobrevivir. Cuando se involucra con Alina, una mujer casada, empieza a arriesgar su esperanza de una vida mejor, su estancia en el país e incluso su vida.",104
tt10500534,Inland,Movie,Drama,2020,10.0,Jon Blåhed,"['tt10500534', 'Irma von Platen', 'Eva Melander', 'Albin Grenholm', 'Ann Petrén', 'Paloma Perez', 'Tage Hervén', 'Rasmus Winblad', 'Simon Lindgren', 'Lena P. Cederlund', 'Daniel Eneris Sandström']","['Jon Blåhed', 'Elin Willows']","A young woman from Stockholm moves to her boyfriend's hometown in northern Sweden, but the relationship quickly ends. She finds a job and stays, for reasons she doesn't even understand herself. How do you become part of something new?",88
tt10500666,Just Different,Movie,Drama,2020,10.0,Ahmet Sönmez,"['tt10500666', 'Ömer Akgüllü', 'Vildan Atasever', 'Meral Çetinkaya', 'Aybars Kartal Özson']",['Nalan Merter Savas'],Fikret is married with a 10-year-old son and works in the library. But one day his routine life is disrupted when his wife leaves home. His young son becomes more like his father. works in the library. Just Different is the story of a father with 'high-functioning autism' and his 'normal' son.,126
tt10504776,Sangre,Movie,Drama,2020,12.0,Juan Schnitman,"['tt10504776', 'Juan Barberini', 'Natalia Tena', 'Bella Camero', 'Dirk Martens', 'Alexandre Curty', ""Marcelo D'Andrea"", 'Julian Cabrera', 'Jonathan Da Rosa', 'Vladimir Durán', 'Soledad García']","['Juan Barberini', 'Agustina Liendo', 'Juan Schnitman']","Fernando works in an oil tanker that connects two major Argentinian cities. He has a young girlfriend in one and a married lover in the other. As they both become pregnant, his life starts to disintegrate into obsession and violence.",102
tt10504286,Selfish Son,Movie,Drama,2020,,Aniello De Angelis,"['tt10504286', 'Scott Conant', 'Samantha Bowen', 'Aaron Quinn Long', 'Sophia Ventrone', 'Steve Gamble', 'Hanna White', 'Alexander Spears', 'Aniello De Angelis', 'Elizabeth Machabeli']","['Scott Conant', 'Samantha Bowen', 'Aaron Quinn Long']",,NO DATA
tt10506876,Topside,Movie,Drama,2020,9.0,Logan George,"['tt10506876', 'Zhaila Farmer', 'Celine Held', 'Jared Abrahamson', 'Fatlip', 'Hector Falcon', 'Cynthia Tombros', 'Tonye Patano', 'Gino Vento', 'Lorrie Odom', 'Cem Aksoy']","['Logan George', 'Celine Held']","En lo más profundo de la ciudad de Nueva York, una niña de cinco años y su madre viven en una comunidad que ha reclamado los túneles subterráneos abandonados como su hogar.",85
tt10508258,Krasnyy prizrak,Movie,Drama,2021,6.0,Andrey Bogatyrev,"['tt10508258', 'Aleksey Shevchenkov', 'Vladimir Gostyukhin', 'Yuriy Borisov', 'Polina Chernyshova', 'Wolfgang Cerny', 'Michael Gor', 'Olga Stashkevich', 'Pavel Abramenkov', 'Vyacheslav Shikhaleev', 'Oleg Vasilkov']","['Andrey Bogatyrev', 'Vyacheslav Shikhaleev', 'Pavel Abramenkov']","Diciembre 30 de 1941. En Vyazma hay un pequeño grupo de soldados soviéticos, que intentan alcanzar a sus propios camaradas después de haber escapado de un cerco nazi.",99
tt10507176,Desterro,Movie,Drama,2021,11.0,Maria Clara Escobar,"['tt10507176', 'Carla Kinzo', 'Otto Jr.', 'Rômulo Braga', 'David Lobo', 'Sara Antunes', 'Ricardo Calil', 'Bárbara Colen', 'Juliana Carneiro da Cunha', 'Hu Xiau Den', 'Flora Dias']",['Maria Clara Escobar'],"A young woman suddenly disappears, leaving her husband and son in disarray.",122
tt10508774,Gold Coast Lounge,Movie,Drama,2020,1.0,Pascal Aka,"['tt10508774', 'Pascal Aka', 'Raquel Ammah', 'Fred Nii Amugi', 'Adjetey Anang', 'Akofa Edjeani Asiedu', 'Gideon Boakye', 'Etta JoMaria', 'Alphonse Menyo', 'Cina Soul', 'Zynnell Zuh']",['Pascal Aka'],"En el corazón de Ghana, una familia criminal tiene que arreglar su conducta antes de que el gobierno cierre su salón privado.",119
tt10510416,Revenge Ride,Movie,Drama,2020,6.0,Melanie Aitkenhead,"['tt10510416', 'Serinda Swan', 'Diego Boneta', 'Jake Lockett', 'Pollyanna McIntosh', 'Vanessa Dubasso', 'Reem Kadem', 'John D. Hickman', 'Hank Brock', 'Shawn Mattox', 'Vince Jolivette']",['Timothy Durham'],"Maggie is a tough and ruthless member of the all-female Dark Moon biker gang led by the merciless Trigga. After Maggie's cousin is drugged at a party, the gang rides out for revenge.",73
tt10510250,Silence Is Compliance,Movie,Drama,2020,1.0,Dominique McClellan,"['tt10510250', 'Stylist B.', 'John Charles II', 'John Charles', 'Lemetria Dillon', 'Sallay Shameka Gray', 'Kyler Jett', 'Jessica Johnson', 'Donald Lewis', 'Ariel Lucius', 'Havilah Malone']",['Dominique McClellan'],A Sexual assault survivor embarks on a mission to help other survivors use their voice to seek justice against their abuser.,47
tt10510254,Les Vieux Chums,Movie,Drama,2020,11.0,Claude Gagnon,"['tt10510254', 'Patrick Labbé', 'Paul Doucet', 'Luka Limoges', 'Marie-Pier Labrecque', 'Stéphan Côté', 'Hassan El Fad', 'Luc Proulx', 'Natasha Kanapé Fontaine', 'Michel Olivier Girard', 'Geneviève Rochette']",['Claude Gagnon'],"After years living in Maroc, and now suffering from terminal lung cancer, Pierrot has decided to return to his hometown in Québec, in order to see his old chums and settle his affairs, but he has another project in mind which will need the help of his closest friend.",123
tt10514222,Ma Rainey's Black Bottom,Movie,Drama,2020,12.0,George C. Wolfe,"['tt10514222', 'Viola Davis', 'Chadwick Boseman', 'Glynn Turman', 'Colman Domingo', 'Michael Potts', 'Jeremy Shamos', 'Jonny Coyne', 'Taylour Paige', 'Dusan Brown', 'Joshua Harto']","['Ruben Santiago-Hudson', 'August Wilson']","Una tarde en Chicago, en la década de 1920, la temperatura y la tensión se elevan cuando la legendaria Ma Rainey, una artista pionera apodada la madre del blues, llega tarde a una sesión de grabación.",94
