tt11278342,No Choice,Movie,Drama,2021,10.0,Reza Dormishian,"['tt11278342', 'Fatemah Motamed-Aria', 'Negar Javaherian', 'Parsa Pirouzfar', 'Pardis Ahmadieh', 'Mojtaba Pirzadeh', 'Bahman Farmanara', 'Reza Behbudi', 'Maryam Boubani', 'Homayoun Ershadi', 'Hooshang Ghovanloo']",['Reza Dormishian'],"No Choice is about three women who live in three different circumstances in Iran. Golbahar, a sixteen-year-old homeless girl who has been producing and selling babies since she was 11 years old is sold to a middle-aged man to give birth to his child, but Golbahar does not become pregnant after a month. She is threatened with death by a pimp if she does not become preg... Leer todo",108
tt11280556,Madness Inside Me,Movie,Drama,2021,9.0,Matthew Berkowitz,"['tt11280556', 'Merrin Dungey', 'Devon Graye', 'Jennifer Gelfer', 'Scotty Tovar', 'Thomas Q. Jones', 'Anthony DeSando', 'Brit Whittle', 'John Buffalo Mailer', 'Nick Mathews', 'Samantha Watkins']",['Matthew Berkowitz'],"A forensic psychiatrist's husband is killed during a home invasion, but instead of identifying the killer, she recants. She stalks the newly released psychopath, deciding whether she wants to kill him, sleep with him, or try to know him.",89
tt11280886,The Eccentric World of Baron Styles,Movie,Drama,2020,1.0,Jerome-Anthony Larkin,"['tt11280886', 'Francis Allen', 'Olga Bespalenko', 'Marilyn Carlisle', 'Karen Chimato', 'Eric Claussen', 'Jayson Costa', 'Shane Costa', 'J.J. Duffy', 'Mireya Kilmon', 'Claudine Lee']",['Jerome-Anthony Larkin'],"Recent college graduate, Leonard Rothman, begins working as the new COO of Styles Enterprises, but he soon learns that his perfect boss, Baron Styles, is a stone-cold killer.",NO DATA
tt11280912,Maarjaara Oru Kalluvacha Nuna,Movie,Drama,2020,1.0,Raakesh Baala,"['tt11280912', 'Abhirami', 'Jason Chacko', 'Jason Chacko', 'Disney James', 'Sudheer Karamana', 'Sudhi Kollam', 'Hareesh Peradi', 'Renu Soundar', 'Tini Tom', 'Vihaan']",['Raakesh Baala'],"Due to an unfortunate event, Shanthanu leaves home and resides in the outskirts of the city named Ashramam Veedu. During the stay period, there is a twist of fate in Shanthanu's life as he encounters a chain of mysterious events.",142
tt11280926,No deixis que m'enfonsi,Movie,Drama,2020,1.0,David Conill,"['tt11280926', 'Pepo Blasco', 'Pep Miràs', 'Albert Ribalta']",['Alba Colomer'],,NO DATA
tt11280892,Ennum,Movie,Drama,2020,11.0,Aneesh Varma,"['tt11280892', 'Sudheer Karamana', 'Shivani']","['Sudheer Karamana', 'Shivani']",,NO DATA
tt11281098,Love FM,Movie,Drama,2020,2.0,Sreedev,"['tt11281098', 'Boban Alumoodan', 'Anand Bbal', 'Akash Dev', 'Sasi Kalinga', 'Janaki Krishnan', 'Sarath Kumar', 'Mammukoya', 'Malavika Menon', 'Sneha Sreekumar', 'Tito Wilson']",['Saju Kodiyan'],Love FM revolves around a radio that plays a crucial role in the love story. It is a romantic movie where it touches upon the love stories of two generations.,120
tt11280986,Varkey,Movie,Drama,2020,3.0,Adharsh Venugopal,"['tt11280986', 'Samad Sulaiman', 'Drishya Dinesh', 'Sreejith Ravi', 'Salim Kumar', 'Alencier Ley Lopez', 'Jaffer Idukki', 'Jenson Alappat', 'Devison C.J.', 'Letha Das', 'Baiju Ezhupunna']",['Adharsh Venugopal'],"Varky is a quotation Goon who does the dirty work for his Boss and when need be, even for cops. But chaos ensues when his Boss assigns him to kidnap a bride-to-be on the eve of her wedding.",94
tt11283002,Words and Music,Movie,Drama,2020,5.0,Daniele De Plano,"['tt11283002', 'Nicholas Hunt', 'Anthony Souter']",['Samuel Beckett'],,NO DATA
tt11284280,Kadaver,Movie,Drama,2020,10.0,Jarand Herdal,"['tt11284280', 'Thorbjørn Harr', 'Thomas Gullestad', 'Gitte Witt', 'Maria Grazia Di Meo', 'Kingsford Siayor', 'Jonatan Rodriguez', 'Helge Jordal', 'Trine Wiggen', 'Gjermund Gjesme', 'Tuva Olivia Remman']",['Jarand Herdal'],Un hotel ofrece un peculiar espectáculo con cena incluida en plena hambruna postapocalíptica. Y una familia descubre que deberá pagar mucho más que el precio de entrada.,86
tt11285408,La Pesca del Atún Blanco (Catching the White Tuna),Movie,Drama,2020,9.0,Maritza Blanco,"['tt11285408', 'Belisario Albornoz', 'Bairon Castillo', 'Andres Ortega', 'Erlin Ortega', 'Eryen Korath Ortiz']",['Maritza Blanco'],,75
tt11286640,Nowhere Special,Movie,Drama,2022,4.0,Uberto Pasolini,"['tt11286640', 'James Norton', 'Daniel Lamont', 'Carol Moore', 'Valene Kane', 'Keith McErlean', ""Eileen O'Higgins"", 'Laura Hughes', 'Éva Morris', 'Chris Corrigan', 'Siobhán McSweeney']",['Uberto Pasolini'],"Sigue a John, el limpiador de ventanas de 35 años, que ha dedicado su vida a criar a su hijo después de que la madre del niño los dejara poco después de dar a luz.",96
tt11287860,Todas las pistas fueron falsas,Movie,Drama,2020,11.0,Alejandro Cozza,"['tt11287860', 'Rafael Rodríguez', 'Dora Spollansky']",['Alejandro Cozza'],,NO DATA
tt11291510,Secret Sweet - Tribute to Carl Andersen 1958 - 2012,Movie,Drama,2020,10.0,Malga Kubiak,"['tt11291510', 'Thomas Goersch', 'Malga Kubiak']",['Malga Kubiak'],,NO DATA
tt11295624,Hustle on Lombard,Movie,Drama,2020,1.0,Matt Torsell,"['tt11295624', 'Michael Dandridge', 'Ham Mukasa', 'Cristina Sanchez', 'Jesse Marciniak', 'Madarryl Mial', 'Rachel Arnold']",['Matt Torsell'],"Two estranged brothers, one a drug addict, the other, a paranoid schizophrenic, struggle to face their demons in the streets of Baltimore.",76
tt11295984,Bhoomiyile Manohara Swakaryam,Movie,Drama,2020,2.0,Shaiju Anthikkad,"['tt11295984', 'Deepak Parambol', 'Prayaga Martin', 'Abhishek Raveendran', 'Shine Tom Chacko', 'Indrans', 'Sudheesh', 'Anju Aravind', 'Santhosh Keezhattoor', 'Lal', 'Gourav Menon']",['A. Santhakumar'],"Ahammed and Anna are friends from childhood and their parents are also good friends. Both of them who loved each other belonged to extremely religious families. One day, all of a sudden Ahammed decides to leave his native place without revealing many details and he asked Anna to forget him and move on. What happens post this incident is the main content of Bhoomiyile ... Leer todo",134
tt11301312,What If It Was Me?,Movie,Drama,2020,,Matt Power,"['tt11301312', 'Sean C. Dwyer', 'Reece Presley', 'Tiffany Blom', 'Jacelyn Holmes', 'David Tomlinson', 'Emanuel Cappello', 'Laurel Gillespie', 'Matt Ingram', 'David Keogh', 'Rich Leenher']","['Sean C. Dwyer', 'Reece Presley', 'Tiffany Blom']","The real life story of two brothers, and the devastating accident that put their love to the test, forcing them to make the ultimate sacrifice.",131
tt11306684,Feng ping lang jing,Movie,Drama,2020,11.0,Xiaofeng Li,"['tt11306684', 'Yu Zhang', 'Jia Song', 'Yanhui Wang', 'Jin Chen', 'Enxi Deng', 'Yuhang Gao', 'Hong-Chi Lee', 'Zhengjie Zhou']",['Xin Yu'],"Un fugado convicto culpado por homicidio negligente regresa a su ciudad natal después de 15 años, solo para ser perseguido por su pasado, y se ve mezclado en un escándalo que involucra a la hija de su víctima.",118
tt11306906,Dakota Family,Movie,Drama,2020,12.0,Om Prakash Rao,"['tt11306906', 'Sonia Gowda', 'Om Prakash Rao', 'Tulasi', 'Rockline Venkatesh']","['Sonia Gowda', 'Om Prakash Rao', 'Tulasi']",,NO DATA
tt11311996,Mathi,Movie,Drama,2020,5.0,Suresh Narayanan,"['tt11311996', 'Mahendran Vizha']",['Mahendran Vizha'],,134
tt11312112,Gurukulam,Movie,Drama,2020,6.0,Paethansami,['tt11312112'],[],,NO DATA
tt11311990,Sokku Sundaram,Movie,Drama,2020,5.0,Sridhar .A.,"['tt11311990', 'Mahanadhi Shankar']",['Mahanadhi Shankar'],,134
tt11311994,Table 13,Movie,Drama,2020,,Christopher Gray,"['tt11311994', 'Dayton Callie', 'Amanda Henn', 'Stefanie Estes', 'Cairos Heinen', 'Vinicius Faria Zinn', 'Nona Jedelle Cook', 'Isa Rainer', 'John Nicholson', 'Derek Mikula', 'Carson Arellano']","['Lori Dutra', 'Christopher Gray']",,NO DATA
tt11318348,Brahma Janen Gopon Kommoti,Movie,Drama,2020,3.0,Aritra Mukherjee,"['tt11318348', 'Ritabhari Chakraborty', 'Manasi Sinha', 'Soma Chakraborty', 'Subhasish Mukherjee', 'Soham Majumdar', 'Ambarish Bhattacharya', 'Tanika Basu', 'Shaheb Chattopadhyay', 'Ritwick Purkait', 'Debashis Roy']",['Zinia Sen'],"Shabari, a lecturer by profession, moonlights as a performing artist. However, she marries a conservative man and her husband is not too happy to learn about her secret profession.",127
tt11317986,Prem Ki Padhai,Movie,Drama,2020,12.0,Rithesh S. Kumar,"['tt11317986', 'Ritu Raj', 'Nisha Singh']","['Ritu Raj', 'Nisha Singh']",,NO DATA
tt11316764,Rocket Hunter,Movie,Drama,2020,9.0,Christopher Forbes,"['tt11316764', 'Brad Owens', 'Scotty Sparks', 'William Wylie', 'Ronald Blanton', 'Joseph Zuchowski', 'Jezibell Anat', 'Eric Miller', 'Charlie Gabel', 'Brendan Thompson', 'Stephen Gilliam']",['Christopher Forbes'],"In one of the most dangerous missions of the war, an American B-17 pilot volunteers to fly a surrendered Messerschmidt 109 on a daring flight through the heart of Germany to try to prevent the people of London from being terrorized by the V-2 rockets. ""Rocket Hunter"" tells the story of an amazing pilot and his bombardier brother from the time they are teenagers dreami... Leer todo",86
tt11318336,Raymo,Movie,Drama,2020,3.0,Pawan Wadeyar,"['tt11318336', 'Rajesh Nataranga', 'Ishaan', 'Achyuth Kumar', 'Madhoo', 'Prashanth Natana', 'Ashika Ranganath', 'R. Sarathkumar']",['Pawan Wadeyar'],"Revanth Deshpande is a rich kid but doesn't depend on his father's money. He is a rockstar who goes by the name Raymo. Soon, he meets Mohana and they fall in love. Will their love be successful?",157
tt11316964,Mia,Movie,Drama,2020,1.0,Veronica Velasco,"['tt11316964', 'Coleen Garcia', 'Billy Crawford', 'Edgar Allan Guzman', 'Alberto Antares', 'Chichi Cardona', 'Jeremy Domingo', 'Star Orjaliza', 'Sunshine Teodoro', 'Kenth Martin Tabajonda', 'Lance Mykell Mamungay']","['Veronica Velasco', 'Jinky Laurel']","Mia Salazar, a self-destructive, alcoholic doctor who joined the Doctor to the Barrios program to heal from the tragedy of her fiance's death meets the cheerful and nerdy forester Jay Policarpio. Together, the two will embark on a new journey.",91
tt11317142,Shiva Baby,Movie,Drama,2021,4.0,Emma Seligman,"['tt11317142', 'Rachel Sennott', 'Danny Deferrari', 'Fred Melamed', 'Polly Draper', 'Molly Gordon', 'Glynis Bell', 'Rita Gardner', 'Cilda Shaur', 'Jackie Hoffman', 'Richard Brundage']",['Emma Seligman'],"En un funeral judío, acompañada de sus padres, una estudiante universitaria se encuentra con su amante, mucho más mayor.",77
tt11318302,Sadha Nannu Nadipe,Movie,Drama,2020,2.0,Lanka Pratheek Prem Karan,"['tt11318302', 'Mahesh Achanta', 'Mohammad Ali', 'Surya Kumar Bhagawan Das', 'Rajeev Kanakala', 'Lanka Pratheek Prem Karan', 'Nagendra Babu', 'Nassar', 'Allmatti Nani Naveen', 'Naveen Neni', 'Vaishnavi Patwardhan']",['Lanka Pratheek Prem Karan'],"When a pretty girl who's about to pass away soon falls for a small time thief, he struggles to come to terms with it.",144
tt11318228,Vaanam Kottattum,Movie,Drama,2020,2.0,Dhana Sekaran,"['tt11318228', 'R. Sarathkumar', 'Vikram Prabhu', 'Radhika Sarathkumar', 'Aishwarya Rajesh', 'Madonna Sebastian', 'Shanthnu Bhagyaraj', 'Nandha', 'Amitash Pradhan', 'Balaji Sakthivel', 'Madhusudhan Rao']","['Mani Ratnam', 'Dhana Sekaran']","A simple father's life whose one mistake breaks him away from his dear family. Even after many years, when he finally meets his family, the same mistake haunts him back in a different form which unfolds into an emotionally gripping climax.",138
tt11318044,Dhurala,Movie,Drama,2020,1.0,Sameer Vidwans,"['tt11318044', 'Ankush Chaudhari', 'Sangram Desai', 'Nupur Dudwadkar', 'Devendra Gaikwad', 'Prajakta Hanamghar', 'Priyadarshan Jadhav', 'Siddharth Jadhav', 'Krishna Jannu', 'Umesh Kamat', 'Alka Kubal']",['Kshitij Patwardhan'],"When the sarpanch of the Ambergaon village dies, his family members battle with each other over their greed for power which affects their relationships.",169
tt11317958,Veer Yodha-Mahabali,Movie,Drama,2020,12.0,Iqbal Baksh,"['tt11317958', 'Atsede Addy Ethio', 'Sahil Akhtar', 'Amrapali Dubey', 'Amjad Qureshi', 'Archana Sharma', 'Dinesh Lal Yadav']","['Atsede Addy Ethio', 'Sahil Akhtar', 'Amrapali Dubey']",,NO DATA
tt11318262,Sannyasi Deshonayok,Movie,Drama,2020,1.0,Amlan Kusum Ghosh,"['tt11318262', 'Kirron Arya', 'Victor Banerjee', 'Saswata Chatterjee', 'Abhirup Chowdhury', 'Narendra Kanojiya', 'Ankur Roy', 'Vivek Sharma', 'Uday Vir Singh Yadav']","['Kirron Arya', 'Victor Banerjee', 'Saswata Chatterjee']",,NO DATA
tt11318164,U Turn 2,Movie,Drama,2020,1.0,Chandru Obaiah,"['tt11318164', 'Chandru Obaiah', 'Ugramm Ravi', 'Kari Subbu', 'Victory Vasu']","['Chandru Obaiah', 'Ugramm Ravi', 'Kari Subbu']","U Turn 2 is an Horror movie. Around one pizza boy story will run and two friends, one girl friend staying with him entire movie. Devil whom to kill is conclusion.",NO DATA
tt11318364,Belashuru,Movie,Drama,2020,5.0,Shiboprosad Mukherjee,"['tt11318364', 'Soumitra Chatterjee', 'Swatilekha Sengupta', 'Rituparna Sengupta', 'Aparajita Adhya', 'Monami Ghosh', 'Indrani Dutta', 'Kharaj Mukherjee', 'Anindya Chatterjee', 'Shankar Chakraborty', 'Sujoy Prosad Chatterjee']",['Shiboprosad Mukherjee'],"Life of an elderly couple and the bond that parents, children and other members of the family share together in a Indian family in Bengal.",140
tt11319074,Bad Boy,Movie,Drama,2020,2.0,Patryk Vega,"['tt11319074', 'Antoni Królikowski', 'Maciej Stuhr', 'Katarzyna Zawadzka', 'Andrzej Grabowski', 'Malgorzata Kozuchowska', 'Piotr Stramowski', 'Kamil Grosicki', 'Slawomir Peszko', 'Zbigniew Zamachowski', 'Zbigniew Kozlowski']","['Olaf Olszewski', 'Patryk Vega']","The rise and fall of a soccer club owner, discovering the harsh reality of the sport, often connected with crime and fraud.",135
tt11319518,Reckless,Movie,Drama,2020,6.0,Matthew Lyne-Watt,"['tt11319518', 'Abigail Stone', 'Tia Rocket', 'Phillip Stark']","['Abigail Stone', 'Tia Rocket', 'Phillip Stark']",A young journalist must recount her version of events when a dead body winds up in her apartment.,NO DATA
tt11321468,My Name Is Sam,Movie,Drama,2020,1.0,Sam Wickey,"['tt11321468', 'Kasha Fauscett', 'Sam Wickey', 'Reed Haymons', 'Wesley Juels', 'Connor Falk', 'Parker Juels', 'Brooke Bowman', 'McAlyn Forbes', 'Bella Motter', 'Allie Taylor']","['Troy Fauscett', 'Sam Wickey']","An Amish family (and specifically Sam, a high functioning autistic boy) and their eventual departure from the strict and often harsh Amish community they lived in.",85
tt11323086,Sasi Lalitha,Movie,Drama,2020,12.0,Kethireddy Jagadhishwara Reddy,"['tt11323086', 'Kajol']",['Kajol'],,NO DATA
tt11322786,You jian Nai Liang,Movie,Drama,2021,3.0,Peng Fei Song,"['tt11322786', 'Yanshu Wu', 'Ze Ying', 'Jun Kunimura', 'Masatoshi Nagase', 'Shintarô Akiyama', 'Peng Fei Song']",['Peng Fei Song'],"After the victory of the War of Resistance Against Japan in 1945, a large number of Japanese orphans were adopted by families in Northeast China. With the normalization of diplomatic relations between the two countries in the 1970s and 1980s, many orphans returned to China, including Lihua, the adopted daughter of Grandma Chen (played by Wu Yanshu). In 2005, Grandma C... Leer todo",97
tt11324626,The Last Christmas Party,Movie,Drama,2020,11.0,Julian Carlo Santos,"['tt11324626', 'Anna Clare Kerr', 'Samantha Brooks', 'Martin Drop', 'James Williams', 'Gabe Armentano', 'Spencer Wawak', 'Rosie Dean', 'Kyvon Edwin', 'Charis Storms', 'Brittany Raper']","['Kevin Nittolo', 'Julian Carlo Santos']",Tres parejas de universitarios pasar una última noche juntos en una fiesta navideña antes de irse de vacaciones.,84
tt11323394,Killer in Me,Movie,Drama,2020,10.0,Marcus D. Spencer,"['tt11323394', 'Marcus D. Spencer', 'Sherif Awad']","['Marcus D. Spencer', 'Jessica Wosik']",,NO DATA
tt11322984,Maragatha Kaadu,Movie,Drama,2020,11.0,Mangaleshwaran,"['tt11322984', 'Ajay', 'Bava Lakshmanan', 'Jayashree Sivadhas']","['Ajay', 'Bava Lakshmanan', 'Jayashree Sivadhas']",,NO DATA
tt11323324,Kavalthurai Ungal Nanban,Movie,Drama,2020,11.0,Ranjith Manikandan,"['tt11323324', 'Mime Gopi', 'Raveena Ravi', 'Suresh Ravi', 'Supergood Subramani']",['Ranjith Manikandan'],A terrible tournout of events when a common public employee enters unexpectedly into a police station,122
tt11323246,Pass Na Pass,Movie,Drama,2020,11.0,Rafiq Talukdar,"['tt11323246', 'Adi Irani', 'Malhar Pandya', 'Jasmin Patel', 'Dharmesh Vyas']","['Adi Irani', 'Malhar Pandya', 'Jasmin Patel']",,NO DATA
tt11323102,Divyang,Movie,Drama,2020,11.0,Dilip Kosre,"['tt11323102', 'Aman Lade', 'Vandan Nakhate']","['Aman Lade', 'Vandan Nakhate']",,NO DATA
tt11322920,Ayyappanum Koshiyum,Movie,Drama,2020,2.0,Sachy,"['tt11322920', 'Biju Menon', 'Prithviraj Sukumaran', 'Ranjith', 'Anil Nedumangad', 'Johny Antony', 'Shaju K.S.', 'Sabumon Abdusamad', 'Alencier Ley Lopez', 'Anu Mohan', 'Gowri Nandha']",['Sachy'],"The story revolves around the clash between Ayyappan, a senior police officer who serves at the Attappadi Police Station and Havildar Koshi, who comes to the village with a motive.",177
tt11323316,Penguin,Movie,Drama,2020,6.0,Eashvar Karthic,"['tt11323316', 'Keerthy Suresh', 'Linga', 'Madhampatty Rangaraj', 'Master Advaith', 'Mathi', 'Harini', 'Sai Jivitha', 'Nithya Kriupa', 'Maddy', 'Murali']",['Eashvar Karthic'],It is a spine chilling tale of a pregnant mother who sets out on a dangerous mission to unravel the mystery and save her loved ones.,132
tt11323284,Raakshasaru,Movie,Drama,2020,11.0,Saikumar Sampana,"['tt11323284', 'Saikumar Sampana']",[],,NO DATA
tt11327514,Uncle Frank,Movie,Drama,2020,11.0,Alan Ball,"['tt11327514', 'Paul Bettany', 'Sophia Lillis', 'Peter Macdissi', 'Steve Zahn', 'Judy Greer', 'Margo Martindale', 'Stephen Root', 'Lois Smith', 'Jane McNeill', 'Caity Brewer']",['Alan Ball'],"En 1973, Frank y su sobrina Beth se dirigen por carratera de Manhattan a Creekville, Carolina del Sur, para el entierro del patriarca de la familia, e inesperadamente se les une Walid, el amante de Frank.",95
tt11333854,Un efecto óptico,Movie,Drama,2020,9.0,Juan Cavestany,"['tt11333854', 'Carmen Machi', 'Pepón Nieto', 'Luis Bermejo', 'Lucía Juárez', 'Boubacar Sakho', 'Lola Cordón', 'Paul Hanna', 'Susana Sanabria', 'Alejandro Pérez Blanco']",['Juan Cavestany'],"Alfredo y Teresa deciden viajar a Nueva York para ""desconectar"". Pero nada más aterrizar empiezan a percibir señales, sutiles y no tanto, de que en realidad no están en la ciudad que les vendieron en la agencia.",80
tt11337342,The Killers,Movie,Drama,2020,1.0,NO DATA,['tt11337342'],[],,NO DATA
tt11338498,Michael,Movie,Drama,2020,,Guillaume Bouiges,"['tt11338498', 'Emmanuel Collet', 'Samantha Nony', 'Geoffrey Vinchon', 'Lisiane Hansart', 'Tom Guillot', 'Constantin Pappas', 'Jade Boulanger', 'Sam Olfain', 'Karell Touron', 'Aristote Douroudakis']","['Guillaume Bouiges', 'Emmanuel Collet']","In a wasteland, the Antichrist is looking for redemption.",NO DATA
tt11343552,Anukunnadi Okkati Ayyindhi Okati,Movie,Drama,2020,3.0,Baalu Adusumilli,"['tt11343552', 'Dhanya Balakrishna', 'Siddhi Idnani', 'Tridha Choudhury', 'Komalee Prasad', 'Raghu Babu', 'Basha', 'Chaitu Jr.', 'Himaja', 'Kalyani', 'Madhu Nandan']","['Baalu Adusumilli', 'Vijay Kamisetty']",Four childhood friends travel to Goa for a fun-filled wedding of their friend but their trip turns into a nightmare when they become involved in the murder of a stripper.,122
tt11343320,Body of Night,Movie,Drama,2020,4.0,Nicole D'Angelo,"['tt11343320', 'Jason Toler', ""Ro'Shae Etienne"", 'Lisa London', 'Megan Davis', 'Jennifer Field', 'Barry Sattels', 'Amanda Van Annan', 'Craijece Danielle', 'Joycelyne Lew', 'Anthia Gillick']","['Gregory Hatanaka', 'Geno McGahee']",A woman explores the dark side of online dating when she meets a mysterious man who engages her in a series of increasingly dangerous tests of her ability.,73
tt11343634,Khakii,Movie,Drama,2020,1.0,Naveen Reddy B,"['tt11343634', 'Tanya Hope', 'Chaya Singh', 'Dev Gill', 'Chiranjeevi Sarja']","['Gururaj M. Desai', 'Maasthi Upparahalli']",,114
tt11343808,The Bleeding Goddess,Movie,Drama,2020,1.0,Eklavya Sakpal,['tt11343808'],['Eklavya Sakpal'],,NO DATA
tt11347394,Huey,Movie,Drama,2020,,Brenden Singh,"['tt11347394', 'Bryan Moriarty', 'Daisy Boyden', 'Philip Ridout', 'Emma Bugg', 'Jacob Meadows', 'Magdalena Fiedlerova', 'Arianne Hargrave', 'Rui Lourenço', 'Mathias Hermann Löffler', 'Rita Medeiros']",['Brenden Singh'],"Un escritor lucha por lidiar con su salud mental inestable y las miradas frías de una mujer al azar en una cafetería, librando una batalla perdida para mantener el autocontrol.",70
tt11349638,Skazhi ey,Movie,Drama,2021,5.0,Aleksandr Molochnikov,"['tt11349638', 'Shaelan Bowers', 'Aleksandra Brovko', 'Artyom Bystrov', 'Wolfgang Cerny', 'Igor Chernevich', 'Annaka Fourneret', 'Kai Aleks Getts', 'Marina Ignatova', 'John J. Jordan', 'Svetlana Khodchenkova']","['Aleksandr Molochnikov', 'Alexander Talal', 'Ilya Tilkin']","When his parents divorce and his mother moves to the United States, 11-year -old Sasha of St. Petersburg, Russia is pulled apart emotionally between two parents, both of whom he loves, and two cultures.",98
tt11350286,Khökhö,Movie,Drama,2020,4.0,Janchivdorj Jamyansuren,"['tt11350286', 'Tsegmed Ayurzana', 'Zoljargal Batsaikhan', 'Bayra Bela', 'Sansar Erdene', 'Bayarmaa Nergui', 'Bayarmagnai Purevtseren', 'Borkhuu Tangad', 'Tserenbold Tsegmid', 'Tsenguun Tsolmon']",['Janchivdorj Jamyansuren'],"Death comes calling to an old woman, whose children rush home to see her. As she clings to life in the hope of seeing her missing daughter, the others return to their lives. Alone with his suffering mother, one son faces a terrible choice.",124
tt11349892,Good,Movie,Drama,2021,,Justin Etheredge,"['tt11349892', 'Keith David', 'Justin Etheredge', 'Nefetari Spencer', 'Kali Racquel', 'Christen Sharice', 'Sarah Scott Davis', 'Ken Colquitt', 'Aroon Nayer', 'Gwen Cesta-Persichetti', 'Harrison Rodriguez']","['Justin Etheredge', 'Nathan Allen']","Payton becomes the caretaker of Gregory Devereaux, a wealthy man facing his final months. As they become close, Gregory's past sins force Payton to decide between his dreams and a pregnancy that could squander them all.",80
tt11352982,Bli Min,Movie,Drama,2020,6.0,Ali Al-Saqr,"['tt11352982', 'Sandra Penzo', 'Emma Jolin', 'Adrian Althin Gudinge', 'Saga Abramsson', 'Alexander Ceciliasson', 'Vlora Curoja', 'Filip Dahlstedt', 'Sandra Fredriksson', 'Jessica Högberg', 'Emeli Iversen']",['Ali Al-Saqr'],"A one-sided love that has stood the test of time fills Maja's days. Her undeniable attraction to Alice goes unspoken. Until one day, it doesn't.",NO DATA
tt11354418,Jete Nahi Dibo,Movie,Drama,2020,11.0,Prabir Roy,"['tt11354418', 'Shakuntala Barua', 'Swastika Dutta', 'Sujan Mukherjee', 'Sudip Sarkar']","['Shakuntala Barua', 'Swastika Dutta', 'Sujan Mukherjee']",,NO DATA
tt11354326,Al Mallu,Movie,Drama,2020,1.0,Boban Samuel,"['tt11354326', 'Namitha Pramod', 'Anoop Majeed', 'Siddique', 'Miya George', 'Lal', 'Dharmajan Bolgatty', 'Sheelu Abraham', 'Jennifer Antony', 'Kabir Avran', 'Resmi Boban']","['Jayan Naduvathazhath', 'Rajath', 'Boban Samuel']","Nayana was cheated by her prospective fiancee, but when he does the same to a dear friend, she decides enough is enough",128
tt11355282,Adavi,Movie,Drama,2020,2.0,G. Ramesh,"['tt11355282', 'Ammu Abhirami', 'Vinoth Kishan']","['Ammu Abhirami', 'Vinoth Kishan']",A tribe in a mountain tries to save their land from a greedy estate owner.,103
tt11355334,Pandrikku Nandri Solli,Movie,Drama,2020,,Bala Aran,"['tt11355334', 'Chella', 'Joe Malloori', 'Nishanth', 'Vijay Sathya', 'Viyan']","['Chella', 'Joe Malloori', 'Nishanth']",A couple of people fighting amongst themselves to find a long lost treasure.,107
tt11355174,Amrutha Ramam,Movie,Drama,2020,4.0,Surendar Kontaddi,"['tt11355174', 'Jd Cherukuru', 'Vamsi Davuluri', 'Sreejith Gangadharan', 'Srijit Gangadharan', 'Ali Gul Khan', 'Ram Mittakanti', 'Sukuruti Narayanan', 'Amita Ranganath']","['Jd Cherukuru', 'Vamsi Davuluri', 'Sreejith Gangadharan']","Amrutha Ramam is a heartfelt love story based on a series of true experiences. The film depicts the lives of Amrutha and Ram, and how together they find the meaning of selfless love.",NO DATA
tt11358264,Ayu,Movie,Drama,2020,7.0,Chathra Weeraman,"['tt11358264', 'Sandra Mack', 'Jagath Manuwarna', 'Malini Fonseka', 'Ashan Dias', 'Kenara Weerathunga']","['Chathra Weeraman', 'Shakthi Weerasinghe', 'Saman Weeraman']","After getting in a car accident, a pregnant woman discovers a deadly secret about her life that begins to destroy everything and everyone she loves until she decides to escape her present and journey out digging deep hoping to find answers",116
tt11362792,Fuego adentro,Movie,Drama,2020,10.0,Jesús Mario Lozano,"['tt11362792', 'Hugo Catalán', 'Armando Espitia', 'Luisa Pardo']",['Jesús Mario Lozano'],"León, a single and repentant man, hides in a lost city in the mountains that, surprisingly, his dear little brother Andrés finds him to bring him news of his beloved Marta, who is waiting for her.",80
tt11357580,Luz,Movie,Drama,2021,4.0,Jon Garcia,"['tt11357580', 'Ernesto Reyes', 'Jesse Tayeh', 'Jimmy Garcia', 'Alma Gloria Garcia', 'Lowell Deo', 'Rega Lupo', 'Marian Mendez', 'Evie Riojas', 'Willis Argetsinger', 'Virgil Bohnenkamp']",['Jon Garcia'],"Lo que comenzó como una amistad se convierte en un romance feroz en este drama desgarrador. Una historia de supervivencia, no solo para la vida de ambos hombres, sino para su relación a medida que pasa al mundo fuera de su celda.",118
tt11358398,Namsanui bujangdeul,Movie,Drama,2020,1.0,Min-ho Woo,"['tt11358398', 'Lee Byung-hun', 'Lee Sung-min', 'Kwak Do-won', 'Lee Hee-joon', 'Kim So-jin', 'Farid-Eric Bernard', 'Jerry Rector', 'Paul Battle', 'Aïmen Derriachi', 'Lee Do-guk']","['Lee Ji-min', 'Min-ho Woo']","Corea está bajo el control absoluto del presidente Park, quien controla la KCIA, la organización con ventaja sobre cualquier rama del gobierno.",114
